Protein id	Contig id	Start	Stop	Strand	Element symbol	Element name	Scope	Type	Subtype	Class	Subclass	Method	Target length	Reference sequence length	% Coverage of reference	% Identity to reference	Alignment length	Closest reference accession	Closest reference name	HMM accession	HMM description
NA	NODE_16_length_140608_cov_37.477699	59535	60716	+	emrD	multidrug efflux MFS transporter EmrD	plus	AMR	AMR	EFFLUX	EFFLUX	BLASTX	394	394	100.00	99.49	394	ACN65732.1	multidrug efflux MFS transporter EmrD	NA	NA
NA	NODE_18_length_134735_cov_36.628007	94082	94981	+	fieF	CDF family cation-efflux transporter FieF	plus	STRESS	METAL	NA	NA	EXACTX	300	300	100.00	100.00	300	BAB89353.1	CDF family cation-efflux transporter FieF	NA	NA
NA	NODE_23_length_89554_cov_30.783461	10945	11373	-	silE	silver-binding protein SilE	plus	STRESS	METAL	SILVER	SILVER	BLASTX	143	143	100.00	95.80	143	AAD11743.1	silver-binding protein SilE	NA	NA
NA	NODE_23_length_89554_cov_30.783461	11630	13099	-	silS	copper/silver sensor histidine kinase SilS	plus	STRESS	METAL	COPPER/SILVER	COPPER/SILVER	BLASTX	490	491	99.80	96.73	490	SPD96882.1	copper/silver sensor histidine kinase SilS	NA	NA
NA	NODE_23_length_89554_cov_30.783461	13095	13772	-	silR	copper/silver response regulator transcription factor SilR	plus	STRESS	METAL	COPPER/SILVER	COPPER/SILVER	BLASTX	226	226	100.00	98.23	226	SPD96883.1	copper/silver response regulator transcription factor SilR	NA	NA
NA	NODE_23_length_89554_cov_30.783461	13962	15344	+	silC	Cu(+)/Ag(+) efflux RND transporter outer membrane channel SilC	plus	STRESS	METAL	COPPER/SILVER	COPPER/SILVER	BLASTX	461	461	100.00	98.92	461	AAD11746.1	Cu(+)/Ag(+) efflux RND transporter outer membrane channel SilC	NA	NA
NA	NODE_23_length_89554_cov_30.783461	15844	17133	+	silB	Cu(+)/Ag(+) efflux RND transporter periplasmic adaptor subunit SilB	plus	STRESS	METAL	COPPER/SILVER	COPPER/SILVER	BLASTX	430	430	100.00	99.30	430	AAD11748.1	Cu(+)/Ag(+) efflux RND transporter periplasmic adaptor subunit SilB	NA	NA
NA	NODE_23_length_89554_cov_30.783461	17147	20290	+	silA	Cu(+)/Ag(+) efflux RND transporter permease subunit SilA	plus	STRESS	METAL	COPPER/SILVER	COPPER/SILVER	BLASTX	1048	1048	100.00	98.85	1048	AAD11749.1	Cu(+)/Ag(+) efflux RND transporter permease subunit SilA	NA	NA
NA	NODE_23_length_89554_cov_30.783461	20918	23386	+	silP	Ag(+)-translocating P-type ATPase SilP	plus	STRESS	METAL	SILVER	SILVER	BLASTX	823	824	100.00	98.42	824	AAD11750.1	Ag(+)-translocating P-type ATPase SilP	NA	NA
NA	NODE_23_length_89554_cov_30.783461	25370	27184	+	pcoA	multicopper oxidase PcoA	plus	STRESS	METAL	COPPER	COPPER	EXACTX	605	605	100.00	100.00	605	CAA58525.1	multicopper oxidase PcoA	NA	NA
NA	NODE_23_length_89554_cov_30.783461	27193	28080	+	pcoB	copper-binding protein PcoB	plus	STRESS	METAL	COPPER	COPPER	EXACTX	296	296	100.00	100.00	296	CAA58526.1	copper-binding protein PcoB	NA	NA
NA	NODE_23_length_89554_cov_30.783461	28123	28500	+	pcoC	copper resistance system metallochaperone PcoC	plus	STRESS	METAL	COPPER	COPPER	EXACTX	126	126	100.00	100.00	126	CAA58527.1	copper resistance system metallochaperone PcoC	NA	NA
NA	NODE_23_length_89554_cov_30.783461	28508	29434	+	pcoD	copper resistance inner membrane protein PcoD	plus	STRESS	METAL	COPPER	COPPER	BLASTX	309	309	100.00	99.68	309	CAA58528.1	copper resistance inner membrane protein PcoD	NA	NA
NA	NODE_23_length_89554_cov_30.783461	29492	30169	+	pcoR	copper response regulator transcription factor PcoR	plus	STRESS	METAL	COPPER	COPPER	EXACTX	226	226	100.00	100.00	226	CAA58529.1	copper response regulator transcription factor PcoR	NA	NA
NA	NODE_23_length_89554_cov_30.783461	30169	31566	+	pcoS	copper resistance membrane spanning protein PcoS	plus	STRESS	METAL	COPPER	COPPER	BLASTX	466	466	100.00	99.36	466	CAA58530.1	copper resistance membrane spanning protein PcoS	NA	NA
NA	NODE_23_length_89554_cov_30.783461	60623	60973	+	arsR	As(III)-sensing metalloregulatory transcriptional repressor ArsR	plus	STRESS	METAL	ARSENIC	ARSENIC	EXACTX	117	117	100.00	100.00	117	AAB09624.1	As(III)-sensing metalloregulatory transcriptional repressor ArsR	NA	NA
NA	NODE_23_length_89554_cov_30.783461	61024	61383	+	arsD	arsenite efflux transporter metallochaperone ArsD	plus	STRESS	METAL	ARSENIC	ARSENITE	BLASTX	120	120	100.00	94.17	120	AAB09625.1	arsenite efflux transporter metallochaperone ArsD	NA	NA
NA	NODE_23_length_89554_cov_30.783461	61404	63152	+	arsA	arsenite efflux transporter ATPase subunit ArsA	plus	STRESS	METAL	ARSENIC	ARSENITE	BLASTX	583	583	100.00	93.83	583	AAB09626.1	arsenite efflux transporter ATPase subunit ArsA	NA	NA
NA	NODE_23_length_89554_cov_30.783461	63203	64489	+	arsB	arsenite efflux transporter membrane subunit ArsB	plus	STRESS	METAL	ARSENIC	ARSENITE	BLASTX	429	429	100.00	98.14	429	BAA24823.1	arsenite efflux transporter membrane subunit ArsB	NA	NA
NA	NODE_23_length_89554_cov_30.783461	64505	64927	+	arsC	glutaredoxin-dependent arsenate reductase	plus	STRESS	METAL	ARSENIC	ARSENATE	BLASTX	141	141	100.00	95.74	141	AAB09628.1	glutaredoxin-dependent arsenate reductase	NA	NA
NA	NODE_25_length_79517_cov_36.907176	65178	65594	-	fosA	FosA5 family fosfomycin resistance glutathione transferase	core	AMR	AMR	FOSFOMYCIN	FOSFOMYCIN	EXACTX	139	139	100.00	100.00	139	WP_004146118.1	FosA5 family fosfomycin resistance glutathione transferase	NA	NA
NA	NODE_28_length_63361_cov_36.547136	8830	10002	+	oqxA	multidrug efflux RND transporter periplasmic adaptor subunit OqxA	core	AMR	AMR	PHENICOL/QUINOLONE	PHENICOL/QUINOLONE	BLASTX	391	391	100.00	99.49	391	WP_002914189.1	multidrug efflux RND transporter periplasmic adaptor subunit OqxA	NA	NA
NA	NODE_28_length_63361_cov_36.547136	10029	13178	+	oqxB	multidrug efflux RND transporter permease subunit OqxB	core	AMR	AMR	PHENICOL/QUINOLONE	PHENICOL/QUINOLONE	BLASTX	1050	1050	100.00	99.71	1050	WP_004149399.1	multidrug efflux RND transporter permease subunit OqxB19	NA	NA
NA	NODE_3_length_370835_cov_34.748924	230953	232029	-	ompK35_E132K	Klebsiella pneumoniae carbapenem resistant OmpK35	core	AMR	POINT	BETA-LACTAM	CARBAPENEM	POINTX	359	359	100.00	99.72	359	WP_004141771.1	outer membrane porin OmpK35	NA	NA
NA	NODE_64_length_627_cov_91.180070	3	626	-	blaSHV	SHV family class A beta-lactamase	core	AMR	AMR	BETA-LACTAM	BETA-LACTAM	PARTIAL_CONTIG_ENDX	208	286	72.73	100.00	208	WP_001620095.1	broad-spectrum class A beta-lactamase SHV-1	NA	NA
NA	NODE_92_length_463_cov_2.112745	3	461	-	mph(A)	Mph(A) family macrolide 2'-phosphotransferase	core	AMR	AMR	MACROLIDE	AZITHROMYCIN/ERYTHROMYCIN/SPIRAMYCIN/TELITHROMYCIN	PARTIAL_CONTIG_ENDX	153	301	50.83	100.00	153	WP_000219391.1	Mph(A) family macrolide 2'-phosphotransferase	NA	NA
NA	NODE_9_length_195567_cov_37.037860	153934	154191	+	fosA7	FosA7 family fosfomycin resistance glutathione transferase	core	AMR	AMR	FOSFOMYCIN	FOSFOMYCIN	PARTIALX	86	140	61.43	91.86	86	WP_023231494.1	fosfomycin resistance glutathione transferase FosA7.3	NA	NA
