Protein id	Contig id	Start	Stop	Strand	Element symbol	Element name	Scope	Type	Subtype	Class	Subclass	Method	Target length	Reference sequence length	% Coverage of reference	% Identity to reference	Alignment length	Closest reference accession	Closest reference name	HMM accession	HMM description
NA	NODE_17_length_125045_cov_28.088895	66294	67466	+	oqxA11	multidrug efflux RND transporter periplasmic adaptor subunit OqxA11	core	AMR	AMR	PHENICOL/QUINOLONE	PHENICOL/QUINOLONE	ALLELEX	391	391	100.00	100.00	391	WP_004212918.1	multidrug efflux RND transporter periplasmic adaptor subunit OqxA11	NA	NA
NA	NODE_17_length_125045_cov_28.088895	67493	70642	+	oqxB19	multidrug efflux RND transporter permease subunit OqxB19	core	AMR	AMR	PHENICOL/QUINOLONE	PHENICOL/QUINOLONE	ALLELEX	1050	1050	100.00	100.00	1050	WP_004149399.1	multidrug efflux RND transporter permease subunit OqxB19	NA	NA
NA	NODE_1_length_499133_cov_33.177642	418058	419239	+	emrD	multidrug efflux MFS transporter EmrD	plus	AMR	AMR	EFFLUX	EFFLUX	BLASTX	394	394	100.00	99.24	394	ACN65732.1	multidrug efflux MFS transporter EmrD	NA	NA
NA	NODE_20_length_99248_cov_32.196778	39737	40636	-	fieF	CDF family cation-efflux transporter FieF	plus	STRESS	METAL	NA	NA	EXACTX	300	300	100.00	100.00	300	BAB89353.1	CDF family cation-efflux transporter FieF	NA	NA
NA	NODE_22_length_87886_cov_30.634104	64837	65253	-	fosA	FosA5 family fosfomycin resistance glutathione transferase	core	AMR	AMR	FOSFOMYCIN	FOSFOMYCIN	EXACTX	139	139	100.00	100.00	139	WP_009486251.1	FosA5 family fosfomycin resistance glutathione transferase	NA	NA
NA	NODE_3_length_459779_cov_23.384009	390806	391663	+	blaSHV-27	broad-spectrum class A beta-lactamase SHV-27	core	AMR	AMR	BETA-LACTAM	BETA-LACTAM	ALLELEX	286	286	100.00	100.00	286	WP_023282555.1	broad-spectrum class A beta-lactamase SHV-27	NA	NA
