Protein id	Contig id	Start	Stop	Strand	Element symbol	Element name	Scope	Type	Subtype	Class	Subclass	Method	Target length	Reference sequence length	% Coverage of reference	% Identity to reference	Alignment length	Closest reference accession	Closest reference name	HMM accession	HMM description
NA	NODE_12_length_118860_cov_46.665561	8344	9201	-	blaSHV-26	broad-spectrum class A beta-lactamase SHV-26	core	AMR	AMR	BETA-LACTAM	BETA-LACTAM	ALLELEX	286	286	100.00	100.00	286	WP_023280043.1	broad-spectrum class A beta-lactamase SHV-26	NA	NA
NA	NODE_18_length_99404_cov_64.716142	58756	59655	+	fieF	CDF family cation-efflux transporter FieF	plus	STRESS	METAL	NA	NA	EXACTX	300	300	100.00	100.00	300	BAB89353.1	CDF family cation-efflux transporter FieF	NA	NA
NA	NODE_24_length_86323_cov_63.153278	13836	14252	+	fosA	FosA5 family fosfomycin resistance glutathione transferase	core	AMR	AMR	FOSFOMYCIN	FOSFOMYCIN	BLASTX	139	139	100.00	99.28	139	WP_012579083.1	fosfomycin resistance glutathione transferase FosA5	NA	NA
NA	NODE_25_length_84671_cov_55.679552	26274	29423	-	oqxB19	multidrug efflux RND transporter permease subunit OqxB19	core	AMR	AMR	PHENICOL/QUINOLONE	PHENICOL/QUINOLONE	ALLELEX	1050	1050	100.00	100.00	1050	WP_004149399.1	multidrug efflux RND transporter permease subunit OqxB19	NA	NA
NA	NODE_25_length_84671_cov_55.679552	29450	30622	-	oqxA10	multidrug efflux RND transporter periplasmic adaptor subunit OqxA10	core	AMR	AMR	PHENICOL/QUINOLONE	PHENICOL/QUINOLONE	ALLELEX	391	391	100.00	100.00	391	WP_004149398.1	multidrug efflux RND transporter periplasmic adaptor subunit OqxA10	NA	NA
NA	NODE_3_length_279117_cov_65.753746	79897	81078	-	emrD	multidrug efflux MFS transporter EmrD	plus	AMR	AMR	EFFLUX	EFFLUX	BLASTX	394	394	100.00	99.49	394	ACN65732.1	multidrug efflux MFS transporter EmrD	NA	NA
NA	NODE_54_length_23212_cov_49.456406	1772	2200	-	silE	silver-binding protein SilE	plus	STRESS	METAL	SILVER	SILVER	BLASTX	143	143	100.00	96.50	143	AAD11743.1	silver-binding protein SilE	NA	NA
NA	NODE_54_length_23212_cov_49.456406	2454	3926	-	silS	copper/silver sensor histidine kinase SilS	plus	STRESS	METAL	COPPER/SILVER	COPPER/SILVER	EXACTX	491	491	100.00	100.00	491	SPD96882.1	copper/silver sensor histidine kinase SilS	NA	NA
NA	NODE_54_length_23212_cov_49.456406	3922	4599	-	silR	copper/silver response regulator transcription factor SilR	plus	STRESS	METAL	COPPER/SILVER	COPPER/SILVER	EXACTX	226	226	100.00	100.00	226	SPD96883.1	copper/silver response regulator transcription factor SilR	NA	NA
NA	NODE_54_length_23212_cov_49.456406	4789	6171	+	silC	Cu(+)/Ag(+) efflux RND transporter outer membrane channel SilC	plus	STRESS	METAL	COPPER/SILVER	COPPER/SILVER	EXACTX	461	461	100.00	100.00	461	SPD96884.1	Cu(+)/Ag(+) efflux RND transporter outer membrane channel SilC	NA	NA
NA	NODE_54_length_23212_cov_49.456406	6203	6553	+	silF	Cu(+)/Ag(+) efflux RND transporter periplasmic metallochaperone SilF	plus	STRESS	METAL	COPPER/SILVER	COPPER/SILVER	BLASTX	117	117	100.00	99.15	117	KGL71342.1	Cu(+)/Ag(+) efflux RND transporter periplasmic metallochaperone SilF	NA	NA
NA	NODE_54_length_23212_cov_49.456406	6670	7959	+	silB	Cu(+)/Ag(+) efflux RND transporter periplasmic adaptor subunit SilB	plus	STRESS	METAL	COPPER/SILVER	COPPER/SILVER	BLASTX	430	430	100.00	97.67	430	AAD11748.1	Cu(+)/Ag(+) efflux RND transporter periplasmic adaptor subunit SilB	NA	NA
NA	NODE_54_length_23212_cov_49.456406	7973	11116	+	silA	Cu(+)/Ag(+) efflux RND transporter permease subunit SilA	plus	STRESS	METAL	COPPER/SILVER	COPPER/SILVER	BLASTX	1048	1048	100.00	98.85	1048	AAD11749.1	Cu(+)/Ag(+) efflux RND transporter permease subunit SilA	NA	NA
NA	NODE_54_length_23212_cov_49.456406	11752	14217	+	silP	Ag(+)-translocating P-type ATPase SilP	plus	STRESS	METAL	SILVER	SILVER	BLASTX	822	824	99.64	94.41	823	AAD11750.1	Ag(+)-translocating P-type ATPase SilP	NA	NA
NA	NODE_54_length_23212_cov_49.456406	16201	18015	+	pcoA	multicopper oxidase PcoA	plus	STRESS	METAL	COPPER	COPPER	EXACTX	605	605	100.00	100.00	605	CAA58525.1	multicopper oxidase PcoA	NA	NA
NA	NODE_54_length_23212_cov_49.456406	18024	18911	+	pcoB	copper-binding protein PcoB	plus	STRESS	METAL	COPPER	COPPER	BLASTX	296	296	100.00	99.66	296	CAA58526.1	copper-binding protein PcoB	NA	NA
NA	NODE_54_length_23212_cov_49.456406	18954	19331	+	pcoC	copper resistance system metallochaperone PcoC	plus	STRESS	METAL	COPPER	COPPER	EXACTX	126	126	100.00	100.00	126	CAA58527.1	copper resistance system metallochaperone PcoC	NA	NA
NA	NODE_54_length_23212_cov_49.456406	19339	20265	+	pcoD	copper resistance inner membrane protein PcoD	plus	STRESS	METAL	COPPER	COPPER	BLASTX	309	309	100.00	99.35	309	CAA58528.1	copper resistance inner membrane protein PcoD	NA	NA
NA	NODE_54_length_23212_cov_49.456406	20323	21000	+	pcoR	copper response regulator transcription factor PcoR	plus	STRESS	METAL	COPPER	COPPER	EXACTX	226	226	100.00	100.00	226	CAA58529.1	copper response regulator transcription factor PcoR	NA	NA
NA	NODE_54_length_23212_cov_49.456406	21000	22397	+	pcoS	copper resistance membrane spanning protein PcoS	plus	STRESS	METAL	COPPER	COPPER	BLASTX	466	466	100.00	99.14	466	CAA58530.1	copper resistance membrane spanning protein PcoS	NA	NA
NA	NODE_55_length_22623_cov_54.320409	7178	7669	-	psi-GI	heat resistance protein PsiE-GI	plus	STRESS	HEAT	NA	NA	BLASTX	164	165	99.39	95.73	164	APX31178.1	heat resistance protein PsiE-GI	NA	NA
NA	NODE_55_length_22623_cov_54.320409	7669	9381	-	kefB-GI	heat resistance system K+/H+ antiporter KefB-GI	plus	STRESS	HEAT	NA	NA	BLASTX	571	571	100.00	98.07	571	APX31177.1	heat resistance system K+/H+ antiporter KefB-GI	NA	NA
NA	NODE_55_length_22623_cov_54.320409	9388	9825	-	trxLHR	heat resistance system thioredoxin Trx-GI	plus	STRESS	HEAT	NA	NA	BLASTX	146	146	100.00	98.63	146	APX31176.1	heat resistance system thioredoxin Trx-GI	NA	NA
NA	NODE_55_length_22623_cov_54.320409	11043	11651	-	hdeD-GI	heat resistance membrane protein HdeD-GI	plus	STRESS	HEAT	NA	NA	BLASTX	203	203	100.00	98.03	203	APX31174.1	heat resistance membrane protein HdeD-GI	NA	NA
NA	NODE_55_length_22623_cov_54.320409	11744	12628	-	yfdX2	heat resistance protein YfdX2	plus	STRESS	HEAT	NA	NA	BLASTX	295	295	100.00	97.63	295	ASF80766.1	heat resistance protein YfdX2	NA	NA
NA	NODE_55_length_22623_cov_54.320409	12734	13645	-	yfdX1	heat resistance protein YfdX1	plus	STRESS	HEAT	NA	NA	BLASTX	304	304	100.00	98.36	304	APX31172.1	heat resistance protein YfdX1	NA	NA
NA	NODE_55_length_22623_cov_54.320409	13671	14126	-	shsP	small heat shock protein sHSP20-GI	plus	STRESS	HEAT	NA	NA	INTERNAL_STOP	152	152	100.00	98.03	152	ASF80771.1	small heat shock protein sHSP20-GI	NA	NA
NA	NODE_55_length_22623_cov_54.320409	15295	18141	-	clpK	heat shock survival AAA family ATPase ClpK	plus	STRESS	HEAT	NA	NA	BLASTX	949	949	100.00	98.74	949	ASF80763.1	heat shock survival AAA family ATPase ClpK	NA	NA
NA	NODE_55_length_22623_cov_54.320409	18250	18816	-	hsp20	small heat shock protein sHSP20	plus	STRESS	HEAT	NA	NA	BLASTX	189	189	100.00	99.47	189	CDY80020.1	small heat shock protein sHSP20	NA	NA
NA	NODE_57_length_18922_cov_53.698309	4286	4633	+	arsR	As(III)-sensing metalloregulatory transcriptional repressor ArsR	plus	STRESS	METAL	ARSENIC	ARSENIC	BLASTX	116	116	100.00	98.28	116	AET17094.1	As(III)-sensing metalloregulatory transcriptional repressor ArsR	NA	NA
NA	NODE_57_length_18922_cov_53.698309	4688	5047	+	arsD	arsenite efflux transporter metallochaperone ArsD	plus	STRESS	METAL	ARSENIC	ARSENITE	BLASTX	120	120	100.00	90.83	120	AAB09625.1	arsenite efflux transporter metallochaperone ArsD	NA	NA
NA	NODE_57_length_18922_cov_53.698309	5068	6816	+	arsA	arsenite efflux transporter ATPase subunit ArsA	plus	STRESS	METAL	ARSENIC	ARSENITE	BLASTX	583	583	100.00	98.63	583	BAA24822.1	arsenite efflux transporter ATPase subunit ArsA	NA	NA
NA	NODE_57_length_18922_cov_53.698309	6867	8153	+	arsB	arsenite efflux transporter membrane subunit ArsB	plus	STRESS	METAL	ARSENIC	ARSENITE	BLASTX	429	429	100.00	98.83	429	BAA24823.1	arsenite efflux transporter membrane subunit ArsB	NA	NA
NA	NODE_57_length_18922_cov_53.698309	8169	8591	+	arsC	glutaredoxin-dependent arsenate reductase	plus	STRESS	METAL	ARSENIC	ARSENATE	BLASTX	141	141	100.00	99.29	141	BAA24824.1	glutaredoxin-dependent arsenate reductase	NA	NA
NA	NODE_60_length_12951_cov_51.601892	1741	2160	-	ncrY	nickel resistance OB fold protein NcrY	plus	STRESS	METAL	NICKEL	NICKEL	EXACTX	140	140	100.00	100.00	140	ABF61437.1	nickel resistance OB fold protein NcrY	NA	NA
NA	NODE_60_length_12951_cov_51.601892	2325	3452	-	ncrC	Ni(II)/Co(II) efflux transporter permease subunit NcrC	plus	STRESS	METAL	COPPER/NICKEL	COPPER/NICKEL	EXACTX	376	376	100.00	100.00	376	ADF64798.1	Ni(II)/Co(II) efflux transporter permease subunit NcrC	NA	NA
NA	NODE_60_length_12951_cov_51.601892	3468	3734	-	ncrB	nickel-sensing transcriptional repressor NcrB	plus	STRESS	METAL	NICKEL	NICKEL	EXACTX	89	89	100.00	100.00	89	ABF61435.1	nickel-sensing transcriptional repressor NcrB	NA	NA
NA	NODE_60_length_12951_cov_51.601892	3843	5138	-	ncrA	Metal Resistance	plus	STRESS	METAL	NICKEL	NICKEL	EXACTX	432	432	100.00	100.00	432	ABF61434.1	Metal Resistance	NA	NA
NA	NODE_63_length_11848_cov_29.218859	118	543	-	merR	mercury resistance transcriptional regulator MerR	plus	STRESS	METAL	MERCURY	MERCURY	BLASTX	142	144	98.61	92.96	142	CAA77320.1	mercury resistance transcriptional regulator MerR	NA	NA
NA	NODE_63_length_11848_cov_29.218859	633	977	+	merT	mercuric transport protein MerT	plus	STRESS	METAL	MERCURY	MERCURY	BLASTX	115	116	99.14	99.13	115	CAA70196.1	mercuric transport protein MerT	NA	NA
NA	NODE_63_length_11848_cov_29.218859	1763	3445	+	merA	mercury(II) reductase	plus	STRESS	METAL	MERCURY	MERCURY	BLASTX	561	561	100.00	93.23	561	ACU65296.1	mercury(II) reductase	NA	NA
NA	NODE_63_length_11848_cov_29.218859	3466	3828	+	merD	mercury resistance co-regulator MerD	plus	STRESS	METAL	MERCURY	MERCURY	BLASTX	121	121	100.00	90.08	121	AAC38221.1	mercury resistance co-regulator MerD	NA	NA
NA	NODE_63_length_11848_cov_29.218859	3828	4061	+	merE	broad-spectrum mercury transporter MerE	plus	STRESS	METAL	MERCURY	MERCURY	BLASTX	78	78	100.00	96.15	78	AAC38236.1	broad-spectrum mercury transporter MerE	NA	NA
NA	NODE_691_length_261_cov_0.927184	2	259	-	arsC	glutaredoxin-dependent arsenate reductase	plus	STRESS	METAL	ARSENIC	ARSENATE	PARTIAL_CONTIG_ENDX	86	141	60.99	96.51	86	AAB09628.1	glutaredoxin-dependent arsenate reductase	NA	NA
