Protein id	Contig id	Start	Stop	Strand	Element symbol	Element name	Scope	Type	Subtype	Class	Subclass	Method	Target length	Reference sequence length	% Coverage of reference	% Identity to reference	Alignment length	Closest reference accession	Closest reference name	HMM accession	HMM description
NA	NODE_19_length_101176_cov_58.694158	79806	80987	-	emrD	multidrug efflux MFS transporter EmrD	plus	AMR	AMR	EFFLUX	EFFLUX	BLASTX	394	394	100.00	99.49	394	ACN65732.1	multidrug efflux MFS transporter EmrD	NA	NA
NA	NODE_24_length_91916_cov_57.573889	79393	80250	+	blaSHV-1	broad-spectrum class A beta-lactamase SHV-1	core	AMR	AMR	BETA-LACTAM	BETA-LACTAM	ALLELEX	286	286	100.00	100.00	286	WP_001620095.1	broad-spectrum class A beta-lactamase SHV-1	NA	NA
NA	NODE_26_length_88836_cov_58.485126	65712	66128	-	fosA	FosA5 family fosfomycin resistance glutathione transferase	core	AMR	AMR	FOSFOMYCIN	FOSFOMYCIN	BLASTX	139	139	100.00	97.84	139	WP_004146118.1	FosA5 family fosfomycin resistance glutathione transferase	NA	NA
NA	NODE_32_length_69161_cov_57.476210	18140	21289	-	oqxB19	multidrug efflux RND transporter permease subunit OqxB19	core	AMR	AMR	PHENICOL/QUINOLONE	PHENICOL/QUINOLONE	ALLELEX	1050	1050	100.00	100.00	1050	WP_004149399.1	multidrug efflux RND transporter permease subunit OqxB19	NA	NA
NA	NODE_32_length_69161_cov_57.476210	21316	22488	-	oqxA	multidrug efflux RND transporter periplasmic adaptor subunit OqxA	core	AMR	AMR	PHENICOL/QUINOLONE	PHENICOL/QUINOLONE	EXACTX	391	391	100.00	100.00	391	WP_002914189.1	multidrug efflux RND transporter periplasmic adaptor subunit OqxA	NA	NA
NA	NODE_39_length_55844_cov_56.699887	15197	16096	+	fieF	CDF family cation-efflux transporter FieF	plus	STRESS	METAL	NA	NA	EXACTX	300	300	100.00	100.00	300	BAB89353.1	CDF family cation-efflux transporter FieF	NA	NA
NA	NODE_52_length_29923_cov_35.825231	3554	3982	-	silE	silver-binding protein SilE	plus	STRESS	METAL	SILVER	SILVER	BLASTX	143	143	100.00	97.20	143	AAD11743.1	silver-binding protein SilE	NA	NA
NA	NODE_52_length_29923_cov_35.825231	4236	5708	-	silS	copper/silver sensor histidine kinase SilS	plus	STRESS	METAL	COPPER/SILVER	COPPER/SILVER	EXACTX	491	491	100.00	100.00	491	SPD96882.1	copper/silver sensor histidine kinase SilS	NA	NA
NA	NODE_52_length_29923_cov_35.825231	5704	6381	-	silR	copper/silver response regulator transcription factor SilR	plus	STRESS	METAL	COPPER/SILVER	COPPER/SILVER	EXACTX	226	226	100.00	100.00	226	SPD96883.1	copper/silver response regulator transcription factor SilR	NA	NA
NA	NODE_52_length_29923_cov_35.825231	6571	7953	+	silC	Cu(+)/Ag(+) efflux RND transporter outer membrane channel SilC	plus	STRESS	METAL	COPPER/SILVER	COPPER/SILVER	EXACTX	461	461	100.00	100.00	461	SPD96884.1	Cu(+)/Ag(+) efflux RND transporter outer membrane channel SilC	NA	NA
NA	NODE_52_length_29923_cov_35.825231	7985	8344	+	silF	Cu(+)/Ag(+) efflux RND transporter periplasmic metallochaperone SilF	plus	STRESS	METAL	COPPER/SILVER	COPPER/SILVER	BLASTX	120	117	100.00	94.17	120	KGL71342.1	Cu(+)/Ag(+) efflux RND transporter periplasmic metallochaperone SilF	NA	NA
NA	NODE_52_length_29923_cov_35.825231	8461	9750	+	silB	Cu(+)/Ag(+) efflux RND transporter periplasmic adaptor subunit SilB	plus	STRESS	METAL	COPPER/SILVER	COPPER/SILVER	BLASTX	430	430	100.00	97.91	430	AAD11748.1	Cu(+)/Ag(+) efflux RND transporter periplasmic adaptor subunit SilB	NA	NA
NA	NODE_52_length_29923_cov_35.825231	9764	12907	+	silA	Cu(+)/Ag(+) efflux RND transporter permease subunit SilA	plus	STRESS	METAL	COPPER/SILVER	COPPER/SILVER	BLASTX	1048	1048	100.00	98.95	1048	AAD11749.1	Cu(+)/Ag(+) efflux RND transporter permease subunit SilA	NA	NA
NA	NODE_52_length_29923_cov_35.825231	13543	16008	+	silP	Ag(+)-translocating P-type ATPase SilP	plus	STRESS	METAL	SILVER	SILVER	BLASTX	822	824	99.64	95.26	823	AAD11750.1	Ag(+)-translocating P-type ATPase SilP	NA	NA
NA	NODE_52_length_29923_cov_35.825231	17992	19806	+	pcoA	multicopper oxidase PcoA	plus	STRESS	METAL	COPPER	COPPER	EXACTX	605	605	100.00	100.00	605	CAA58525.1	multicopper oxidase PcoA	NA	NA
NA	NODE_52_length_29923_cov_35.825231	19815	20702	+	pcoB	copper-binding protein PcoB	plus	STRESS	METAL	COPPER	COPPER	EXACTX	296	296	100.00	100.00	296	CAA58526.1	copper-binding protein PcoB	NA	NA
NA	NODE_52_length_29923_cov_35.825231	20745	21122	+	pcoC	copper resistance system metallochaperone PcoC	plus	STRESS	METAL	COPPER	COPPER	EXACTX	126	126	100.00	100.00	126	CAA58527.1	copper resistance system metallochaperone PcoC	NA	NA
NA	NODE_52_length_29923_cov_35.825231	21130	22056	+	pcoD	copper resistance inner membrane protein PcoD	plus	STRESS	METAL	COPPER	COPPER	BLASTX	309	309	100.00	99.35	309	CAA58528.1	copper resistance inner membrane protein PcoD	NA	NA
NA	NODE_52_length_29923_cov_35.825231	22114	22791	+	pcoR	copper response regulator transcription factor PcoR	plus	STRESS	METAL	COPPER	COPPER	EXACTX	226	226	100.00	100.00	226	CAA58529.1	copper response regulator transcription factor PcoR	NA	NA
NA	NODE_52_length_29923_cov_35.825231	22791	24188	+	pcoS	copper resistance membrane spanning protein PcoS	plus	STRESS	METAL	COPPER	COPPER	BLASTX	466	466	100.00	98.93	466	CAA58530.1	copper resistance membrane spanning protein PcoS	NA	NA
NA	NODE_56_length_23471_cov_40.947344	954	1520	+	hsp20	small heat shock protein sHSP20	plus	STRESS	HEAT	NA	NA	BLASTX	189	189	100.00	99.47	189	CDY80020.1	small heat shock protein sHSP20	NA	NA
NA	NODE_56_length_23471_cov_40.947344	1629	4475	+	clpK	heat shock survival AAA family ATPase ClpK	plus	STRESS	HEAT	NA	NA	BLASTX	949	949	100.00	98.74	949	ASF80763.1	heat shock survival AAA family ATPase ClpK	NA	NA
NA	NODE_56_length_23471_cov_40.947344	5624	6079	+	shsP	small heat shock protein sHSP20-GI	plus	STRESS	HEAT	NA	NA	BLASTX	152	152	100.00	99.34	152	ASF80771.1	small heat shock protein sHSP20-GI	NA	NA
NA	NODE_56_length_23471_cov_40.947344	6105	7016	+	yfdX1	heat resistance protein YfdX1	plus	STRESS	HEAT	NA	NA	BLASTX	304	304	100.00	99.34	304	APX31172.1	heat resistance protein YfdX1	NA	NA
NA	NODE_56_length_23471_cov_40.947344	7122	8006	+	yfdX2	heat resistance protein YfdX2	plus	STRESS	HEAT	NA	NA	BLASTX	295	295	100.00	98.98	295	ASF80766.1	heat resistance protein YfdX2	NA	NA
NA	NODE_56_length_23471_cov_40.947344	8099	8707	+	hdeD-GI	heat resistance membrane protein HdeD-GI	plus	STRESS	HEAT	NA	NA	BLASTX	203	203	100.00	96.06	203	APX31174.1	heat resistance membrane protein HdeD-GI	NA	NA
NA	NODE_56_length_23471_cov_40.947344	9924	10361	+	trxLHR	heat resistance system thioredoxin Trx-GI	plus	STRESS	HEAT	NA	NA	BLASTX	146	146	100.00	98.63	146	APX31176.1	heat resistance system thioredoxin Trx-GI	NA	NA
NA	NODE_56_length_23471_cov_40.947344	10368	12080	+	kefB-GI	heat resistance system K+/H+ antiporter KefB-GI	plus	STRESS	HEAT	NA	NA	INTERNAL_STOP	571	571	100.00	98.95	571	APX31177.1	heat resistance system K+/H+ antiporter KefB-GI	NA	NA
NA	NODE_56_length_23471_cov_40.947344	12080	12571	+	psi-GI	heat resistance protein PsiE-GI	plus	STRESS	HEAT	NA	NA	BLASTX	164	165	99.39	96.34	164	APX31178.1	heat resistance protein PsiE-GI	NA	NA
NA	NODE_68_length_12915_cov_50.017341	1703	2122	-	ncrY	nickel resistance OB fold protein NcrY	plus	STRESS	METAL	NICKEL	NICKEL	EXACTX	140	140	100.00	100.00	140	ABF61437.1	nickel resistance OB fold protein NcrY	NA	NA
NA	NODE_68_length_12915_cov_50.017341	2287	3414	-	ncrC	Ni(II)/Co(II) efflux transporter permease subunit NcrC	plus	STRESS	METAL	COPPER/NICKEL	COPPER/NICKEL	EXACTX	376	376	100.00	100.00	376	ADF64798.1	Ni(II)/Co(II) efflux transporter permease subunit NcrC	NA	NA
NA	NODE_68_length_12915_cov_50.017341	3430	3696	-	ncrB	nickel-sensing transcriptional repressor NcrB	plus	STRESS	METAL	NICKEL	NICKEL	EXACTX	89	89	100.00	100.00	89	ABF61435.1	nickel-sensing transcriptional repressor NcrB	NA	NA
NA	NODE_68_length_12915_cov_50.017341	3805	5100	-	ncrA	Metal Resistance	plus	STRESS	METAL	NICKEL	NICKEL	EXACTX	432	432	100.00	100.00	432	ABF61434.1	Metal Resistance	NA	NA
NA	NODE_73_length_10259_cov_49.347805	2763	2984	-	fosA7	FosA7 family fosfomycin resistance glutathione transferase	core	AMR	AMR	FOSFOMYCIN	FOSFOMYCIN	PARTIALX	74	140	52.86	95.95	74	WP_000941934.1	fosfomycin resistance glutathione transferase FosA7	NA	NA
NA	NODE_8_length_142887_cov_57.358323	37483	38130	-	acrR_M109I	Klebsiella pneumoniae tigecycline resistant AcrR	core	AMR	POINT	TETRACYCLINE	TIGECYCLINE	POINTX	216	216	100.00	99.54	216	WP_002892080.1	transcriptional regulator AcrR	NA	NA
