Protein id	Contig id	Start	Stop	Strand	Element symbol	Element name	Scope	Type	Subtype	Class	Subclass	Method	Target length	Reference sequence length	% Coverage of reference	% Identity to reference	Alignment length	Closest reference accession	Closest reference name	HMM accession	HMM description
NA	NODE_17_length_109272_cov_61.596198	58752	59651	+	fieF	CDF family cation-efflux transporter FieF	plus	STRESS	METAL	NA	NA	EXACTX	300	300	100.00	100.00	300	BAB89353.1	CDF family cation-efflux transporter FieF	NA	NA
NA	NODE_19_length_96751_cov_61.239338	50181	53330	-	oqxB19	multidrug efflux RND transporter permease subunit OqxB19	core	AMR	AMR	PHENICOL/QUINOLONE	PHENICOL/QUINOLONE	ALLELEX	1050	1050	100.00	100.00	1050	WP_004149399.1	multidrug efflux RND transporter permease subunit OqxB19	NA	NA
NA	NODE_19_length_96751_cov_61.239338	53357	54529	-	oqxA	multidrug efflux RND transporter periplasmic adaptor subunit OqxA	core	AMR	AMR	PHENICOL/QUINOLONE	PHENICOL/QUINOLONE	EXACTX	391	391	100.00	100.00	391	WP_002914189.1	multidrug efflux RND transporter periplasmic adaptor subunit OqxA	NA	NA
NA	NODE_1_length_606865_cov_53.219556	208259	209116	+	blaSHV-27	broad-spectrum class A beta-lactamase SHV-27	core	AMR	AMR	BETA-LACTAM	BETA-LACTAM	ALLELEX	286	286	100.00	100.00	286	WP_023282555.1	broad-spectrum class A beta-lactamase SHV-27	NA	NA
NA	NODE_22_length_84294_cov_63.785895	13837	14253	+	fosA	FosA5 family fosfomycin resistance glutathione transferase	core	AMR	AMR	FOSFOMYCIN	FOSFOMYCIN	BLASTX	139	139	100.00	99.28	139	WP_004146118.1	FosA5 family fosfomycin resistance glutathione transferase	NA	NA
NA	NODE_2_length_501247_cov_66.097867	420171	421352	+	emrD	multidrug efflux MFS transporter EmrD	plus	AMR	AMR	EFFLUX	EFFLUX	BLASTX	394	394	100.00	99.24	394	ACN65732.1	multidrug efflux MFS transporter EmrD	NA	NA
NA	NODE_34_length_24662_cov_22.905880	3184	3612	-	silE	silver-binding protein SilE	plus	STRESS	METAL	SILVER	SILVER	BLASTX	143	143	100.00	97.20	143	AAD11743.1	silver-binding protein SilE	NA	NA
NA	NODE_34_length_24662_cov_22.905880	3866	5338	-	silS	copper/silver sensor histidine kinase SilS	plus	STRESS	METAL	COPPER/SILVER	COPPER/SILVER	BLASTX	491	491	100.00	98.98	491	SPD96882.1	copper/silver sensor histidine kinase SilS	NA	NA
NA	NODE_34_length_24662_cov_22.905880	5334	6011	-	silR	copper/silver response regulator transcription factor SilR	plus	STRESS	METAL	COPPER/SILVER	COPPER/SILVER	BLASTX	226	226	100.00	98.23	226	SPD96883.1	copper/silver response regulator transcription factor SilR	NA	NA
NA	NODE_34_length_24662_cov_22.905880	6201	7583	+	silC	Cu(+)/Ag(+) efflux RND transporter outer membrane channel SilC	plus	STRESS	METAL	COPPER/SILVER	COPPER/SILVER	BLASTX	461	461	100.00	98.26	461	SPD96884.1	Cu(+)/Ag(+) efflux RND transporter outer membrane channel SilC	NA	NA
NA	NODE_34_length_24662_cov_22.905880	7615	7965	+	silF	Cu(+)/Ag(+) efflux RND transporter periplasmic metallochaperone SilF	plus	STRESS	METAL	COPPER/SILVER	COPPER/SILVER	BLASTX	117	117	100.00	99.15	117	KGL71342.1	Cu(+)/Ag(+) efflux RND transporter periplasmic metallochaperone SilF	NA	NA
NA	NODE_34_length_24662_cov_22.905880	8082	9371	+	silB	Cu(+)/Ag(+) efflux RND transporter periplasmic adaptor subunit SilB	plus	STRESS	METAL	COPPER/SILVER	COPPER/SILVER	BLASTX	430	430	100.00	97.91	430	AAD11748.1	Cu(+)/Ag(+) efflux RND transporter periplasmic adaptor subunit SilB	NA	NA
NA	NODE_34_length_24662_cov_22.905880	9385	12528	+	silA	Cu(+)/Ag(+) efflux RND transporter permease subunit SilA	plus	STRESS	METAL	COPPER/SILVER	COPPER/SILVER	BLASTX	1048	1048	100.00	98.85	1048	AAD11749.1	Cu(+)/Ag(+) efflux RND transporter permease subunit SilA	NA	NA
NA	NODE_34_length_24662_cov_22.905880	13164	15629	+	silP	Ag(+)-translocating P-type ATPase SilP	plus	STRESS	METAL	SILVER	SILVER	BLASTX	822	824	99.64	94.65	823	AAD11750.1	Ag(+)-translocating P-type ATPase SilP	NA	NA
NA	NODE_34_length_24662_cov_22.905880	17613	19427	+	pcoA	multicopper oxidase PcoA	plus	STRESS	METAL	COPPER	COPPER	EXACTX	605	605	100.00	100.00	605	CAA58525.1	multicopper oxidase PcoA	NA	NA
NA	NODE_34_length_24662_cov_22.905880	19436	20323	+	pcoB	copper-binding protein PcoB	plus	STRESS	METAL	COPPER	COPPER	BLASTX	296	296	100.00	99.66	296	CAA58526.1	copper-binding protein PcoB	NA	NA
NA	NODE_34_length_24662_cov_22.905880	20366	20743	+	pcoC	copper resistance system metallochaperone PcoC	plus	STRESS	METAL	COPPER	COPPER	EXACTX	126	126	100.00	100.00	126	CAA58527.1	copper resistance system metallochaperone PcoC	NA	NA
NA	NODE_34_length_24662_cov_22.905880	20751	21677	+	pcoD	copper resistance inner membrane protein PcoD	plus	STRESS	METAL	COPPER	COPPER	BLASTX	309	309	100.00	99.68	309	CAA58528.1	copper resistance inner membrane protein PcoD	NA	NA
NA	NODE_34_length_24662_cov_22.905880	21735	22412	+	pcoR	copper response regulator transcription factor PcoR	plus	STRESS	METAL	COPPER	COPPER	EXACTX	226	226	100.00	100.00	226	CAA58529.1	copper response regulator transcription factor PcoR	NA	NA
NA	NODE_34_length_24662_cov_22.905880	22412	23809	+	pcoS	copper resistance membrane spanning protein PcoS	plus	STRESS	METAL	COPPER	COPPER	BLASTX	466	466	100.00	99.36	466	CAA58530.1	copper resistance membrane spanning protein PcoS	NA	NA
NA	NODE_36_length_18797_cov_19.926635	12686	13036	+	arsR	As(III)-sensing metalloregulatory transcriptional repressor ArsR	plus	STRESS	METAL	ARSENIC	ARSENIC	EXACTX	117	117	100.00	100.00	117	AAB09624.1	As(III)-sensing metalloregulatory transcriptional repressor ArsR	NA	NA
NA	NODE_36_length_18797_cov_19.926635	13087	13446	+	arsD	arsenite efflux transporter metallochaperone ArsD	plus	STRESS	METAL	ARSENIC	ARSENITE	BLASTX	120	120	100.00	94.17	120	AAB09625.1	arsenite efflux transporter metallochaperone ArsD	NA	NA
NA	NODE_36_length_18797_cov_19.926635	13467	15215	+	arsA	arsenite efflux transporter ATPase subunit ArsA	plus	STRESS	METAL	ARSENIC	ARSENITE	BLASTX	583	583	100.00	94.00	583	AAB09626.1	arsenite efflux transporter ATPase subunit ArsA	NA	NA
NA	NODE_36_length_18797_cov_19.926635	15266	16552	+	arsB	arsenite efflux transporter membrane subunit ArsB	plus	STRESS	METAL	ARSENIC	ARSENITE	INTERNAL_STOP	429	429	100.00	97.67	429	BAA24823.1	arsenite efflux transporter membrane subunit ArsB	NA	NA
NA	NODE_36_length_18797_cov_19.926635	16568	16990	+	arsC	glutaredoxin-dependent arsenate reductase	plus	STRESS	METAL	ARSENIC	ARSENATE	BLASTX	141	141	100.00	96.45	141	AAB09628.1	glutaredoxin-dependent arsenate reductase	NA	NA
NA	NODE_38_length_13952_cov_22.140030	2506	5292	-	clpK	heat shock survival AAA family ATPase ClpK	plus	STRESS	HEAT	NA	NA	BLASTX	929	949	97.89	99.25	929	ASF80763.1	heat shock survival AAA family ATPase ClpK	NA	NA
NA	NODE_38_length_13952_cov_22.140030	5401	5967	-	hsp20	small heat shock protein sHSP20	plus	STRESS	HEAT	NA	NA	EXACTX	189	189	100.00	100.00	189	CDY80020.1	small heat shock protein sHSP20	NA	NA
NA	NODE_39_length_13857_cov_22.529416	3865	4677	-	sul2	sulfonamide-resistant dihydropteroate synthase Sul2	core	AMR	AMR	SULFONAMIDE	SULFONAMIDE	EXACTX	271	271	100.00	100.00	271	WP_001043260.1	sulfonamide-resistant dihydropteroate synthase Sul2	NA	NA
NA	NODE_45_length_5168_cov_25.151574	1595	2065	+	dfrA17	trimethoprim-resistant dihydrofolate reductase DfrA17	core	AMR	AMR	TRIMETHOPRIM	TRIMETHOPRIM	EXACTX	157	157	100.00	100.00	157	WP_001389366.1	trimethoprim-resistant dihydrofolate reductase DfrA17	NA	NA
NA	NODE_45_length_5168_cov_25.151574	2199	2984	+	aadA5	ANT(3'')-Ia family aminoglycoside nucleotidyltransferase AadA5	core	AMR	AMR	AMINOGLYCOSIDE	STREPTOMYCIN	EXACTX	262	262	100.00	100.00	262	WP_000503573.1	ANT(3'')-Ia family aminoglycoside nucleotidyltransferase AadA5	NA	NA
NA	NODE_45_length_5168_cov_25.151574	3193	3537	+	qacEdelta1	quaternary ammonium compound efflux SMR transporter QacE delta 1	core	STRESS	BIOCIDE	QUATERNARY AMMONIUM	QUATERNARY AMMONIUM	ALLELEX	115	115	100.00	100.00	115	WP_000679427.1	quaternary ammonium compound efflux SMR transporter QacE delta 1	NA	NA
NA	NODE_45_length_5168_cov_25.151574	3534	4370	+	sul1	sulfonamide-resistant dihydropteroate synthase Sul1	core	AMR	AMR	SULFONAMIDE	SULFONAMIDE	EXACTX	279	279	100.00	100.00	279	WP_000259031.1	sulfonamide-resistant dihydropteroate synthase Sul1	NA	NA
NA	NODE_52_length_1504_cov_24.817805	148	786	-	catA2	type A-2 chloramphenicol O-acetyltransferase CatII	core	AMR	AMR	PHENICOL	CHLORAMPHENICOL	EXACTX	213	213	100.00	100.00	213	WP_001011939.1	type A-2 chloramphenicol O-acetyltransferase CatII	NA	NA
