Protein id	Contig id	Start	Stop	Strand	Element symbol	Element name	Scope	Type	Subtype	Class	Subclass	Method	Target length	Reference sequence length	% Coverage of reference	% Identity to reference	Alignment length	Closest reference accession	Closest reference name	HMM accession	HMM description
NA	NODE_10_length_176866_cov_63.622150	79944	81125	-	emrD	multidrug efflux MFS transporter EmrD	plus	AMR	AMR	EFFLUX	EFFLUX	BLASTX	394	394	100.00	99.49	394	ACN65732.1	multidrug efflux MFS transporter EmrD	NA	NA
NA	NODE_11_length_169216_cov_53.820230	4723	5580	-	blaSHV-11	broad-spectrum class A beta-lactamase SHV-11	core	AMR	AMR	BETA-LACTAM	BETA-LACTAM	ALLELEX	286	286	100.00	100.00	286	WP_004176269.1	broad-spectrum class A beta-lactamase SHV-11	NA	NA
NA	NODE_1_length_259513_cov_56.154433	46487	47563	-	ompK35_E132K	Klebsiella pneumoniae carbapenem resistant OmpK35	core	AMR	POINT	BETA-LACTAM	CARBAPENEM	POINTX	359	359	100.00	99.72	359	WP_004141771.1	outer membrane porin OmpK35	NA	NA
NA	NODE_22_length_99338_cov_61.231359	58690	59589	+	fieF	CDF family cation-efflux transporter FieF	plus	STRESS	METAL	NA	NA	EXACTX	300	300	100.00	100.00	300	BAB89353.1	CDF family cation-efflux transporter FieF	NA	NA
NA	NODE_29_length_79710_cov_61.132044	14127	14543	+	fosA	FosA5 family fosfomycin resistance glutathione transferase	core	AMR	AMR	FOSFOMYCIN	FOSFOMYCIN	EXACTX	139	139	100.00	100.00	139	WP_004146118.1	FosA5 family fosfomycin resistance glutathione transferase	NA	NA
NA	NODE_32_length_69384_cov_59.876257	10639	11811	+	oqxA	multidrug efflux RND transporter periplasmic adaptor subunit OqxA	core	AMR	AMR	PHENICOL/QUINOLONE	PHENICOL/QUINOLONE	EXACTX	391	391	100.00	100.00	391	WP_002914189.1	multidrug efflux RND transporter periplasmic adaptor subunit OqxA	NA	NA
NA	NODE_32_length_69384_cov_59.876257	11838	14987	+	oqxB25	multidrug efflux RND transporter permease subunit OqxB25	core	AMR	AMR	PHENICOL/QUINOLONE	PHENICOL/QUINOLONE	ALLELEX	1050	1050	100.00	100.00	1050	WP_016947602.1	multidrug efflux RND transporter permease subunit OqxB25	NA	NA
NA	NODE_34_length_59959_cov_72.253255	9477	9929	+	terB	tellurium resistance membrane protein TerB	plus	STRESS	METAL	TELLURIUM	TELLURIUM	EXACTX	151	151	100.00	100.00	151	ACI12150.1	tellurium resistance membrane protein TerB	NA	NA
NA	NODE_34_length_59959_cov_72.253255	9956	10996	+	terC	tellurium resistance membrane protein TerC	plus	STRESS	METAL	TELLURIUM	TELLURIUM	BLASTX	347	346	100.00	98.85	347	AAA98291.1	tellurium resistance membrane protein TerC	NA	NA
NA	NODE_34_length_59959_cov_72.253255	11038	11613	+	terD	tellurium resistance membrane protein TerD	plus	STRESS	METAL	TELLURIUM	TELLURIUM	BLASTX	192	192	100.00	98.96	192	AAA98292.1	tellurium resistance membrane protein TerD	NA	NA
NA	NODE_34_length_59959_cov_72.253255	11717	12289	+	terE	tellurium resistance cAMP binding protein TerE	plus	STRESS	METAL	TELLURIUM	TELLURIUM	BLASTX	191	191	100.00	99.48	191	AAA98293.1	tellurium resistance cAMP binding protein TerE	NA	NA
NA	NODE_34_length_59959_cov_72.253255	34775	35134	+	rmpA2	mucoid phenotype regulator RmpA2	plus	VIRULENCE	VIRULENCE	NA	NA	PARTIALX	120	212	56.60	96.67	120	AAR07704.1	mucoid phenotype regulator RmpA2	NA	NA
NA	NODE_34_length_59959_cov_72.253255	40305	42491	-	iutA	ferric aerobactin receptor IutA	plus	VIRULENCE	VIRULENCE	NA	NA	BLASTX	729	731	99.73	89.57	729	AAN45165.2	ferric aerobactin receptor IutA	NA	NA
NA	NODE_34_length_59959_cov_72.253255	43869	45599	-	iucC	NIS family aerobactin synthetase IucC	plus	VIRULENCE	VIRULENCE	NA	NA	BLASTX	577	580	99.48	92.72	577	AAN82073.1	NIS family aerobactin synthetase IucC	NA	NA
NA	NODE_34_length_59959_cov_72.253255	45602	46546	-	iucB	N(6)-hydroxylysine O-acetyltransferase IucB	plus	VIRULENCE	VIRULENCE	NA	NA	BLASTX	315	315	100.00	94.60	315	AAN82074.1	N(6)-hydroxylysine O-acetyltransferase IucB	NA	NA
NA	NODE_34_length_59959_cov_72.253255	46553	48271	-	iucA	aerobactin synthase IucA	plus	VIRULENCE	VIRULENCE	NA	NA	BLASTX	573	576	99.83	90.09	575	EGI25746.1	aerobactin synthase IucA	NA	NA
NA	NODE_36_length_54546_cov_74.557230	26330	27727	-	pcoS	copper resistance membrane spanning protein PcoS	plus	STRESS	METAL	COPPER	COPPER	BLASTX	466	466	100.00	99.14	466	CAA58530.1	copper resistance membrane spanning protein PcoS	NA	NA
NA	NODE_36_length_54546_cov_74.557230	27727	28404	-	pcoR	copper response regulator transcription factor PcoR	plus	STRESS	METAL	COPPER	COPPER	EXACTX	226	226	100.00	100.00	226	CAA58529.1	copper response regulator transcription factor PcoR	NA	NA
NA	NODE_36_length_54546_cov_74.557230	28462	29388	-	pcoD	copper resistance inner membrane protein PcoD	plus	STRESS	METAL	COPPER	COPPER	BLASTX	309	309	100.00	99.35	309	CAA58528.1	copper resistance inner membrane protein PcoD	NA	NA
NA	NODE_36_length_54546_cov_74.557230	29396	29773	-	pcoC	copper resistance system metallochaperone PcoC	plus	STRESS	METAL	COPPER	COPPER	EXACTX	126	126	100.00	100.00	126	CAA58527.1	copper resistance system metallochaperone PcoC	NA	NA
NA	NODE_36_length_54546_cov_74.557230	29816	30703	-	pcoB	copper-binding protein PcoB	plus	STRESS	METAL	COPPER	COPPER	BLASTX	296	296	100.00	99.66	296	CAA58526.1	copper-binding protein PcoB	NA	NA
NA	NODE_36_length_54546_cov_74.557230	30712	32526	-	pcoA	multicopper oxidase PcoA	plus	STRESS	METAL	COPPER	COPPER	BLASTX	605	605	100.00	99.83	605	CAA58525.1	multicopper oxidase PcoA	NA	NA
NA	NODE_36_length_54546_cov_74.557230	34510	36975	-	silP	Ag(+)-translocating P-type ATPase SilP	plus	STRESS	METAL	SILVER	SILVER	BLASTX	822	824	99.64	94.53	823	AAD11750.1	Ag(+)-translocating P-type ATPase SilP	NA	NA
NA	NODE_36_length_54546_cov_74.557230	37611	40754	-	silA	Cu(+)/Ag(+) efflux RND transporter permease subunit SilA	plus	STRESS	METAL	COPPER/SILVER	COPPER/SILVER	BLASTX	1048	1048	100.00	98.85	1048	AAD11749.1	Cu(+)/Ag(+) efflux RND transporter permease subunit SilA	NA	NA
NA	NODE_36_length_54546_cov_74.557230	40768	42057	-	silB	Cu(+)/Ag(+) efflux RND transporter periplasmic adaptor subunit SilB	plus	STRESS	METAL	COPPER/SILVER	COPPER/SILVER	BLASTX	430	430	100.00	98.14	430	AAD11748.1	Cu(+)/Ag(+) efflux RND transporter periplasmic adaptor subunit SilB	NA	NA
NA	NODE_36_length_54546_cov_74.557230	42174	42533	-	silF	Cu(+)/Ag(+) efflux RND transporter periplasmic metallochaperone SilF	plus	STRESS	METAL	COPPER/SILVER	COPPER/SILVER	BLASTX	120	117	100.00	94.17	120	KGL71342.1	Cu(+)/Ag(+) efflux RND transporter periplasmic metallochaperone SilF	NA	NA
NA	NODE_36_length_54546_cov_74.557230	42565	43947	-	silC	Cu(+)/Ag(+) efflux RND transporter outer membrane channel SilC	plus	STRESS	METAL	COPPER/SILVER	COPPER/SILVER	BLASTX	461	461	100.00	99.35	461	SPD96884.1	Cu(+)/Ag(+) efflux RND transporter outer membrane channel SilC	NA	NA
NA	NODE_36_length_54546_cov_74.557230	44137	44814	+	silR	copper/silver response regulator transcription factor SilR	plus	STRESS	METAL	COPPER/SILVER	COPPER/SILVER	BLASTX	226	226	100.00	97.35	226	SPD96883.1	copper/silver response regulator transcription factor SilR	NA	NA
NA	NODE_36_length_54546_cov_74.557230	44810	46282	+	silS	copper/silver sensor histidine kinase SilS	plus	STRESS	METAL	COPPER/SILVER	COPPER/SILVER	BLASTX	491	491	100.00	98.98	491	SPD96882.1	copper/silver sensor histidine kinase SilS	NA	NA
NA	NODE_39_length_44412_cov_72.992583	29504	30616	+	iroB	salmochelin biosynthesis C-glycosyltransferase IroB	plus	VIRULENCE	VIRULENCE	NA	NA	BLASTX	371	371	100.00	90.30	371	EOW04219.1	salmochelin biosynthesis C-glycosyltransferase IroB	NA	NA
NA	NODE_39_length_44412_cov_72.992583	30762	34397	+	iroC	salmochelin/enterobactin export ABC transporter IroC	plus	VIRULENCE	VIRULENCE	NA	NA	BLASTX	1212	1219	99.51	88.95	1213	AUH19662.1	salmochelin/enterobactin export ABC transporter IroC	NA	NA
NA	NODE_39_length_44412_cov_72.992583	34511	35737	+	iroD	catecholate siderophore esterase IroD	plus	VIRULENCE	VIRULENCE	NA	NA	BLASTX	409	409	100.00	98.78	409	AVE24993.1	catecholate siderophore esterase IroD	NA	NA
NA	NODE_39_length_44412_cov_72.992583	36200	38371	+	iroN	siderophore salmochelin receptor IroN	plus	VIRULENCE	VIRULENCE	NA	NA	BLASTX	724	724	100.00	99.86	724	BAH65949.1	siderophore salmochelin receptor IroN	NA	NA
NA	NODE_39_length_44412_cov_72.992583	38803	39702	-	peg-344	DMT family inner membrane transporter PEG344	plus	VIRULENCE	VIRULENCE	NA	NA	EXACTX	300	300	100.00	100.00	300	BAH65947.1	DMT family inner membrane transporter PEG344	NA	NA
NA	NODE_39_length_44412_cov_72.992583	39781	40176	-	rmpC	mucoid phenotype regulator RmpC	plus	VIRULENCE	VIRULENCE	NA	NA	BLASTX	132	133	99.25	90.91	132	AIK83625.1	mucoid phenotype regulator RmpC	NA	NA
NA	NODE_39_length_44412_cov_72.992583	40532	40651	-	rmpD	mucoid phenotype synthesis protein RmpD	plus	VIRULENCE	VIRULENCE	NA	NA	EXACTX	40	40	100.00	100.00	40	QIK04195.1	mucoid phenotype synthesis protein RmpD	NA	NA
NA	NODE_39_length_44412_cov_72.992583	40710	41339	-	rmpA	mucoid phenotype regulator RmpA	plus	VIRULENCE	VIRULENCE	NA	NA	EXACTX	210	210	100.00	100.00	210	AMA27886.1	mucoid phenotype regulator RmpA	NA	NA
