Protein id	Contig id	Start	Stop	Strand	Element symbol	Element name	Scope	Type	Subtype	Class	Subclass	Method	Target length	Reference sequence length	% Coverage of reference	% Identity to reference	Alignment length	Closest reference accession	Closest reference name	HMM accession	HMM description
NA	NODE_170_length_313_cov_1.856589	2	313	-	terE	tellurium resistance cAMP binding protein TerE	plus	STRESS	METAL	TELLURIUM	TELLURIUM	PARTIAL_CONTIG_ENDX	104	191	54.45	99.04	104	AAA98293.1	tellurium resistance cAMP binding protein TerE	NA	NA
NA	NODE_1_length_332215_cov_56.463244	115705	116562	+	blaSHV-1	broad-spectrum class A beta-lactamase SHV-1	core	AMR	AMR	BETA-LACTAM	BETA-LACTAM	ALLELEX	286	286	100.00	100.00	286	WP_001620095.1	broad-spectrum class A beta-lactamase SHV-1	NA	NA
NA	NODE_21_length_102527_cov_58.819931	79967	81148	-	emrD	multidrug efflux MFS transporter EmrD	plus	AMR	AMR	EFFLUX	EFFLUX	BLASTX	394	394	100.00	99.24	394	ACN65732.1	multidrug efflux MFS transporter EmrD	NA	NA
NA	NODE_24_length_99401_cov_57.756447	40651	41823	+	oqxA10	multidrug efflux RND transporter periplasmic adaptor subunit OqxA10	core	AMR	AMR	PHENICOL/QUINOLONE	PHENICOL/QUINOLONE	ALLELEX	391	391	100.00	100.00	391	WP_004149398.1	multidrug efflux RND transporter periplasmic adaptor subunit OqxA10	NA	NA
NA	NODE_24_length_99401_cov_57.756447	41850	44999	+	oqxB25	multidrug efflux RND transporter permease subunit OqxB25	core	AMR	AMR	PHENICOL/QUINOLONE	PHENICOL/QUINOLONE	ALLELEX	1050	1050	100.00	100.00	1050	WP_016947602.1	multidrug efflux RND transporter permease subunit OqxB25	NA	NA
NA	NODE_27_length_94121_cov_58.790073	53474	54373	+	fieF	CDF family cation-efflux transporter FieF	plus	STRESS	METAL	NA	NA	EXACTX	300	300	100.00	100.00	300	BAB89353.1	CDF family cation-efflux transporter FieF	NA	NA
NA	NODE_307_length_243_cov_1.531915	3	242	+	ble	bleomycin binding protein Ble-MBL	core	AMR	AMR	BLEOMYCIN	BLEOMYCIN	PARTIAL_CONTIG_ENDX	80	121	66.12	100.00	80	WP_004201167.1	bleomycin binding protein Ble-MBL	NA	NA
NA	NODE_33_length_58628_cov_59.890530	15452	15868	+	fosA	FosA5 family fosfomycin resistance glutathione transferase	core	AMR	AMR	FOSFOMYCIN	FOSFOMYCIN	EXACTX	139	139	100.00	100.00	139	WP_004146118.1	FosA5 family fosfomycin resistance glutathione transferase	NA	NA
NA	NODE_37_length_37376_cov_59.695158	14856	15422	+	hsp20	small heat shock protein sHSP20	plus	STRESS	HEAT	NA	NA	BLASTX	189	189	100.00	99.47	189	CDY80020.1	small heat shock protein sHSP20	NA	NA
NA	NODE_37_length_37376_cov_59.695158	15531	18377	+	clpK	heat shock survival AAA family ATPase ClpK	plus	STRESS	HEAT	NA	NA	BLASTX	949	949	100.00	98.74	949	ASF80763.1	heat shock survival AAA family ATPase ClpK	NA	NA
NA	NODE_37_length_37376_cov_59.695158	19526	19981	+	shsP	small heat shock protein sHSP20-GI	plus	STRESS	HEAT	NA	NA	BLASTX	152	152	100.00	99.34	152	ASF80771.1	small heat shock protein sHSP20-GI	NA	NA
NA	NODE_37_length_37376_cov_59.695158	20007	20918	+	yfdX1	heat resistance protein YfdX1	plus	STRESS	HEAT	NA	NA	BLASTX	304	304	100.00	99.34	304	APX31172.1	heat resistance protein YfdX1	NA	NA
NA	NODE_37_length_37376_cov_59.695158	21024	21908	+	yfdX2	heat resistance protein YfdX2	plus	STRESS	HEAT	NA	NA	BLASTX	295	295	100.00	98.98	295	ASF80766.1	heat resistance protein YfdX2	NA	NA
NA	NODE_37_length_37376_cov_59.695158	22001	22609	+	hdeD-GI	heat resistance membrane protein HdeD-GI	plus	STRESS	HEAT	NA	NA	BLASTX	203	203	100.00	96.06	203	APX31174.1	heat resistance membrane protein HdeD-GI	NA	NA
NA	NODE_37_length_37376_cov_59.695158	23826	24263	+	trxLHR	heat resistance system thioredoxin Trx-GI	plus	STRESS	HEAT	NA	NA	BLASTX	146	146	100.00	98.63	146	APX31176.1	heat resistance system thioredoxin Trx-GI	NA	NA
NA	NODE_37_length_37376_cov_59.695158	24270	25982	+	kefB-GI	heat resistance system K+/H+ antiporter KefB-GI	plus	STRESS	HEAT	NA	NA	INTERNAL_STOP	571	571	100.00	98.95	571	APX31177.1	heat resistance system K+/H+ antiporter KefB-GI	NA	NA
NA	NODE_37_length_37376_cov_59.695158	25982	26473	+	psi-GI	heat resistance protein PsiE-GI	plus	STRESS	HEAT	NA	NA	BLASTX	164	165	99.39	96.34	164	APX31178.1	heat resistance protein PsiE-GI	NA	NA
NA	NODE_40_length_34303_cov_46.302353	5393	6790	-	pcoS	copper resistance membrane spanning protein PcoS	plus	STRESS	METAL	COPPER	COPPER	BLASTX	466	466	100.00	99.14	466	CAA58530.1	copper resistance membrane spanning protein PcoS	NA	NA
NA	NODE_40_length_34303_cov_46.302353	6790	7467	-	pcoR	copper response regulator transcription factor PcoR	plus	STRESS	METAL	COPPER	COPPER	EXACTX	226	226	100.00	100.00	226	CAA58529.1	copper response regulator transcription factor PcoR	NA	NA
NA	NODE_40_length_34303_cov_46.302353	7525	8451	-	pcoD	copper resistance inner membrane protein PcoD	plus	STRESS	METAL	COPPER	COPPER	BLASTX	309	309	100.00	99.35	309	CAA58528.1	copper resistance inner membrane protein PcoD	NA	NA
NA	NODE_40_length_34303_cov_46.302353	8459	8836	-	pcoC	copper resistance system metallochaperone PcoC	plus	STRESS	METAL	COPPER	COPPER	EXACTX	126	126	100.00	100.00	126	CAA58527.1	copper resistance system metallochaperone PcoC	NA	NA
NA	NODE_40_length_34303_cov_46.302353	8879	9766	-	pcoB	copper-binding protein PcoB	plus	STRESS	METAL	COPPER	COPPER	EXACTX	296	296	100.00	100.00	296	CAA58526.1	copper-binding protein PcoB	NA	NA
NA	NODE_40_length_34303_cov_46.302353	9775	11589	-	pcoA	multicopper oxidase PcoA	plus	STRESS	METAL	COPPER	COPPER	EXACTX	605	605	100.00	100.00	605	CAA58525.1	multicopper oxidase PcoA	NA	NA
NA	NODE_40_length_34303_cov_46.302353	13573	16038	-	silP	Ag(+)-translocating P-type ATPase SilP	plus	STRESS	METAL	SILVER	SILVER	BLASTX	822	824	99.64	94.65	823	AAD11750.1	Ag(+)-translocating P-type ATPase SilP	NA	NA
NA	NODE_40_length_34303_cov_46.302353	16674	19817	-	silA	Cu(+)/Ag(+) efflux RND transporter permease subunit SilA	plus	STRESS	METAL	COPPER/SILVER	COPPER/SILVER	BLASTX	1048	1048	100.00	98.85	1048	AAD11749.1	Cu(+)/Ag(+) efflux RND transporter permease subunit SilA	NA	NA
NA	NODE_40_length_34303_cov_46.302353	19831	21120	-	silB	Cu(+)/Ag(+) efflux RND transporter periplasmic adaptor subunit SilB	plus	STRESS	METAL	COPPER/SILVER	COPPER/SILVER	BLASTX	430	430	100.00	97.91	430	AAD11748.1	Cu(+)/Ag(+) efflux RND transporter periplasmic adaptor subunit SilB	NA	NA
NA	NODE_40_length_34303_cov_46.302353	21237	21587	-	silF	Cu(+)/Ag(+) efflux RND transporter periplasmic metallochaperone SilF	plus	STRESS	METAL	COPPER/SILVER	COPPER/SILVER	BLASTX	117	117	100.00	99.15	117	KGL71342.1	Cu(+)/Ag(+) efflux RND transporter periplasmic metallochaperone SilF	NA	NA
NA	NODE_40_length_34303_cov_46.302353	21619	23001	-	silC	Cu(+)/Ag(+) efflux RND transporter outer membrane channel SilC	plus	STRESS	METAL	COPPER/SILVER	COPPER/SILVER	BLASTX	461	461	100.00	99.78	461	SPD96884.1	Cu(+)/Ag(+) efflux RND transporter outer membrane channel SilC	NA	NA
NA	NODE_40_length_34303_cov_46.302353	23191	23868	+	silR	copper/silver response regulator transcription factor SilR	plus	STRESS	METAL	COPPER/SILVER	COPPER/SILVER	EXACTX	226	226	100.00	100.00	226	SPD96883.1	copper/silver response regulator transcription factor SilR	NA	NA
NA	NODE_40_length_34303_cov_46.302353	23864	25336	+	silS	copper/silver sensor histidine kinase SilS	plus	STRESS	METAL	COPPER/SILVER	COPPER/SILVER	EXACTX	491	491	100.00	100.00	491	SPD96882.1	copper/silver sensor histidine kinase SilS	NA	NA
NA	NODE_40_length_34303_cov_46.302353	25590	26018	+	silE	silver-binding protein SilE	plus	STRESS	METAL	SILVER	SILVER	BLASTX	143	143	100.00	96.50	143	AAD11743.1	silver-binding protein SilE	NA	NA
NA	NODE_43_length_30694_cov_54.466530	15519	15929	-	crcB	fluoride efflux transporter CrcB	plus	STRESS	BIOCIDE	FLUORIDE	FLUORIDE	EXACTX	137	137	100.00	100.00	137	CCN31428.1	fluoride efflux transporter CrcB	NA	NA
NA	NODE_48_length_23541_cov_47.245763	7817	9112	+	ncrA	Metal Resistance	plus	STRESS	METAL	NICKEL	NICKEL	EXACTX	432	432	100.00	100.00	432	ABF61434.1	Metal Resistance	NA	NA
NA	NODE_48_length_23541_cov_47.245763	9221	9487	+	ncrB	nickel-sensing transcriptional repressor NcrB	plus	STRESS	METAL	NICKEL	NICKEL	EXACTX	89	89	100.00	100.00	89	ABF61435.1	nickel-sensing transcriptional repressor NcrB	NA	NA
NA	NODE_48_length_23541_cov_47.245763	9503	10630	+	ncrC	Ni(II)/Co(II) efflux transporter permease subunit NcrC	plus	STRESS	METAL	COPPER/NICKEL	COPPER/NICKEL	EXACTX	376	376	100.00	100.00	376	ADF64798.1	Ni(II)/Co(II) efflux transporter permease subunit NcrC	NA	NA
NA	NODE_48_length_23541_cov_47.245763	10795	11214	+	ncrY	nickel resistance OB fold protein NcrY	plus	STRESS	METAL	NICKEL	NICKEL	EXACTX	140	140	100.00	100.00	140	ABF61437.1	nickel resistance OB fold protein NcrY	NA	NA
