Protein id	Contig id	Start	Stop	Strand	Element symbol	Element name	Scope	Type	Subtype	Class	Subclass	Method	Target length	Reference sequence length	% Coverage of reference	% Identity to reference	Alignment length	Closest reference accession	Closest reference name	HMM accession	HMM description
NA	NODE_19_length_98389_cov_66.714880	38755	39654	-	fieF	CDF family cation-efflux transporter FieF	plus	STRESS	METAL	NA	NA	EXACTX	300	300	100.00	100.00	300	BAB89353.1	CDF family cation-efflux transporter FieF	NA	NA
NA	NODE_22_length_91956_cov_65.940022	50489	53638	-	oqxB	multidrug efflux RND transporter permease subunit OqxB	core	AMR	AMR	PHENICOL/QUINOLONE	PHENICOL/QUINOLONE	BLASTX	1050	1050	100.00	99.90	1050	WP_019704817.1	multidrug efflux RND transporter permease subunit OqxB14	NA	NA
NA	NODE_22_length_91956_cov_65.940022	53665	54837	-	oqxA	multidrug efflux RND transporter periplasmic adaptor subunit OqxA	core	AMR	AMR	PHENICOL/QUINOLONE	PHENICOL/QUINOLONE	EXACTX	391	391	100.00	100.00	391	WP_002914189.1	multidrug efflux RND transporter periplasmic adaptor subunit OqxA	NA	NA
NA	NODE_25_length_78431_cov_67.294695	64179	64595	-	fosA10	fosfomycin resistance glutathione transferase FosA10	core	AMR	AMR	FOSFOMYCIN	FOSFOMYCIN	ALLELEX	139	139	100.00	100.00	139	WP_004214174.1	fosfomycin resistance glutathione transferase FosA10	NA	NA
NA	NODE_2_length_580602_cov_61.053653	398022	398879	-	blaSHV-1	broad-spectrum class A beta-lactamase SHV-1	core	AMR	AMR	BETA-LACTAM	BETA-LACTAM	ALLELEX	286	286	100.00	100.00	286	WP_001620095.1	broad-spectrum class A beta-lactamase SHV-1	NA	NA
NA	NODE_5_length_268998_cov_70.633934	187922	189103	+	emrD	multidrug efflux MFS transporter EmrD	plus	AMR	AMR	EFFLUX	EFFLUX	BLASTX	394	394	100.00	99.49	394	ACN65732.1	multidrug efflux MFS transporter EmrD	NA	NA
