Protein id	Contig id	Start	Stop	Strand	Element symbol	Element name	Scope	Type	Subtype	Class	Subclass	Method	Target length	Reference sequence length	% Coverage of reference	% Identity to reference	Alignment length	Closest reference accession	Closest reference name	HMM accession	HMM description
NA	NODE_104_length_4716_cov_49.422871	66	497	-	merR	mercury resistance transcriptional regulator MerR	plus	STRESS	METAL	MERCURY	MERCURY	BLASTX	144	144	100.00	93.75	144	CAA77320.1	mercury resistance transcriptional regulator MerR	NA	NA
NA	NODE_104_length_4716_cov_49.422871	569	916	+	merT	mercuric transport protein MerT	plus	STRESS	METAL	MERCURY	MERCURY	EXACTX	116	116	100.00	100.00	116	AAB59075.1	mercuric transport protein MerT	NA	NA
NA	NODE_104_length_4716_cov_49.422871	933	1205	+	merP	mercury resistance system periplasmic binding protein MerP	plus	STRESS	METAL	MERCURY	MERCURY	BLASTX	91	91	100.00	90.11	91	AAC38219.1	mercury resistance system periplasmic binding protein MerP	NA	NA
NA	NODE_104_length_4716_cov_49.422871	1244	1663	+	merC	organomercurial transporter MerC	plus	STRESS	METAL	MERCURY	ORGANOMERCURY	EXACTX	140	140	100.00	100.00	140	AAC33908.1	organomercurial transporter MerC	NA	NA
NA	NODE_105_length_4584_cov_69.710753	1661	2290	+	catB	type B chloramphenicol O-acetyltransferase	core	AMR	AMR	PHENICOL	CHLORAMPHENICOL	EXACTX	210	210	100.00	100.00	210	WP_031281281.1	type B chloramphenicol O-acetyltransferase	NA	NA
NA	NODE_105_length_4584_cov_69.710753	3945	4583	-	rmtF	RmtF family 16S rRNA (guanine(1405)-N(7))-methyltransferase	core	AMR	AMR	AMINOGLYCOSIDE	AMINOGLYCOSIDE	PARTIAL_CONTIG_ENDX	213	259	82.24	100.00	213	WP_015632396.1	16S rRNA (guanine(1405)-N(7))-methyltransferase RmtF1	NA	NA
NA	NODE_110_length_3738_cov_86.108879	592	1143	-	aac(6')-Ib	AAC(6')-Ib family aminoglycoside 6'-N-acetyltransferase	core	AMR	AMR	AMINOGLYCOSIDE	GENTAMICIN	EXACTX	184	184	100.00	100.00	184	WP_022631510.1	AAC(6')-Ib family aminoglycoside 6'-N-acetyltransferase	NA	NA
NA	NODE_110_length_3738_cov_86.108879	3201	3650	-	arr-2	NAD(+)--rifampin ADP-ribosyltransferase Arr-2	core	AMR	AMR	RIFAMYCIN	RIFAMYCIN	ALLELEX	150	150	100.00	100.00	150	WP_000237816.1	NAD(+)--rifampin ADP-ribosyltransferase Arr-2	NA	NA
NA	NODE_112_length_3344_cov_45.034053	2325	3227	-	mph(A)	Mph(A) family macrolide 2'-phosphotransferase	core	AMR	AMR	MACROLIDE	AZITHROMYCIN/ERYTHROMYCIN/SPIRAMYCIN/TELITHROMYCIN	BLASTX	301	301	100.00	100.00	301	WP_000219391.1	Mph(A) family macrolide 2'-phosphotransferase	NA	NA
NA	NODE_113_length_3194_cov_79.718382	1781	2422	-	qnrB1	quinolone resistance pentapeptide repeat protein QnrB1	core	AMR	AMR	QUINOLONE	QUINOLONE	ALLELEX	214	214	100.00	100.00	214	WP_014386481.1	quinolone resistance pentapeptide repeat protein QnrB1	NA	NA
NA	NODE_115_length_2986_cov_56.893893	334	1110	+	aph(3')-VI	APH(3')-VI family aminoglycoside O-phosphotransferase	core	AMR	AMR	AMINOGLYCOSIDE	AMIKACIN/KANAMYCIN	EXACTX	259	259	100.00	100.00	259	WP_014386410.1	APH(3')-VI family aminoglycoside O-phosphotransferase	NA	NA
NA	NODE_127_length_2079_cov_50.164032	72	542	+	dfrA5	trimethoprim-resistant dihydrofolate reductase DfrA5	core	AMR	AMR	TRIMETHOPRIM	TRIMETHOPRIM	EXACTX	157	157	100.00	100.00	157	WP_001317507.1	trimethoprim-resistant dihydrofolate reductase DfrA5	NA	NA
NA	NODE_127_length_2079_cov_50.164032	729	1073	+	qacEdelta1	quaternary ammonium compound efflux SMR transporter QacE delta 1	core	STRESS	BIOCIDE	QUATERNARY AMMONIUM	QUATERNARY AMMONIUM	ALLELEX	115	115	100.00	100.00	115	WP_000679427.1	quaternary ammonium compound efflux SMR transporter QacE delta 1	NA	NA
NA	NODE_127_length_2079_cov_50.164032	1070	1906	+	sul1	sulfonamide-resistant dihydropteroate synthase Sul1	core	AMR	AMR	SULFONAMIDE	SULFONAMIDE	EXACTX	279	279	100.00	100.00	279	WP_000259031.1	sulfonamide-resistant dihydropteroate synthase Sul1	NA	NA
NA	NODE_140_length_1492_cov_43.072373	135	773	-	catA2	type A-2 chloramphenicol O-acetyltransferase CatII	core	AMR	AMR	PHENICOL	CHLORAMPHENICOL	EXACTX	213	213	100.00	100.00	213	WP_001011939.1	type A-2 chloramphenicol O-acetyltransferase CatII	NA	NA
NA	NODE_142_length_1434_cov_146.749094	61	933	-	blaCTX-M-65	extended-spectrum class A beta-lactamase CTX-M-65	core	AMR	AMR	BETA-LACTAM	CEPHALOSPORIN	ALLELEX	291	291	100.00	100.00	291	WP_013188475.1	extended-spectrum class A beta-lactamase CTX-M-65	NA	NA
NA	NODE_146_length_1379_cov_130.274924	375	788	+	fosA3	fosfomycin resistance glutathione transferase FosA3	core	AMR	AMR	FOSFOMYCIN	FOSFOMYCIN	ALLELEX	138	138	100.00	100.00	138	WP_014839980.1	fosfomycin resistance glutathione transferase FosA3	NA	NA
NA	NODE_155_length_1124_cov_42.646399	120	932	+	aph(3')-Ia	aminoglycoside O-phosphotransferase APH(3')-Ia	core	AMR	AMR	AMINOGLYCOSIDE	KANAMYCIN	EXACTX	271	271	100.00	100.00	271	WP_000018329.1	aminoglycoside O-phosphotransferase APH(3')-Ia	NA	NA
NA	NODE_15_length_136483_cov_25.394538	127399	128256	+	blaSHV-11	broad-spectrum class A beta-lactamase SHV-11	core	AMR	AMR	BETA-LACTAM	BETA-LACTAM	ALLELEX	286	286	100.00	100.00	286	WP_004176269.1	broad-spectrum class A beta-lactamase SHV-11	NA	NA
NA	NODE_1_length_282786_cov_39.390760	249862	251904	+	parC_S80I	Klebsiella pneumoniae quinolone resistant ParC	core	AMR	POINT	QUINOLONE	QUINOLONE	POINTX	681	689	98.84	99.41	681	WP_101982161.1	DNA topoisomerase IV subunit A ParC	NA	NA
NA	NODE_21_length_99341_cov_45.653043	58691	59590	+	fieF	CDF family cation-efflux transporter FieF	plus	STRESS	METAL	NA	NA	EXACTX	300	300	100.00	100.00	300	BAB89353.1	CDF family cation-efflux transporter FieF	NA	NA
NA	NODE_27_length_84534_cov_38.408066	70154	70570	-	fosA	FosA5 family fosfomycin resistance glutathione transferase	core	AMR	AMR	FOSFOMYCIN	FOSFOMYCIN	BLASTX	139	139	100.00	98.56	139	WP_004146118.1	FosA5 family fosfomycin resistance glutathione transferase	NA	NA
NA	NODE_2_length_269153_cov_28.522263	70507	72306	+	ybtP	yersiniabactin ABC transporter ATP-binding/permease protein YbtP	plus	VIRULENCE	VIRULENCE	NA	NA	BLASTX	600	600	100.00	99.83	600	CAA21388.1	yersiniabactin ABC transporter ATP-binding/permease protein YbtP	NA	NA
NA	NODE_2_length_269153_cov_28.522263	72296	74095	+	ybtQ	yersiniabactin ABC transporter ATP-binding/permease protein YbtQ	plus	VIRULENCE	VIRULENCE	NA	NA	BLASTX	600	600	100.00	99.83	600	AAC69584.1	yersiniabactin ABC transporter ATP-binding/permease protein YbtQ	NA	NA
NA	NODE_35_length_64393_cov_50.188163	19042	19494	+	terB	tellurium resistance membrane protein TerB	plus	STRESS	METAL	TELLURIUM	TELLURIUM	EXACTX	151	151	100.00	100.00	151	ACI12150.1	tellurium resistance membrane protein TerB	NA	NA
NA	NODE_35_length_64393_cov_50.188163	19521	20558	+	terC	tellurium resistance membrane protein TerC	plus	STRESS	METAL	TELLURIUM	TELLURIUM	BLASTX	346	346	100.00	99.13	346	AAA98291.1	tellurium resistance membrane protein TerC	NA	NA
NA	NODE_35_length_64393_cov_50.188163	20600	21175	+	terD	tellurium resistance membrane protein TerD	plus	STRESS	METAL	TELLURIUM	TELLURIUM	BLASTX	192	192	100.00	98.96	192	AAA98292.1	tellurium resistance membrane protein TerD	NA	NA
NA	NODE_35_length_64393_cov_50.188163	21265	21837	+	terE	tellurium resistance cAMP binding protein TerE	plus	STRESS	METAL	TELLURIUM	TELLURIUM	BLASTX	191	191	100.00	98.95	191	AAA98293.1	tellurium resistance cAMP binding protein TerE	NA	NA
NA	NODE_35_length_64393_cov_50.188163	49842	52028	-	iutA	ferric aerobactin receptor IutA	plus	VIRULENCE	VIRULENCE	NA	NA	BLASTX	729	731	99.73	89.57	729	AAN45165.2	ferric aerobactin receptor IutA	NA	NA
NA	NODE_35_length_64393_cov_50.188163	53406	55136	-	iucC	NIS family aerobactin synthetase IucC	plus	VIRULENCE	VIRULENCE	NA	NA	BLASTX	577	580	99.48	92.72	577	AAN82073.1	NIS family aerobactin synthetase IucC	NA	NA
NA	NODE_35_length_64393_cov_50.188163	55139	56083	-	iucB	N(6)-hydroxylysine O-acetyltransferase IucB	plus	VIRULENCE	VIRULENCE	NA	NA	BLASTX	315	315	100.00	94.60	315	AAN82074.1	N(6)-hydroxylysine O-acetyltransferase IucB	NA	NA
NA	NODE_35_length_64393_cov_50.188163	56090	57808	-	iucA	aerobactin synthase IucA	plus	VIRULENCE	VIRULENCE	NA	NA	BLASTX	573	576	99.83	90.09	575	EGI25746.1	aerobactin synthase IucA	NA	NA
NA	NODE_42_length_59052_cov_34.598488	302	1474	+	oqxA	multidrug efflux RND transporter periplasmic adaptor subunit OqxA	core	AMR	AMR	PHENICOL/QUINOLONE	PHENICOL/QUINOLONE	EXACTX	391	391	100.00	100.00	391	WP_002914189.1	multidrug efflux RND transporter periplasmic adaptor subunit OqxA	NA	NA
NA	NODE_42_length_59052_cov_34.598488	1501	4650	+	oqxB	multidrug efflux RND transporter permease subunit OqxB	core	AMR	AMR	PHENICOL/QUINOLONE	PHENICOL/QUINOLONE	EXACTX	1050	1050	100.00	100.00	1050	WP_000347934.1	multidrug efflux RND transporter permease subunit OqxB	NA	NA
NA	NODE_45_length_52028_cov_57.101437	10624	11253	+	rmpA	mucoid phenotype regulator RmpA	plus	VIRULENCE	VIRULENCE	NA	NA	BLASTX	210	210	100.00	99.52	210	AMA27886.1	mucoid phenotype regulator RmpA	NA	NA
NA	NODE_45_length_52028_cov_57.101437	11312	11431	+	rmpD	mucoid phenotype synthesis protein RmpD	plus	VIRULENCE	VIRULENCE	NA	NA	EXACTX	40	40	100.00	100.00	40	QIK04195.1	mucoid phenotype synthesis protein RmpD	NA	NA
NA	NODE_45_length_52028_cov_57.101437	11787	12182	+	rmpC	mucoid phenotype regulator RmpC	plus	VIRULENCE	VIRULENCE	NA	NA	BLASTX	132	133	99.25	90.91	132	AIK83625.1	mucoid phenotype regulator RmpC	NA	NA
NA	NODE_45_length_52028_cov_57.101437	12261	13160	+	peg-344	DMT family inner membrane transporter PEG344	plus	VIRULENCE	VIRULENCE	NA	NA	EXACTX	300	300	100.00	100.00	300	BAH65947.1	DMT family inner membrane transporter PEG344	NA	NA
NA	NODE_49_length_38066_cov_43.567494	16933	18114	-	emrD	multidrug efflux MFS transporter EmrD	plus	AMR	AMR	EFFLUX	EFFLUX	BLASTX	394	394	100.00	99.24	394	ACN65732.1	multidrug efflux MFS transporter EmrD	NA	NA
NA	NODE_50_length_37087_cov_60.304466	3174	3521	+	arsR	As(III)-sensing metalloregulatory transcriptional repressor ArsR	plus	STRESS	METAL	ARSENIC	ARSENIC	EXACTX	116	116	100.00	100.00	116	AET17094.1	As(III)-sensing metalloregulatory transcriptional repressor ArsR	NA	NA
NA	NODE_50_length_37087_cov_60.304466	3574	3933	+	arsD	arsenite efflux transporter metallochaperone ArsD	plus	STRESS	METAL	ARSENIC	ARSENITE	BLASTX	120	120	100.00	90.83	120	AAB09625.1	arsenite efflux transporter metallochaperone ArsD	NA	NA
NA	NODE_50_length_37087_cov_60.304466	3954	5702	+	arsA	arsenite efflux transporter ATPase subunit ArsA	plus	STRESS	METAL	ARSENIC	ARSENITE	EXACTX	583	583	100.00	100.00	583	BAA24822.1	arsenite efflux transporter ATPase subunit ArsA	NA	NA
NA	NODE_50_length_37087_cov_60.304466	5753	7039	+	arsB	arsenite efflux transporter membrane subunit ArsB	plus	STRESS	METAL	ARSENIC	ARSENITE	EXACTX	429	429	100.00	100.00	429	BAA24823.1	arsenite efflux transporter membrane subunit ArsB	NA	NA
NA	NODE_50_length_37087_cov_60.304466	7055	7477	+	arsC	glutaredoxin-dependent arsenate reductase	plus	STRESS	METAL	ARSENIC	ARSENATE	EXACTX	141	141	100.00	100.00	141	BAA24824.1	glutaredoxin-dependent arsenate reductase	NA	NA
NA	NODE_50_length_37087_cov_60.304466	15518	15949	-	pcoE	copper resistance system metallochaperone PcoE	plus	STRESS	METAL	COPPER	COPPER	BLASTX	144	144	100.00	94.44	144	CAA58532.1	copper resistance system metallochaperone PcoE	NA	NA
NA	NODE_50_length_37087_cov_60.304466	16169	17566	-	pcoS	copper resistance membrane spanning protein PcoS	plus	STRESS	METAL	COPPER	COPPER	BLASTX	466	466	100.00	99.14	466	CAA58530.1	copper resistance membrane spanning protein PcoS	NA	NA
NA	NODE_50_length_37087_cov_60.304466	17566	18243	-	pcoR	copper response regulator transcription factor PcoR	plus	STRESS	METAL	COPPER	COPPER	EXACTX	226	226	100.00	100.00	226	CAA58529.1	copper response regulator transcription factor PcoR	NA	NA
NA	NODE_50_length_37087_cov_60.304466	18301	19227	-	pcoD	copper resistance inner membrane protein PcoD	plus	STRESS	METAL	COPPER	COPPER	BLASTX	309	309	100.00	99.68	309	CAA58528.1	copper resistance inner membrane protein PcoD	NA	NA
NA	NODE_50_length_37087_cov_60.304466	19235	19612	-	pcoC	copper resistance system metallochaperone PcoC	plus	STRESS	METAL	COPPER	COPPER	EXACTX	126	126	100.00	100.00	126	CAA58527.1	copper resistance system metallochaperone PcoC	NA	NA
NA	NODE_50_length_37087_cov_60.304466	19655	20542	-	pcoB	copper-binding protein PcoB	plus	STRESS	METAL	COPPER	COPPER	EXACTX	296	296	100.00	100.00	296	CAA58526.1	copper-binding protein PcoB	NA	NA
NA	NODE_50_length_37087_cov_60.304466	20551	22365	-	pcoA	multicopper oxidase PcoA	plus	STRESS	METAL	COPPER	COPPER	EXACTX	605	605	100.00	100.00	605	CAA58525.1	multicopper oxidase PcoA	NA	NA
NA	NODE_50_length_37087_cov_60.304466	24349	26814	-	silP	Ag(+)-translocating P-type ATPase SilP	plus	STRESS	METAL	SILVER	SILVER	BLASTX	822	824	99.64	94.53	823	AAD11750.1	Ag(+)-translocating P-type ATPase SilP	NA	NA
NA	NODE_50_length_37087_cov_60.304466	27450	30593	-	silA	Cu(+)/Ag(+) efflux RND transporter permease subunit SilA	plus	STRESS	METAL	COPPER/SILVER	COPPER/SILVER	BLASTX	1048	1048	100.00	98.85	1048	AAD11749.1	Cu(+)/Ag(+) efflux RND transporter permease subunit SilA	NA	NA
NA	NODE_50_length_37087_cov_60.304466	30607	31896	-	silB	Cu(+)/Ag(+) efflux RND transporter periplasmic adaptor subunit SilB	plus	STRESS	METAL	COPPER/SILVER	COPPER/SILVER	BLASTX	430	430	100.00	97.67	430	AAD11748.1	Cu(+)/Ag(+) efflux RND transporter periplasmic adaptor subunit SilB	NA	NA
NA	NODE_50_length_37087_cov_60.304466	32013	32363	-	silF	Cu(+)/Ag(+) efflux RND transporter periplasmic metallochaperone SilF	plus	STRESS	METAL	COPPER/SILVER	COPPER/SILVER	BLASTX	117	117	100.00	99.15	117	KGL71342.1	Cu(+)/Ag(+) efflux RND transporter periplasmic metallochaperone SilF	NA	NA
NA	NODE_50_length_37087_cov_60.304466	32395	33777	-	silC	Cu(+)/Ag(+) efflux RND transporter outer membrane channel SilC	plus	STRESS	METAL	COPPER/SILVER	COPPER/SILVER	EXACTX	461	461	100.00	100.00	461	SPD96884.1	Cu(+)/Ag(+) efflux RND transporter outer membrane channel SilC	NA	NA
NA	NODE_50_length_37087_cov_60.304466	33967	34644	+	silR	copper/silver response regulator transcription factor SilR	plus	STRESS	METAL	COPPER/SILVER	COPPER/SILVER	EXACTX	226	226	100.00	100.00	226	SPD96883.1	copper/silver response regulator transcription factor SilR	NA	NA
NA	NODE_50_length_37087_cov_60.304466	34640	36112	+	silS	copper/silver sensor histidine kinase SilS	plus	STRESS	METAL	COPPER/SILVER	COPPER/SILVER	EXACTX	491	491	100.00	100.00	491	SPD96882.1	copper/silver sensor histidine kinase SilS	NA	NA
NA	NODE_50_length_37087_cov_60.304466	36366	36794	+	silE	silver-binding protein SilE	plus	STRESS	METAL	SILVER	SILVER	BLASTX	143	143	100.00	91.61	143	AAD11743.1	silver-binding protein SilE	NA	NA
NA	NODE_6_length_178517_cov_31.272545	117765	120395	+	gyrA_D87G	Klebsiella pneumoniae quinolone resistant GyrA	core	AMR	POINT	QUINOLONE	QUINOLONE	POINTX	877	877	100.00	99.66	877	WP_117036963.1	DNA gyrase subunit A GyrA	NA	NA
NA	NODE_6_length_178517_cov_31.272545	117765	120395	+	gyrA_S83I	Klebsiella pneumoniae quinolone resistant GyrA	core	AMR	POINT	QUINOLONE	QUINOLONE	POINTX	877	877	100.00	99.66	877	WP_117036963.1	DNA gyrase subunit A GyrA	NA	NA
NA	NODE_6_length_178517_cov_31.272545	127511	128632	+	ompK36_D135DGD	Klebsiella pneumoniae carbapenem resistant OmpK36	core	AMR	POINT	BETA-LACTAM	CARBAPENEM	POINTX	374	367	100.00	92.29	376	WP_002913005.1	outer membrane porin OmpK36	NA	NA
NA	NODE_88_length_7531_cov_49.474585	268	1038	+	armA	16S rRNA (guanine(1405)-N(7))-methyltransferase ArmA	core	AMR	AMR	AMINOGLYCOSIDE	GENTAMICIN	EXACTX	257	257	100.00	100.00	257	WP_000359986.1	16S rRNA (guanine(1405)-N(7))-methyltransferase ArmA	NA	NA
NA	NODE_88_length_7531_cov_49.474585	3340	4812	+	msr(E)	ABC-F type ribosomal protection protein Msr(E)	core	AMR	AMR	MACROLIDE/STREPTOGRAMIN	AZITHROMYCIN/ERYTHROMYCIN/STREPTOGRAMIN	EXACTX	491	491	100.00	100.00	491	WP_000052512.1	ABC-F type ribosomal protection protein Msr(E)	NA	NA
NA	NODE_88_length_7531_cov_49.474585	4871	5752	+	mph(E)	Mph(E) family macrolide 2'-phosphotransferase	core	AMR	AMR	MACROLIDE	ERYTHROMYCIN	EXACTX	294	294	100.00	100.00	294	WP_000155092.1	Mph(E) family macrolide 2'-phosphotransferase	NA	NA
NA	NODE_94_length_5998_cov_46.347636	3706	4584	-	blaKPC-2	carbapenem-hydrolyzing class A beta-lactamase KPC-2	core	AMR	AMR	BETA-LACTAM	CARBAPENEM	ALLELEX	293	293	100.00	100.00	293	WP_004199234.1	carbapenem-hydrolyzing class A beta-lactamase KPC-2	NA	NA
NA	NODE_98_length_5189_cov_53.085314	822	1475	-	qnrS1	quinolone resistance pentapeptide repeat protein QnrS1	core	AMR	AMR	QUINOLONE	QUINOLONE	ALLELEX	218	218	100.00	100.00	218	WP_001516695.1	quinolone resistance pentapeptide repeat protein QnrS1	NA	NA
NA	NODE_99_length_5145_cov_62.119057	3864	4676	-	sul2	sulfonamide-resistant dihydropteroate synthase Sul2	core	AMR	AMR	SULFONAMIDE	SULFONAMIDE	EXACTX	271	271	100.00	100.00	271	WP_001043260.1	sulfonamide-resistant dihydropteroate synthase Sul2	NA	NA
