Protein id	Contig id	Start	Stop	Strand	Element symbol	Element name	Scope	Type	Subtype	Class	Subclass	Method	Target length	Reference sequence length	% Coverage of reference	% Identity to reference	Alignment length	Closest reference accession	Closest reference name	HMM accession	HMM description
NA	NODE_18_length_99247_cov_84.501522	58599	59498	+	fieF	CDF family cation-efflux transporter FieF	plus	STRESS	METAL	NA	NA	EXACTX	300	300	100.00	100.00	300	BAB89353.1	CDF family cation-efflux transporter FieF	NA	NA
NA	NODE_22_length_89416_cov_69.838330	54404	57553	-	oqxB19	multidrug efflux RND transporter permease subunit OqxB19	core	AMR	AMR	PHENICOL/QUINOLONE	PHENICOL/QUINOLONE	ALLELEX	1050	1050	100.00	100.00	1050	WP_004149399.1	multidrug efflux RND transporter permease subunit OqxB19	NA	NA
NA	NODE_22_length_89416_cov_69.838330	57580	58752	-	oqxA11	multidrug efflux RND transporter periplasmic adaptor subunit OqxA11	core	AMR	AMR	PHENICOL/QUINOLONE	PHENICOL/QUINOLONE	ALLELEX	391	391	100.00	100.00	391	WP_004212918.1	multidrug efflux RND transporter periplasmic adaptor subunit OqxA11	NA	NA
NA	NODE_23_length_88075_cov_77.467428	64840	65256	-	fosA	FosA5 family fosfomycin resistance glutathione transferase	core	AMR	AMR	FOSFOMYCIN	FOSFOMYCIN	EXACTX	139	139	100.00	100.00	139	WP_009486251.1	FosA5 family fosfomycin resistance glutathione transferase	NA	NA
NA	NODE_28_length_62422_cov_73.917617	6594	8312	+	iucA	aerobactin synthase IucA	plus	VIRULENCE	VIRULENCE	NA	NA	BLASTX	573	576	99.83	90.09	575	EGI25746.1	aerobactin synthase IucA	NA	NA
NA	NODE_28_length_62422_cov_73.917617	8319	9263	+	iucB	N(6)-hydroxylysine O-acetyltransferase IucB	plus	VIRULENCE	VIRULENCE	NA	NA	BLASTX	315	315	100.00	94.60	315	AAN82074.1	N(6)-hydroxylysine O-acetyltransferase IucB	NA	NA
NA	NODE_28_length_62422_cov_73.917617	9266	10996	+	iucC	NIS family aerobactin synthetase IucC	plus	VIRULENCE	VIRULENCE	NA	NA	BLASTX	577	580	99.48	92.72	577	AAN82073.1	NIS family aerobactin synthetase IucC	NA	NA
NA	NODE_28_length_62422_cov_73.917617	12374	14560	+	iutA	ferric aerobactin receptor IutA	plus	VIRULENCE	VIRULENCE	NA	NA	BLASTX	729	731	99.73	89.57	729	AAN45165.2	ferric aerobactin receptor IutA	NA	NA
NA	NODE_28_length_62422_cov_73.917617	42565	43137	-	terE	tellurium resistance cAMP binding protein TerE	plus	STRESS	METAL	TELLURIUM	TELLURIUM	BLASTX	191	191	100.00	98.95	191	AAA98293.1	tellurium resistance cAMP binding protein TerE	NA	NA
NA	NODE_28_length_62422_cov_73.917617	43227	43802	-	terD	tellurium resistance membrane protein TerD	plus	STRESS	METAL	TELLURIUM	TELLURIUM	BLASTX	192	192	100.00	98.96	192	AAA98292.1	tellurium resistance membrane protein TerD	NA	NA
NA	NODE_28_length_62422_cov_73.917617	43844	44881	-	terC	tellurium resistance membrane protein TerC	plus	STRESS	METAL	TELLURIUM	TELLURIUM	BLASTX	346	346	100.00	99.13	346	AAA98291.1	tellurium resistance membrane protein TerC	NA	NA
NA	NODE_28_length_62422_cov_73.917617	44908	45360	-	terB	tellurium resistance membrane protein TerB	plus	STRESS	METAL	TELLURIUM	TELLURIUM	EXACTX	151	151	100.00	100.00	151	ACI12150.1	tellurium resistance membrane protein TerB	NA	NA
NA	NODE_2_length_453061_cov_53.933577	384090	384947	+	blaSHV-1	broad-spectrum class A beta-lactamase SHV-1	core	AMR	AMR	BETA-LACTAM	BETA-LACTAM	ALLELEX	286	286	100.00	100.00	286	WP_001620095.1	broad-spectrum class A beta-lactamase SHV-1	NA	NA
NA	NODE_38_length_33346_cov_77.373975	6094	6441	+	arsR	As(III)-sensing metalloregulatory transcriptional repressor ArsR	plus	STRESS	METAL	ARSENIC	ARSENIC	EXACTX	116	116	100.00	100.00	116	AET17094.1	As(III)-sensing metalloregulatory transcriptional repressor ArsR	NA	NA
NA	NODE_38_length_33346_cov_77.373975	6494	6853	+	arsD	arsenite efflux transporter metallochaperone ArsD	plus	STRESS	METAL	ARSENIC	ARSENITE	BLASTX	120	120	100.00	91.67	120	AAB09625.1	arsenite efflux transporter metallochaperone ArsD	NA	NA
NA	NODE_38_length_33346_cov_77.373975	6874	8622	+	arsA	arsenite efflux transporter ATPase subunit ArsA	plus	STRESS	METAL	ARSENIC	ARSENITE	EXACTX	583	583	100.00	100.00	583	BAA24822.1	arsenite efflux transporter ATPase subunit ArsA	NA	NA
NA	NODE_38_length_33346_cov_77.373975	8673	9959	+	arsB	arsenite efflux transporter membrane subunit ArsB	plus	STRESS	METAL	ARSENIC	ARSENITE	EXACTX	429	429	100.00	100.00	429	BAA24823.1	arsenite efflux transporter membrane subunit ArsB	NA	NA
NA	NODE_38_length_33346_cov_77.373975	9975	10397	+	arsC	glutaredoxin-dependent arsenate reductase	plus	STRESS	METAL	ARSENIC	ARSENATE	EXACTX	141	141	100.00	100.00	141	BAA24824.1	glutaredoxin-dependent arsenate reductase	NA	NA
NA	NODE_3_length_336226_cov_60.913565	263441	265240	-	ybtQ	yersiniabactin ABC transporter ATP-binding/permease protein YbtQ	plus	VIRULENCE	VIRULENCE	NA	NA	BLASTX	600	600	100.00	99.83	600	AAC69584.1	yersiniabactin ABC transporter ATP-binding/permease protein YbtQ	NA	NA
NA	NODE_3_length_336226_cov_60.913565	265230	267029	-	ybtP	yersiniabactin ABC transporter ATP-binding/permease protein YbtP	plus	VIRULENCE	VIRULENCE	NA	NA	BLASTX	600	600	100.00	99.67	600	CAA21388.1	yersiniabactin ABC transporter ATP-binding/permease protein YbtP	NA	NA
NA	NODE_44_length_12625_cov_75.098409	659	1531	+	blaCTX-M-15	extended-spectrum class A beta-lactamase CTX-M-15	core	AMR	AMR	BETA-LACTAM	CEPHALOSPORIN	ALLELEX	291	291	100.00	100.00	291	WP_000239590.1	extended-spectrum class A beta-lactamase CTX-M-15	NA	NA
NA	NODE_44_length_12625_cov_75.098409	6175	6828	+	qnrS1	quinolone resistance pentapeptide repeat protein QnrS1	core	AMR	AMR	QUINOLONE	QUINOLONE	ALLELEX	218	218	100.00	100.00	218	WP_001516695.1	quinolone resistance pentapeptide repeat protein QnrS1	NA	NA
NA	NODE_44_length_12625_cov_75.098409	10709	11485	+	aph(3')-VI	APH(3')-VI family aminoglycoside O-phosphotransferase	core	AMR	AMR	AMINOGLYCOSIDE	AMIKACIN/KANAMYCIN	EXACTX	259	259	100.00	100.00	259	WP_014386410.1	APH(3')-VI family aminoglycoside O-phosphotransferase	NA	NA
NA	NODE_48_length_7518_cov_72.462415	786	1427	-	qnrB1	quinolone resistance pentapeptide repeat protein QnrB1	core	AMR	AMR	QUINOLONE	QUINOLONE	ALLELEX	214	214	100.00	100.00	214	WP_014386481.1	quinolone resistance pentapeptide repeat protein QnrB1	NA	NA
NA	NODE_51_length_6075_cov_75.415449	125	1027	+	mph(A)	Mph(A) family macrolide 2'-phosphotransferase	core	AMR	AMR	MACROLIDE	AZITHROMYCIN/ERYTHROMYCIN/SPIRAMYCIN/TELITHROMYCIN	BLASTX	301	301	100.00	100.00	301	WP_000219391.1	Mph(A) family macrolide 2'-phosphotransferase	NA	NA
NA	NODE_57_length_3867_cov_68.157660	374	1210	-	sul1	sulfonamide-resistant dihydropteroate synthase Sul1	core	AMR	AMR	SULFONAMIDE	SULFONAMIDE	EXACTX	279	279	100.00	100.00	279	WP_000259031.1	sulfonamide-resistant dihydropteroate synthase Sul1	NA	NA
NA	NODE_57_length_3867_cov_68.157660	1207	1551	-	qacEdelta1	quaternary ammonium compound efflux SMR transporter QacE delta 1	core	STRESS	BIOCIDE	QUATERNARY AMMONIUM	QUATERNARY AMMONIUM	ALLELEX	115	115	100.00	100.00	115	WP_000679427.1	quaternary ammonium compound efflux SMR transporter QacE delta 1	NA	NA
NA	NODE_57_length_3867_cov_68.157660	1738	2208	-	dfrA5	trimethoprim-resistant dihydrofolate reductase DfrA5	core	AMR	AMR	TRIMETHOPRIM	TRIMETHOPRIM	EXACTX	157	157	100.00	100.00	157	WP_001317507.1	trimethoprim-resistant dihydrofolate reductase DfrA5	NA	NA
NA	NODE_58_length_3290_cov_72.975580	36	845	+	blaNDM-5	subclass B1 metallo-beta-lactamase NDM-5	core	AMR	AMR	BETA-LACTAM	CARBAPENEM	ALLELEX	270	270	100.00	100.00	270	WP_023408309.1	subclass B1 metallo-beta-lactamase NDM-5	NA	NA
NA	NODE_58_length_3290_cov_72.975580	852	1214	+	ble	bleomycin binding protein Ble-MBL	core	AMR	AMR	BLEOMYCIN	BLEOMYCIN	EXACTX	121	121	100.00	100.00	121	WP_004201167.1	bleomycin binding protein Ble-MBL	NA	NA
NA	NODE_7_length_269061_cov_83.646268	187988	189169	+	emrD	multidrug efflux MFS transporter EmrD	plus	AMR	AMR	EFFLUX	EFFLUX	BLASTX	394	394	100.00	99.24	394	ACN65732.1	multidrug efflux MFS transporter EmrD	NA	NA
