Protein id	Contig id	Start	Stop	Strand	Element symbol	Element name	Scope	Type	Subtype	Class	Subclass	Method	Target length	Reference sequence length	% Coverage of reference	% Identity to reference	Alignment length	Closest reference accession	Closest reference name	HMM accession	HMM description
NA	NODE_12_length_138729_cov_62.446623	46968	47444	+	oqxR_D95E	Klebsiella pneumoniae tigecycline resistant OqxR	core	AMR	POINT	TETRACYCLINE	TIGECYCLINE	POINTX	159	159	100.00	92.45	159	WP_000888203.1	Rrf2 family transcriptional regulator OqxR	NA	NA
NA	NODE_12_length_138729_cov_62.446623	47515	50664	-	oqxB	multidrug efflux RND transporter permease subunit OqxB	core	AMR	AMR	PHENICOL/QUINOLONE	PHENICOL/QUINOLONE	BLASTX	1050	1050	100.00	97.24	1050	WP_012967412.1	multidrug efflux RND transporter permease subunit OqxB9	NA	NA
NA	NODE_12_length_138729_cov_62.446623	50691	51863	-	oqxA	multidrug efflux RND transporter periplasmic adaptor subunit OqxA	core	AMR	AMR	PHENICOL/QUINOLONE	PHENICOL/QUINOLONE	BLASTX	391	391	100.00	92.33	391	WP_002914189.1	multidrug efflux RND transporter periplasmic adaptor subunit OqxA	NA	NA
NA	NODE_17_length_106826_cov_92.051596	85804	86985	-	emrD	multidrug efflux MFS transporter EmrD	plus	AMR	AMR	EFFLUX	EFFLUX	BLASTX	394	394	100.00	96.70	394	ACN65732.1	multidrug efflux MFS transporter EmrD	NA	NA
NA	NODE_18_length_98855_cov_90.061903	50518	51411	+	fieF	CDF family cation-efflux transporter FieF	plus	STRESS	METAL	NA	NA	BLASTX	298	300	99.33	94.30	298	BAB89353.1	CDF family cation-efflux transporter FieF	NA	NA
NA	NODE_19_length_97552_cov_78.550561	81370	82512	+	ampC-Kaer	AmpC-Kaer family extended-spectrum class C beta-lactamase	core	AMR	AMR	BETA-LACTAM	CEPHALOSPORIN	BLASTX	381	381	100.00	97.38	381	WP_063406924.1	extended-spectrum class C beta-lactamase AmpC-Kaer-1	NA	NA
NA	NODE_1_length_746942_cov_68.159541	590321	592951	-	gyrA_S83T	Klebsiella pneumoniae quinolone resistant GyrA	core	AMR	POINT	QUINOLONE	QUINOLONE	POINTX	877	877	100.00	96.47	877	WP_117036963.1	DNA gyrase subunit A GyrA	NA	NA
NA	NODE_7_length_181572_cov_82.862525	148694	149110	-	fosA	FosA5 family fosfomycin resistance glutathione transferase	core	AMR	AMR	FOSFOMYCIN	FOSFOMYCIN	BLASTX	139	139	100.00	97.12	139	WP_114473955.1	fosfomycin resistance glutathione transferase FosA9	NA	NA
