Protein id	Contig id	Start	Stop	Strand	Element symbol	Element name	Scope	Type	Subtype	Class	Subclass	Method	Target length	Reference sequence length	% Coverage of reference	% Identity to reference	Alignment length	Closest reference accession	Closest reference name	HMM accession	HMM description
NA	NODE_17_length_106721_cov_54.384424	52208	53380	+	oqxA	multidrug efflux RND transporter periplasmic adaptor subunit OqxA	core	AMR	AMR	PHENICOL/QUINOLONE	PHENICOL/QUINOLONE	EXACTX	391	391	100.00	100.00	391	WP_002914189.1	multidrug efflux RND transporter periplasmic adaptor subunit OqxA	NA	NA
NA	NODE_17_length_106721_cov_54.384424	53407	56556	+	oqxB20	multidrug efflux RND transporter permease subunit OqxB20	core	AMR	AMR	PHENICOL/QUINOLONE	PHENICOL/QUINOLONE	ALLELEX	1050	1050	100.00	100.00	1050	WP_021312368.1	multidrug efflux RND transporter permease subunit OqxB20	NA	NA
NA	NODE_18_length_100443_cov_57.897757	19294	20475	+	emrD	multidrug efflux MFS transporter EmrD	plus	AMR	AMR	EFFLUX	EFFLUX	BLASTX	394	394	100.00	99.49	394	ACN65732.1	multidrug efflux MFS transporter EmrD	NA	NA
NA	NODE_1_length_524961_cov_47.987718	116985	117842	-	blaSHV-1	broad-spectrum class A beta-lactamase SHV-1	core	AMR	AMR	BETA-LACTAM	BETA-LACTAM	ALLELEX	286	286	100.00	100.00	286	WP_001620095.1	broad-spectrum class A beta-lactamase SHV-1	NA	NA
NA	NODE_20_length_99532_cov_56.997276	39753	40652	-	fieF	CDF family cation-efflux transporter FieF	plus	STRESS	METAL	NA	NA	EXACTX	300	300	100.00	100.00	300	BAB89353.1	CDF family cation-efflux transporter FieF	NA	NA
NA	NODE_24_length_81021_cov_55.297471	13929	14345	+	fosA	FosA5 family fosfomycin resistance glutathione transferase	core	AMR	AMR	FOSFOMYCIN	FOSFOMYCIN	BLASTX	139	139	100.00	98.56	139	WP_114473955.1	fosfomycin resistance glutathione transferase FosA9	NA	NA
NA	NODE_49_length_7569_cov_56.579319	5461	5931	-	dfrA14	trimethoprim-resistant dihydrofolate reductase DfrA14	core	AMR	AMR	TRIMETHOPRIM	TRIMETHOPRIM	EXACTX	157	157	100.00	100.00	157	WP_004201280.1	trimethoprim-resistant dihydrofolate reductase DfrA14	NA	NA
NA	NODE_4_length_320061_cov_53.536515	11094	12893	-	ybtQ	yersiniabactin ABC transporter ATP-binding/permease protein YbtQ	plus	VIRULENCE	VIRULENCE	NA	NA	BLASTX	600	600	100.00	99.83	600	AAC69584.1	yersiniabactin ABC transporter ATP-binding/permease protein YbtQ	NA	NA
NA	NODE_4_length_320061_cov_53.536515	12883	14682	-	ybtP	yersiniabactin ABC transporter ATP-binding/permease protein YbtP	plus	VIRULENCE	VIRULENCE	NA	NA	BLASTX	600	600	100.00	99.83	600	CAA21388.1	yersiniabactin ABC transporter ATP-binding/permease protein YbtP	NA	NA
NA	NODE_4_length_320061_cov_53.536515	304063	305163	-	ompK36_D135DGD	Klebsiella pneumoniae carbapenem resistant OmpK36	core	AMR	POINT	BETA-LACTAM	CARBAPENEM	POINTX	367	367	100.00	94.86	370	WP_002913005.1	outer membrane porin OmpK36	NA	NA
NA	NODE_4_length_320061_cov_53.536515	312275	314905	-	gyrA_D87N	Klebsiella pneumoniae quinolone resistant GyrA	core	AMR	POINT	QUINOLONE	QUINOLONE	POINTX	877	877	100.00	99.66	877	WP_117036963.1	DNA gyrase subunit A GyrA	NA	NA
NA	NODE_4_length_320061_cov_53.536515	312275	314905	-	gyrA_S83Y	Klebsiella pneumoniae quinolone resistant GyrA	core	AMR	POINT	QUINOLONE	QUINOLONE	POINTX	877	877	100.00	99.66	877	WP_117036963.1	DNA gyrase subunit A GyrA	NA	NA
NA	NODE_51_length_5432_cov_51.967268	149	382	-	merE	broad-spectrum mercury transporter MerE	plus	STRESS	METAL	MERCURY	MERCURY	BLASTX	78	78	100.00	96.15	78	AAC38236.1	broad-spectrum mercury transporter MerE	NA	NA
NA	NODE_51_length_5432_cov_51.967268	382	744	-	merD	mercury resistance co-regulator MerD	plus	STRESS	METAL	MERCURY	MERCURY	BLASTX	121	121	100.00	90.08	121	AAC38221.1	mercury resistance co-regulator MerD	NA	NA
NA	NODE_51_length_5432_cov_51.967268	765	2447	-	merA	mercury(II) reductase	plus	STRESS	METAL	MERCURY	MERCURY	BLASTX	561	561	100.00	93.23	561	ACU65296.1	mercury(II) reductase	NA	NA
NA	NODE_51_length_5432_cov_51.967268	3233	3577	-	merT	mercuric transport protein MerT	plus	STRESS	METAL	MERCURY	MERCURY	BLASTX	115	116	99.14	98.26	115	CAA70196.1	mercuric transport protein MerT	NA	NA
NA	NODE_51_length_5432_cov_51.967268	3667	4092	+	merR	mercury resistance transcriptional regulator MerR	plus	STRESS	METAL	MERCURY	MERCURY	BLASTX	142	144	98.61	92.96	142	CAA77320.1	mercury resistance transcriptional regulator MerR	NA	NA
NA	NODE_52_length_5167_cov_62.488850	1221	1772	+	aac(6')-Ib	AAC(6')-Ib family aminoglycoside 6'-N-acetyltransferase	core	AMR	AMR	AMINOGLYCOSIDE	AMIKACIN/KANAMYCIN/TOBRAMYCIN	EXACTX	184	184	100.00	100.00	184	WP_063840280.1	AAC(6')-Ib family aminoglycoside 6'-N-acetyltransferase	NA	NA
NA	NODE_52_length_5167_cov_62.488850	1845	2630	+	aadA1	ANT(3'')-Ia family aminoglycoside nucleotidyltransferase AadA1	core	AMR	AMR	AMINOGLYCOSIDE	STREPTOMYCIN	EXACTX	262	262	100.00	100.00	262	WP_001206315.1	ANT(3'')-Ia family aminoglycoside nucleotidyltransferase AadA1	NA	NA
NA	NODE_52_length_5167_cov_62.488850	2693	3514	+	blaOXA-9	oxacillin-hydrolyzing class D beta-lactamase OXA-9	core	AMR	AMR	BETA-LACTAM	BETA-LACTAM	ALLELEX	274	274	100.00	100.00	274	WP_000722315.1	oxacillin-hydrolyzing class D beta-lactamase OXA-9	NA	NA
NA	NODE_52_length_5167_cov_62.488850	4217	5074	+	blaTEM-1	broad-spectrum class A beta-lactamase TEM-1	core	AMR	AMR	BETA-LACTAM	BETA-LACTAM	ALLELEX	286	286	100.00	100.00	286	WP_000027057.1	broad-spectrum class A beta-lactamase TEM-1	NA	NA
NA	NODE_57_length_2231_cov_68.639108	26	820	+	blaOXA-48	OXA-48 family carbapenem-hydrolyzing class D beta-lactamase OXA-48	core	AMR	AMR	BETA-LACTAM	CARBAPENEM	ALLELEX	265	265	100.00	100.00	265	WP_015059991.1	OXA-48 family carbapenem-hydrolyzing class D beta-lactamase OXA-48	NA	NA
NA	NODE_7_length_256840_cov_55.034990	141590	143632	-	parC_S80I	Klebsiella pneumoniae quinolone resistant ParC	core	AMR	POINT	QUINOLONE	QUINOLONE	POINTX	681	689	98.84	99.27	681	WP_101982161.1	DNA topoisomerase IV subunit A ParC	NA	NA
