Protein id	Contig id	Start	Stop	Strand	Element symbol	Element name	Scope	Type	Subtype	Class	Subclass	Method	Target length	Reference sequence length	% Coverage of reference	% Identity to reference	Alignment length	Closest reference accession	Closest reference name	HMM accession	HMM description
NA	NODE_100_length_961_cov_82.409492	112	900	-	aadA1	ANT(3'')-Ia family aminoglycoside nucleotidyltransferase AadA1	core	AMR	AMR	AMINOGLYCOSIDE	STREPTOMYCIN	EXACTX	263	263	100.00	100.00	263	WP_001206316.1	ANT(3'')-Ia family aminoglycoside nucleotidyltransferase AadA1	NA	NA
NA	NODE_107_length_768_cov_70.914446	106	657	-	dfrA18	trimethoprim-resistant dihydrofolate reductase DfrA18	core	AMR	AMR	TRIMETHOPRIM	TRIMETHOPRIM	BLASTX	184	184	100.00	99.46	184	WP_001031075.1	trimethoprim-resistant dihydrofolate reductase DfrA18	NA	NA
NA	NODE_12_length_160411_cov_69.444598	105880	107052	+	oqxA	multidrug efflux RND transporter periplasmic adaptor subunit OqxA	core	AMR	AMR	PHENICOL/QUINOLONE	PHENICOL/QUINOLONE	EXACTX	391	391	100.00	100.00	391	WP_002914189.1	multidrug efflux RND transporter periplasmic adaptor subunit OqxA	NA	NA
NA	NODE_12_length_160411_cov_69.444598	107079	110228	+	oqxB	multidrug efflux RND transporter permease subunit OqxB	core	AMR	AMR	PHENICOL/QUINOLONE	PHENICOL/QUINOLONE	BLASTX	1050	1050	100.00	99.90	1050	WP_016947602.1	multidrug efflux RND transporter permease subunit OqxB25	NA	NA
NA	NODE_1_length_435540_cov_59.239767	65836	66693	-	blaSHV-11	broad-spectrum class A beta-lactamase SHV-11	core	AMR	AMR	BETA-LACTAM	BETA-LACTAM	ALLELEX	286	286	100.00	100.00	286	WP_004176269.1	broad-spectrum class A beta-lactamase SHV-11	NA	NA
NA	NODE_21_length_98319_cov_71.880791	58667	59566	+	fieF	CDF family cation-efflux transporter FieF	plus	STRESS	METAL	NA	NA	EXACTX	300	300	100.00	100.00	300	BAB89353.1	CDF family cation-efflux transporter FieF	NA	NA
NA	NODE_23_length_95433_cov_64.405104	39475	39948	+	dfrA50	trimethoprim-resistant dihydrofolate reductase DfrA50	core	AMR	AMR	TRIMETHOPRIM	TRIMETHOPRIM	BLASTX	158	158	100.00	98.73	158	WP_040203768.1	trimethoprim-resistant dihydrofolate reductase DfrA50	NA	NA
NA	NODE_29_length_79562_cov_70.678557	13836	14249	+	fosA	FosA5 family fosfomycin resistance glutathione transferase	core	AMR	AMR	FOSFOMYCIN	FOSFOMYCIN	BLASTX	138	139	99.28	99.28	138	WP_004146118.1	FosA5 family fosfomycin resistance glutathione transferase	NA	NA
NA	NODE_3_length_304238_cov_62.168254	117763	120393	+	gyrA_S83I	Klebsiella pneumoniae quinolone resistant GyrA	core	AMR	POINT	QUINOLONE	QUINOLONE	POINTX	877	877	100.00	99.66	877	WP_117036963.1	DNA gyrase subunit A GyrA	NA	NA
NA	NODE_40_length_33816_cov_75.093481	2874	3221	+	arsR	As(III)-sensing metalloregulatory transcriptional repressor ArsR	plus	STRESS	METAL	ARSENIC	ARSENIC	EXACTX	116	116	100.00	100.00	116	AET17094.1	As(III)-sensing metalloregulatory transcriptional repressor ArsR	NA	NA
NA	NODE_40_length_33816_cov_75.093481	3274	3633	+	arsD	arsenite efflux transporter metallochaperone ArsD	plus	STRESS	METAL	ARSENIC	ARSENITE	BLASTX	120	120	100.00	91.67	120	AAB09625.1	arsenite efflux transporter metallochaperone ArsD	NA	NA
NA	NODE_40_length_33816_cov_75.093481	3654	5402	+	arsA	arsenite efflux transporter ATPase subunit ArsA	plus	STRESS	METAL	ARSENIC	ARSENITE	EXACTX	583	583	100.00	100.00	583	BAA24822.1	arsenite efflux transporter ATPase subunit ArsA	NA	NA
NA	NODE_40_length_33816_cov_75.093481	5453	6739	+	arsB	arsenite efflux transporter membrane subunit ArsB	plus	STRESS	METAL	ARSENIC	ARSENITE	EXACTX	429	429	100.00	100.00	429	BAA24823.1	arsenite efflux transporter membrane subunit ArsB	NA	NA
NA	NODE_40_length_33816_cov_75.093481	6755	7177	+	arsC	glutaredoxin-dependent arsenate reductase	plus	STRESS	METAL	ARSENIC	ARSENATE	EXACTX	141	141	100.00	100.00	141	BAA24824.1	glutaredoxin-dependent arsenate reductase	NA	NA
NA	NODE_40_length_33816_cov_75.093481	15219	15650	-	pcoE	copper resistance system metallochaperone PcoE	plus	STRESS	METAL	COPPER	COPPER	BLASTX	144	144	100.00	94.44	144	CAA58532.1	copper resistance system metallochaperone PcoE	NA	NA
NA	NODE_40_length_33816_cov_75.093481	15870	17267	-	pcoS	copper resistance membrane spanning protein PcoS	plus	STRESS	METAL	COPPER	COPPER	BLASTX	466	466	100.00	99.14	466	CAA58530.1	copper resistance membrane spanning protein PcoS	NA	NA
NA	NODE_40_length_33816_cov_75.093481	17267	17944	-	pcoR	copper response regulator transcription factor PcoR	plus	STRESS	METAL	COPPER	COPPER	EXACTX	226	226	100.00	100.00	226	CAA58529.1	copper response regulator transcription factor PcoR	NA	NA
NA	NODE_40_length_33816_cov_75.093481	18002	18928	-	pcoD	copper resistance inner membrane protein PcoD	plus	STRESS	METAL	COPPER	COPPER	BLASTX	309	309	100.00	99.68	309	CAA58528.1	copper resistance inner membrane protein PcoD	NA	NA
NA	NODE_40_length_33816_cov_75.093481	18936	19313	-	pcoC	copper resistance system metallochaperone PcoC	plus	STRESS	METAL	COPPER	COPPER	EXACTX	126	126	100.00	100.00	126	CAA58527.1	copper resistance system metallochaperone PcoC	NA	NA
NA	NODE_40_length_33816_cov_75.093481	19356	20243	-	pcoB	copper-binding protein PcoB	plus	STRESS	METAL	COPPER	COPPER	EXACTX	296	296	100.00	100.00	296	CAA58526.1	copper-binding protein PcoB	NA	NA
NA	NODE_40_length_33816_cov_75.093481	20252	22066	-	pcoA	multicopper oxidase PcoA	plus	STRESS	METAL	COPPER	COPPER	EXACTX	605	605	100.00	100.00	605	CAA58525.1	multicopper oxidase PcoA	NA	NA
NA	NODE_40_length_33816_cov_75.093481	24050	26515	-	silP	Ag(+)-translocating P-type ATPase SilP	plus	STRESS	METAL	SILVER	SILVER	BLASTX	822	824	99.64	94.53	823	AAD11750.1	Ag(+)-translocating P-type ATPase SilP	NA	NA
NA	NODE_40_length_33816_cov_75.093481	27151	30294	-	silA	Cu(+)/Ag(+) efflux RND transporter permease subunit SilA	plus	STRESS	METAL	COPPER/SILVER	COPPER/SILVER	BLASTX	1048	1048	100.00	98.85	1048	AAD11749.1	Cu(+)/Ag(+) efflux RND transporter permease subunit SilA	NA	NA
NA	NODE_40_length_33816_cov_75.093481	30308	31597	-	silB	Cu(+)/Ag(+) efflux RND transporter periplasmic adaptor subunit SilB	plus	STRESS	METAL	COPPER/SILVER	COPPER/SILVER	BLASTX	430	430	100.00	97.67	430	AAD11748.1	Cu(+)/Ag(+) efflux RND transporter periplasmic adaptor subunit SilB	NA	NA
NA	NODE_40_length_33816_cov_75.093481	31714	32064	-	silF	Cu(+)/Ag(+) efflux RND transporter periplasmic metallochaperone SilF	plus	STRESS	METAL	COPPER/SILVER	COPPER/SILVER	BLASTX	117	117	100.00	99.15	117	KGL71342.1	Cu(+)/Ag(+) efflux RND transporter periplasmic metallochaperone SilF	NA	NA
NA	NODE_40_length_33816_cov_75.093481	32096	33478	-	silC	Cu(+)/Ag(+) efflux RND transporter outer membrane channel SilC	plus	STRESS	METAL	COPPER/SILVER	COPPER/SILVER	EXACTX	461	461	100.00	100.00	461	SPD96884.1	Cu(+)/Ag(+) efflux RND transporter outer membrane channel SilC	NA	NA
NA	NODE_48_length_11683_cov_76.192122	6692	9478	-	clpK	heat shock survival AAA family ATPase ClpK	plus	STRESS	HEAT	NA	NA	BLASTX	929	949	97.89	99.25	929	ASF80763.1	heat shock survival AAA family ATPase ClpK	NA	NA
NA	NODE_48_length_11683_cov_76.192122	9596	10162	-	hsp20	small heat shock protein sHSP20	plus	STRESS	HEAT	NA	NA	EXACTX	189	189	100.00	100.00	189	CDY80020.1	small heat shock protein sHSP20	NA	NA
NA	NODE_53_length_10824_cov_124.572569	111	455	+	qacEdelta1	quaternary ammonium compound efflux SMR transporter QacE delta 1	core	STRESS	BIOCIDE	QUATERNARY AMMONIUM	QUATERNARY AMMONIUM	ALLELEX	115	115	100.00	100.00	115	WP_000679427.1	quaternary ammonium compound efflux SMR transporter QacE delta 1	NA	NA
NA	NODE_53_length_10824_cov_124.572569	452	1288	+	sul1	sulfonamide-resistant dihydropteroate synthase Sul1	core	AMR	AMR	SULFONAMIDE	SULFONAMIDE	EXACTX	279	279	100.00	100.00	279	WP_000259031.1	sulfonamide-resistant dihydropteroate synthase Sul1	NA	NA
NA	NODE_53_length_10824_cov_124.572569	7568	8209	-	qnrB10	quinolone resistance pentapeptide repeat protein QnrB10	core	AMR	AMR	QUINOLONE	QUINOLONE	ALLELEX	214	214	100.00	100.00	214	WP_032492467.1	quinolone resistance pentapeptide repeat protein QnrB10	NA	NA
NA	NODE_53_length_10824_cov_124.572569	8912	9256	+	qacEdelta1	quaternary ammonium compound efflux SMR transporter QacE delta 1	core	STRESS	BIOCIDE	QUATERNARY AMMONIUM	QUATERNARY AMMONIUM	ALLELEX	115	115	100.00	100.00	115	WP_000679427.1	quaternary ammonium compound efflux SMR transporter QacE delta 1	NA	NA
NA	NODE_53_length_10824_cov_124.572569	9253	10089	+	sul1	sulfonamide-resistant dihydropteroate synthase Sul1	core	AMR	AMR	SULFONAMIDE	SULFONAMIDE	EXACTX	279	279	100.00	100.00	279	WP_000259031.1	sulfonamide-resistant dihydropteroate synthase Sul1	NA	NA
NA	NODE_54_length_9933_cov_80.238814	6466	6810	-	merT	mercuric transport protein MerT	plus	STRESS	METAL	MERCURY	MERCURY	BLASTX	115	116	99.14	99.13	115	CAA70196.1	mercuric transport protein MerT	NA	NA
NA	NODE_54_length_9933_cov_80.238814	6900	7325	+	merR	mercury resistance transcriptional regulator MerR	plus	STRESS	METAL	MERCURY	MERCURY	BLASTX	142	144	98.61	92.96	142	CAA77320.1	mercury resistance transcriptional regulator MerR	NA	NA
NA	NODE_63_length_4643_cov_79.350480	452	1924	+	msr(E)	ABC-F type ribosomal protection protein Msr(E)	core	AMR	AMR	MACROLIDE/STREPTOGRAMIN	AZITHROMYCIN/ERYTHROMYCIN/STREPTOGRAMIN	EXACTX	491	491	100.00	100.00	491	WP_000052512.1	ABC-F type ribosomal protection protein Msr(E)	NA	NA
NA	NODE_63_length_4643_cov_79.350480	1983	2864	+	mph(E)	Mph(E) family macrolide 2'-phosphotransferase	core	AMR	AMR	MACROLIDE	ERYTHROMYCIN	EXACTX	294	294	100.00	100.00	294	WP_000155092.1	Mph(E) family macrolide 2'-phosphotransferase	NA	NA
NA	NODE_65_length_4191_cov_88.562137	1396	1824	-	silE	silver-binding protein SilE	plus	STRESS	METAL	SILVER	SILVER	BLASTX	143	143	100.00	91.61	143	AAD11743.1	silver-binding protein SilE	NA	NA
NA	NODE_65_length_4191_cov_88.562137	2078	3550	-	silS	copper/silver sensor histidine kinase SilS	plus	STRESS	METAL	COPPER/SILVER	COPPER/SILVER	EXACTX	491	491	100.00	100.00	491	SPD96882.1	copper/silver sensor histidine kinase SilS	NA	NA
NA	NODE_65_length_4191_cov_88.562137	3546	4175	-	silR	copper/silver response regulator transcription factor SilR	plus	STRESS	METAL	COPPER/SILVER	COPPER/SILVER	BLASTX	210	226	92.92	95.71	210	SPD96883.1	copper/silver response regulator transcription factor SilR	NA	NA
NA	NODE_68_length_3669_cov_135.671555	2694	3566	-	blaCTX-M-15	extended-spectrum class A beta-lactamase CTX-M-15	core	AMR	AMR	BETA-LACTAM	CEPHALOSPORIN	ALLELEX	291	291	100.00	100.00	291	WP_000239590.1	extended-spectrum class A beta-lactamase CTX-M-15	NA	NA
NA	NODE_6_length_203800_cov_75.591430	79896	81077	-	emrD	multidrug efflux MFS transporter EmrD	plus	AMR	AMR	EFFLUX	EFFLUX	BLASTX	394	394	100.00	99.75	394	ACN65732.1	multidrug efflux MFS transporter EmrD	NA	NA
NA	NODE_70_length_3407_cov_77.926014	2249	3031	-	blaOXA-163	OXA-48 family extended-spectrum class D beta-lactamase OXA-163	core	AMR	AMR	BETA-LACTAM	CEPHALOSPORIN	ALLELEX	261	261	100.00	100.00	261	WP_063131934.1	OXA-48 family extended-spectrum class D beta-lactamase OXA-163	NA	NA
NA	NODE_73_length_2911_cov_82.435924	1738	2232	-	dfrA33	trimethoprim-resistant dihydrofolate reductase DfrA33	core	AMR	AMR	TRIMETHOPRIM	TRIMETHOPRIM	EXACTX	165	165	100.00	100.00	165	WP_071846242.1	trimethoprim-resistant dihydrofolate reductase DfrA33	NA	NA
NA	NODE_74_length_2858_cov_89.889404	1331	2173	+	floR	chloramphenicol/florfenicol efflux MFS transporter FloR	core	AMR	AMR	PHENICOL	CHLORAMPHENICOL/FLORFENICOL	PARTIALX	281	404	69.55	100.00	281	WP_000214119.1	chloramphenicol/florfenicol efflux MFS transporter FloR	NA	NA
NA	NODE_75_length_2842_cov_74.945102	78	719	+	qnrE1	quinolone resistance pentapeptide repeat protein QnrE1	core	AMR	AMR	QUINOLONE	QUINOLONE	ALLELEX	214	214	100.00	100.00	214	WP_061586512.1	quinolone resistance pentapeptide repeat protein QnrE1	NA	NA
NA	NODE_76_length_2705_cov_135.587170	95	952	+	aac(3)-IIe	aminoglycoside N-acetyltransferase AAC(3)-IIe	core	AMR	AMR	AMINOGLYCOSIDE	GENTAMICIN	EXACTX	286	286	100.00	100.00	286	WP_000557452.1	aminoglycoside N-acetyltransferase AAC(3)-IIe	NA	NA
NA	NODE_82_length_2176_cov_229.484677	3	1172	-	tet(A)	tetracycline efflux MFS transporter Tet(A)	core	AMR	AMR	TETRACYCLINE	TETRACYCLINE	BLASTX	390	399	97.74	100.00	390	WP_000804063.1	tetracycline efflux MFS transporter Tet(A)	NA	NA
NA	NODE_87_length_1478_cov_158.638089	46	879	-	aph(6)-Id	aminoglycoside O-phosphotransferase APH(6)-Id	core	AMR	AMR	AMINOGLYCOSIDE	STREPTOMYCIN	EXACTX	278	278	100.00	100.00	278	WP_000480968.1	aminoglycoside O-phosphotransferase APH(6)-Id	NA	NA
NA	NODE_87_length_1478_cov_158.638089	882	1478	-	aph(3'')-Ib	aminoglycoside O-phosphotransferase APH(3'')-Ib	core	AMR	AMR	AMINOGLYCOSIDE	STREPTOMYCIN	PARTIAL_CONTIG_ENDX	199	267	74.53	100.00	199	WP_001082319.1	aminoglycoside O-phosphotransferase APH(3'')-Ib	NA	NA
NA	NODE_93_length_1150_cov_167.888584	36	848	-	sul2	sulfonamide-resistant dihydropteroate synthase Sul2	core	AMR	AMR	SULFONAMIDE	SULFONAMIDE	EXACTX	271	271	100.00	100.00	271	WP_001043260.1	sulfonamide-resistant dihydropteroate synthase Sul2	NA	NA
NA	NODE_9_length_183823_cov_69.912613	100305	102347	+	parC_S80I	Klebsiella pneumoniae quinolone resistant ParC	core	AMR	POINT	QUINOLONE	QUINOLONE	POINTX	681	689	98.84	99.41	681	WP_101982161.1	DNA topoisomerase IV subunit A ParC	NA	NA
