Protein id	Contig id	Start	Stop	Strand	Element symbol	Element name	Scope	Type	Subtype	Class	Subclass	Method	Target length	Reference sequence length	% Coverage of reference	% Identity to reference	Alignment length	Closest reference accession	Closest reference name	HMM accession	HMM description
NA	NODE_1_length_325901_cov_52.514031	117786	120416	+	gyrA_D87N	Klebsiella pneumoniae quinolone resistant GyrA	core	AMR	POINT	QUINOLONE	QUINOLONE	POINTX	877	877	100.00	99.66	877	WP_117036963.1	DNA gyrase subunit A GyrA	NA	NA
NA	NODE_1_length_325901_cov_52.514031	117786	120416	+	gyrA_S83F	Klebsiella pneumoniae quinolone resistant GyrA	core	AMR	POINT	QUINOLONE	QUINOLONE	POINTX	877	877	100.00	99.66	877	WP_117036963.1	DNA gyrase subunit A GyrA	NA	NA
NA	NODE_25_length_94351_cov_62.651162	39750	40649	-	fieF	CDF family cation-efflux transporter FieF	plus	STRESS	METAL	NA	NA	EXACTX	300	300	100.00	100.00	300	BAB89353.1	CDF family cation-efflux transporter FieF	NA	NA
NA	NODE_28_length_88478_cov_59.188435	56448	58490	-	parC_S80I	Klebsiella pneumoniae quinolone resistant ParC	core	AMR	POINT	QUINOLONE	QUINOLONE	POINTX	681	689	98.84	99.41	681	WP_101982161.1	DNA topoisomerase IV subunit A ParC	NA	NA
NA	NODE_2_length_273436_cov_47.349626	68190	69047	-	blaSHV-1	broad-spectrum class A beta-lactamase SHV-1	core	AMR	AMR	BETA-LACTAM	BETA-LACTAM	ALLELEX	286	286	100.00	100.00	286	WP_001620095.1	broad-spectrum class A beta-lactamase SHV-1	NA	NA
NA	NODE_30_length_86078_cov_59.238320	13870	14283	+	fosA	FosA5 family fosfomycin resistance glutathione transferase	core	AMR	AMR	FOSFOMYCIN	FOSFOMYCIN	BLASTX	138	139	99.28	100.00	138	WP_004146118.1	FosA5 family fosfomycin resistance glutathione transferase	NA	NA
NA	NODE_36_length_56656_cov_55.670147	50160	53309	-	oqxB5	multidrug efflux RND transporter permease subunit OqxB5	core	AMR	AMR	PHENICOL/QUINOLONE	PHENICOL/QUINOLONE	ALLELEX	1050	1050	100.00	100.00	1050	WP_004174783.1	multidrug efflux RND transporter permease subunit OqxB5	NA	NA
NA	NODE_36_length_56656_cov_55.670147	53336	54508	-	oqxA	multidrug efflux RND transporter periplasmic adaptor subunit OqxA	core	AMR	AMR	PHENICOL/QUINOLONE	PHENICOL/QUINOLONE	EXACTX	391	391	100.00	100.00	391	WP_002914189.1	multidrug efflux RND transporter periplasmic adaptor subunit OqxA	NA	NA
NA	NODE_39_length_44023_cov_54.665234	98	970	+	blaCTX-M-14	extended-spectrum class A beta-lactamase CTX-M-14	core	AMR	AMR	BETA-LACTAM	CEPHALOSPORIN	ALLELEX	291	291	100.00	100.00	291	WP_001617865.1	extended-spectrum class A beta-lactamase CTX-M-14	NA	NA
NA	NODE_44_length_34535_cov_60.222100	33222	34364	-	blaCMY-4	extended-spectrum class C beta-lactamase CMY-4	core	AMR	AMR	BETA-LACTAM	CEPHALOSPORIN	ALLELEX	381	381	100.00	100.00	381	WP_015056382.1	extended-spectrum class C beta-lactamase CMY-4	NA	NA
NA	NODE_49_length_27758_cov_58.798181	26624	27436	+	sul2	sulfonamide-resistant dihydropteroate synthase Sul2	core	AMR	AMR	SULFONAMIDE	SULFONAMIDE	EXACTX	271	271	100.00	100.00	271	WP_001043260.1	sulfonamide-resistant dihydropteroate synthase Sul2	NA	NA
NA	NODE_56_length_14417_cov_56.085155	2	739	+	aph(6)-Id	aminoglycoside O-phosphotransferase APH(6)-Id	core	AMR	AMR	AMINOGLYCOSIDE	STREPTOMYCIN	PARTIAL_CONTIG_ENDX	246	278	88.49	100.00	246	WP_000480968.1	aminoglycoside O-phosphotransferase APH(6)-Id	NA	NA
NA	NODE_59_length_5584_cov_66.682221	57	527	-	dfrA30	trimethoprim-resistant dihydrofolate reductase DfrA30	core	AMR	AMR	TRIMETHOPRIM	TRIMETHOPRIM	BLASTX	157	157	100.00	99.36	157	WP_063844408.1	trimethoprim-resistant dihydrofolate reductase DfrA30	NA	NA
NA	NODE_5_length_181784_cov_63.829972	79957	81138	-	emrD	multidrug efflux MFS transporter EmrD	plus	AMR	AMR	EFFLUX	EFFLUX	BLASTX	394	394	100.00	99.49	394	ACN65732.1	multidrug efflux MFS transporter EmrD	NA	NA
NA	NODE_60_length_4684_cov_57.788075	3395	3724	-	qacE	quaternary ammonium compound efflux SMR transporter QacE	core	STRESS	BIOCIDE	QUATERNARY AMMONIUM	QUATERNARY AMMONIUM	BLASTX	110	110	100.00	98.18	110	WP_010890145.1	quaternary ammonium compound efflux SMR transporter QacE	NA	NA
NA	NODE_61_length_4663_cov_52.834201	3013	3432	-	merC	organomercurial transporter MerC	plus	STRESS	METAL	MERCURY	ORGANOMERCURY	EXACTX	140	140	100.00	100.00	140	AAC33908.1	organomercurial transporter MerC	NA	NA
NA	NODE_61_length_4663_cov_52.834201	3471	3743	-	merP	mercury resistance system periplasmic binding protein MerP	plus	STRESS	METAL	MERCURY	MERCURY	BLASTX	91	91	100.00	90.11	91	AAC38219.1	mercury resistance system periplasmic binding protein MerP	NA	NA
NA	NODE_61_length_4663_cov_52.834201	3760	4107	-	merT	mercuric transport protein MerT	plus	STRESS	METAL	MERCURY	MERCURY	EXACTX	116	116	100.00	100.00	116	AAB59075.1	mercuric transport protein MerT	NA	NA
NA	NODE_61_length_4663_cov_52.834201	4179	4610	+	merR	mercury resistance transcriptional regulator MerR	plus	STRESS	METAL	MERCURY	MERCURY	BLASTX	144	144	100.00	93.75	144	CAA77320.1	mercury resistance transcriptional regulator MerR	NA	NA
NA	NODE_63_length_2898_cov_58.875835	67	597	+	ant(2'')-Ia	aminoglycoside nucleotidyltransferase ANT(2'')-Ia	core	AMR	AMR	AMINOGLYCOSIDE	GENTAMICIN/KANAMYCIN/TOBRAMYCIN	EXACTX	177	177	100.00	100.00	177	WP_000381802.1	aminoglycoside nucleotidyltransferase ANT(2'')-Ia	NA	NA
NA	NODE_63_length_2898_cov_58.875835	1561	2817	+	cmlA5	chloramphenicol efflux MFS transporter CmlA5	core	AMR	AMR	PHENICOL	CHLORAMPHENICOL	EXACTX	419	419	100.00	100.00	419	WP_012300772.1	chloramphenicol efflux MFS transporter CmlA5	NA	NA
NA	NODE_64_length_2383_cov_52.255155	1474	2250	-	aph(3')-VIb	aminoglycoside O-phosphotransferase APH(3')-VIb	core	AMR	AMR	AMINOGLYCOSIDE	AMIKACIN/KANAMYCIN	BLASTX	259	259	100.00	98.84	259	WP_000422633.1	aminoglycoside O-phosphotransferase APH(3')-VIb	NA	NA
NA	NODE_66_length_1999_cov_56.407407	1104	1898	-	blaOXA-204	OXA-48 family carbapenem-hydrolyzing class D beta-lactamase OXA-204	core	AMR	AMR	BETA-LACTAM	CARBAPENEM	ALLELEX	265	265	100.00	100.00	265	WP_032495449.1	OXA-48 family carbapenem-hydrolyzing class D beta-lactamase OXA-204	NA	NA
NA	NODE_68_length_1600_cov_57.064725	668	1324	-	catA1	type A-1 chloramphenicol O-acetyltransferase	core	AMR	AMR	PHENICOL	CHLORAMPHENICOL	EXACTX	219	219	100.00	100.00	219	WP_000412211.1	type A-1 chloramphenicol O-acetyltransferase	NA	NA
NA	NODE_77_length_1059_cov_116.453187	2	1057	+	tet(A)	tetracycline efflux MFS transporter Tet(A)	core	AMR	AMR	TETRACYCLINE	TETRACYCLINE	PARTIAL_CONTIG_ENDX	352	399	88.22	100.00	352	WP_000804063.1	tetracycline efflux MFS transporter Tet(A)	NA	NA
NA	NODE_82_length_749_cov_171.250720	1	597	+	aph(3'')-Ib	aminoglycoside O-phosphotransferase APH(3'')-Ib	core	AMR	AMR	AMINOGLYCOSIDE	STREPTOMYCIN	PARTIAL_CONTIG_ENDX	199	267	74.53	100.00	199	WP_001082319.1	aminoglycoside O-phosphotransferase APH(3'')-Ib	NA	NA
