Protein id	Contig id	Start	Stop	Strand	Element symbol	Element name	Scope	Type	Subtype	Class	Subclass	Method	Target length	Reference sequence length	% Coverage of reference	% Identity to reference	Alignment length	Closest reference accession	Closest reference name	HMM accession	HMM description
NA	NODE_20_length_100924_cov_61.196770	19296	20477	+	emrD	multidrug efflux MFS transporter EmrD	plus	AMR	AMR	EFFLUX	EFFLUX	BLASTX	394	394	100.00	99.49	394	ACN65732.1	multidrug efflux MFS transporter EmrD	NA	NA
NA	NODE_21_length_99358_cov_57.821989	39753	40652	-	fieF	CDF family cation-efflux transporter FieF	plus	STRESS	METAL	NA	NA	EXACTX	300	300	100.00	100.00	300	BAB89353.1	CDF family cation-efflux transporter FieF	NA	NA
NA	NODE_23_length_93387_cov_56.416620	22337	22750	+	fosA	FosA5 family fosfomycin resistance glutathione transferase	core	AMR	AMR	FOSFOMYCIN	FOSFOMYCIN	BLASTX	138	139	99.28	99.28	138	WP_004146118.1	FosA5 family fosfomycin resistance glutathione transferase	NA	NA
NA	NODE_24_length_89896_cov_54.343240	54847	57996	-	oqxB25	multidrug efflux RND transporter permease subunit OqxB25	core	AMR	AMR	PHENICOL/QUINOLONE	PHENICOL/QUINOLONE	ALLELEX	1050	1050	100.00	100.00	1050	WP_016947602.1	multidrug efflux RND transporter permease subunit OqxB25	NA	NA
NA	NODE_24_length_89896_cov_54.343240	58023	59195	-	oqxA	multidrug efflux RND transporter periplasmic adaptor subunit OqxA	core	AMR	AMR	PHENICOL/QUINOLONE	PHENICOL/QUINOLONE	EXACTX	391	391	100.00	100.00	391	WP_002914189.1	multidrug efflux RND transporter periplasmic adaptor subunit OqxA	NA	NA
NA	NODE_28_length_73706_cov_53.298937	8266	9738	-	silS	copper/silver sensor histidine kinase SilS	plus	STRESS	METAL	COPPER/SILVER	COPPER/SILVER	BLASTX	491	491	100.00	98.98	491	SPD96882.1	copper/silver sensor histidine kinase SilS	NA	NA
NA	NODE_28_length_73706_cov_53.298937	9734	10411	-	silR	copper/silver response regulator transcription factor SilR	plus	STRESS	METAL	COPPER/SILVER	COPPER/SILVER	BLASTX	226	226	100.00	97.35	226	SPD96883.1	copper/silver response regulator transcription factor SilR	NA	NA
NA	NODE_28_length_73706_cov_53.298937	10601	11983	+	silC	Cu(+)/Ag(+) efflux RND transporter outer membrane channel SilC	plus	STRESS	METAL	COPPER/SILVER	COPPER/SILVER	BLASTX	461	461	100.00	99.35	461	SPD96884.1	Cu(+)/Ag(+) efflux RND transporter outer membrane channel SilC	NA	NA
NA	NODE_28_length_73706_cov_53.298937	12015	12374	+	silF	Cu(+)/Ag(+) efflux RND transporter periplasmic metallochaperone SilF	plus	STRESS	METAL	COPPER/SILVER	COPPER/SILVER	BLASTX	120	117	100.00	94.17	120	KGL71342.1	Cu(+)/Ag(+) efflux RND transporter periplasmic metallochaperone SilF	NA	NA
NA	NODE_28_length_73706_cov_53.298937	12491	13780	+	silB	Cu(+)/Ag(+) efflux RND transporter periplasmic adaptor subunit SilB	plus	STRESS	METAL	COPPER/SILVER	COPPER/SILVER	BLASTX	430	430	100.00	98.14	430	AAD11748.1	Cu(+)/Ag(+) efflux RND transporter periplasmic adaptor subunit SilB	NA	NA
NA	NODE_28_length_73706_cov_53.298937	13794	16937	+	silA	Cu(+)/Ag(+) efflux RND transporter permease subunit SilA	plus	STRESS	METAL	COPPER/SILVER	COPPER/SILVER	BLASTX	1048	1048	100.00	98.85	1048	AAD11749.1	Cu(+)/Ag(+) efflux RND transporter permease subunit SilA	NA	NA
NA	NODE_28_length_73706_cov_53.298937	17573	20038	+	silP	Ag(+)-translocating P-type ATPase SilP	plus	STRESS	METAL	SILVER	SILVER	BLASTX	822	824	99.64	94.53	823	AAD11750.1	Ag(+)-translocating P-type ATPase SilP	NA	NA
NA	NODE_28_length_73706_cov_53.298937	22022	23836	+	pcoA	multicopper oxidase PcoA	plus	STRESS	METAL	COPPER	COPPER	BLASTX	605	605	100.00	99.83	605	CAA58525.1	multicopper oxidase PcoA	NA	NA
NA	NODE_28_length_73706_cov_53.298937	23845	24732	+	pcoB	copper-binding protein PcoB	plus	STRESS	METAL	COPPER	COPPER	BLASTX	296	296	100.00	99.66	296	CAA58526.1	copper-binding protein PcoB	NA	NA
NA	NODE_28_length_73706_cov_53.298937	24775	25152	+	pcoC	copper resistance system metallochaperone PcoC	plus	STRESS	METAL	COPPER	COPPER	EXACTX	126	126	100.00	100.00	126	CAA58527.1	copper resistance system metallochaperone PcoC	NA	NA
NA	NODE_28_length_73706_cov_53.298937	25160	26086	+	pcoD	copper resistance inner membrane protein PcoD	plus	STRESS	METAL	COPPER	COPPER	BLASTX	309	309	100.00	99.35	309	CAA58528.1	copper resistance inner membrane protein PcoD	NA	NA
NA	NODE_28_length_73706_cov_53.298937	26144	26821	+	pcoR	copper response regulator transcription factor PcoR	plus	STRESS	METAL	COPPER	COPPER	EXACTX	226	226	100.00	100.00	226	CAA58529.1	copper response regulator transcription factor PcoR	NA	NA
NA	NODE_28_length_73706_cov_53.298937	26821	28218	+	pcoS	copper resistance membrane spanning protein PcoS	plus	STRESS	METAL	COPPER	COPPER	BLASTX	466	466	100.00	99.14	466	CAA58530.1	copper resistance membrane spanning protein PcoS	NA	NA
NA	NODE_2_length_360915_cov_53.763789	241022	242821	-	ybtQ	yersiniabactin ABC transporter ATP-binding/permease protein YbtQ	plus	VIRULENCE	VIRULENCE	NA	NA	BLASTX	600	600	100.00	99.67	600	AAC69584.1	yersiniabactin ABC transporter ATP-binding/permease protein YbtQ	NA	NA
NA	NODE_2_length_360915_cov_53.763789	242811	244610	-	ybtP	yersiniabactin ABC transporter ATP-binding/permease protein YbtP	plus	VIRULENCE	VIRULENCE	NA	NA	BLASTX	600	600	100.00	99.83	600	CAA21388.1	yersiniabactin ABC transporter ATP-binding/permease protein YbtP	NA	NA
NA	NODE_30_length_69073_cov_53.466342	6594	8312	+	iucA	aerobactin synthase IucA	plus	VIRULENCE	VIRULENCE	NA	NA	BLASTX	573	576	99.83	90.09	575	EGI25746.1	aerobactin synthase IucA	NA	NA
NA	NODE_30_length_69073_cov_53.466342	8319	9263	+	iucB	N(6)-hydroxylysine O-acetyltransferase IucB	plus	VIRULENCE	VIRULENCE	NA	NA	BLASTX	315	315	100.00	94.60	315	AAN82074.1	N(6)-hydroxylysine O-acetyltransferase IucB	NA	NA
NA	NODE_30_length_69073_cov_53.466342	9266	10996	+	iucC	NIS family aerobactin synthetase IucC	plus	VIRULENCE	VIRULENCE	NA	NA	BLASTX	577	580	99.48	92.72	577	AAN82073.1	NIS family aerobactin synthetase IucC	NA	NA
NA	NODE_30_length_69073_cov_53.466342	12374	14560	+	iutA	ferric aerobactin receptor IutA	plus	VIRULENCE	VIRULENCE	NA	NA	BLASTX	729	731	99.73	89.57	729	AAN45165.2	ferric aerobactin receptor IutA	NA	NA
NA	NODE_30_length_69073_cov_53.466342	42572	43144	-	terE	tellurium resistance cAMP binding protein TerE	plus	STRESS	METAL	TELLURIUM	TELLURIUM	BLASTX	191	191	100.00	99.48	191	AAA98293.1	tellurium resistance cAMP binding protein TerE	NA	NA
NA	NODE_30_length_69073_cov_53.466342	43248	43823	-	terD	tellurium resistance membrane protein TerD	plus	STRESS	METAL	TELLURIUM	TELLURIUM	BLASTX	192	192	100.00	98.96	192	AAA98292.1	tellurium resistance membrane protein TerD	NA	NA
NA	NODE_30_length_69073_cov_53.466342	43865	44902	-	terC	tellurium resistance membrane protein TerC	plus	STRESS	METAL	TELLURIUM	TELLURIUM	BLASTX	346	346	100.00	99.13	346	AAA98291.1	tellurium resistance membrane protein TerC	NA	NA
NA	NODE_30_length_69073_cov_53.466342	44929	45381	-	terB	tellurium resistance membrane protein TerB	plus	STRESS	METAL	TELLURIUM	TELLURIUM	EXACTX	151	151	100.00	100.00	151	ACI12150.1	tellurium resistance membrane protein TerB	NA	NA
NA	NODE_36_length_47605_cov_60.372871	172	1314	+	blaCMY-4	extended-spectrum class C beta-lactamase CMY-4	core	AMR	AMR	BETA-LACTAM	CEPHALOSPORIN	ALLELEX	381	381	100.00	100.00	381	WP_015056382.1	extended-spectrum class C beta-lactamase CMY-4	NA	NA
NA	NODE_41_length_37972_cov_59.644170	54	374	-	merR	mercury resistance transcriptional regulator MerR	plus	STRESS	METAL	MERCURY	MERCURY	PARTIALX	107	144	74.31	92.52	107	CAA77320.1	mercury resistance transcriptional regulator MerR	NA	NA
NA	NODE_41_length_37972_cov_59.644170	558	905	+	merT	mercuric transport protein MerT	plus	STRESS	METAL	MERCURY	MERCURY	EXACTX	116	116	100.00	100.00	116	AAB59075.1	mercuric transport protein MerT	NA	NA
NA	NODE_41_length_37972_cov_59.644170	922	1194	+	merP	mercury resistance system periplasmic binding protein MerP	plus	STRESS	METAL	MERCURY	MERCURY	BLASTX	91	91	100.00	90.11	91	AAC38219.1	mercury resistance system periplasmic binding protein MerP	NA	NA
NA	NODE_41_length_37972_cov_59.644170	1233	1652	+	merC	organomercurial transporter MerC	plus	STRESS	METAL	MERCURY	ORGANOMERCURY	EXACTX	140	140	100.00	100.00	140	AAC33908.1	organomercurial transporter MerC	NA	NA
NA	NODE_41_length_37972_cov_59.644170	20957	21793	-	sul1	sulfonamide-resistant dihydropteroate synthase Sul1	core	AMR	AMR	SULFONAMIDE	SULFONAMIDE	EXACTX	279	279	100.00	100.00	279	WP_000259031.1	sulfonamide-resistant dihydropteroate synthase Sul1	NA	NA
NA	NODE_41_length_37972_cov_59.644170	21790	21972	-	qacE	quaternary ammonium compound efflux SMR transporter QacE	core	STRESS	BIOCIDE	QUATERNARY AMMONIUM	QUATERNARY AMMONIUM	PARTIALX	61	115	53.04	100.00	61	WP_000679427.1	quaternary ammonium compound efflux SMR transporter QacE delta 1	NA	NA
NA	NODE_41_length_37972_cov_59.644170	25651	26304	-	qnrA6	quinolone resistance pentapeptide repeat protein QnrA6	core	AMR	AMR	QUINOLONE	QUINOLONE	ALLELEX	218	218	100.00	100.00	218	WP_020442395.1	quinolone resistance pentapeptide repeat protein QnrA6	NA	NA
NA	NODE_41_length_37972_cov_59.644170	32071	32907	-	sul1	sulfonamide-resistant dihydropteroate synthase Sul1	core	AMR	AMR	SULFONAMIDE	SULFONAMIDE	EXACTX	279	279	100.00	100.00	279	WP_000259031.1	sulfonamide-resistant dihydropteroate synthase Sul1	NA	NA
NA	NODE_41_length_37972_cov_59.644170	32904	33248	-	qacEdelta1	quaternary ammonium compound efflux SMR transporter QacE delta 1	core	STRESS	BIOCIDE	QUATERNARY AMMONIUM	QUATERNARY AMMONIUM	ALLELEX	115	115	100.00	100.00	115	WP_000679427.1	quaternary ammonium compound efflux SMR transporter QacE delta 1	NA	NA
NA	NODE_41_length_37972_cov_59.644170	33415	34203	-	aadA1	ANT(3'')-Ia family aminoglycoside nucleotidyltransferase AadA1	core	AMR	AMR	AMINOGLYCOSIDE	STREPTOMYCIN	BLASTX	263	263	100.00	99.62	263	WP_001209508.1	ANT(3'')-Ia family aminoglycoside nucleotidyltransferase AadA1	NA	NA
NA	NODE_41_length_37972_cov_59.644170	34223	35020	-	blaOXA-10	oxacillin-hydrolyzing class D beta-lactamase OXA-10	core	AMR	AMR	BETA-LACTAM	CEPHALOSPORIN	ALLELEX	266	266	100.00	100.00	266	WP_000846390.1	oxacillin-hydrolyzing class D beta-lactamase OXA-10	NA	NA
NA	NODE_41_length_37972_cov_59.644170	35288	36544	-	cmlA5	chloramphenicol efflux MFS transporter CmlA5	core	AMR	AMR	PHENICOL	CHLORAMPHENICOL	EXACTX	419	419	100.00	100.00	419	WP_012300772.1	chloramphenicol efflux MFS transporter CmlA5	NA	NA
NA	NODE_41_length_37972_cov_59.644170	36868	37317	-	arr-2	NAD(+)--rifampin ADP-ribosyltransferase Arr-2	core	AMR	AMR	RIFAMYCIN	RIFAMYCIN	ALLELEX	150	150	100.00	100.00	150	WP_000237816.1	NAD(+)--rifampin ADP-ribosyltransferase Arr-2	NA	NA
NA	NODE_41_length_37972_cov_59.644170	37431	37901	-	dfrA14	trimethoprim-resistant dihydrofolate reductase DfrA14	core	AMR	AMR	TRIMETHOPRIM	TRIMETHOPRIM	EXACTX	157	157	100.00	100.00	157	WP_004201280.1	trimethoprim-resistant dihydrofolate reductase DfrA14	NA	NA
NA	NODE_42_length_37916_cov_58.434326	4429	5640	+	floR	chloramphenicol/florfenicol efflux MFS transporter FloR	core	AMR	AMR	PHENICOL	CHLORAMPHENICOL/FLORFENICOL	EXACTX	404	404	100.00	100.00	404	WP_000214119.1	chloramphenicol/florfenicol efflux MFS transporter FloR	NA	NA
NA	NODE_42_length_37916_cov_58.434326	6246	7442	-	tet(A)	tetracycline efflux MFS transporter Tet(A)	core	AMR	AMR	TETRACYCLINE	TETRACYCLINE	EXACTX	399	399	100.00	100.00	399	WP_000804063.1	tetracycline efflux MFS transporter Tet(A)	NA	NA
NA	NODE_42_length_37916_cov_58.434326	8781	9614	-	aph(6)-Id	aminoglycoside O-phosphotransferase APH(6)-Id	core	AMR	AMR	AMINOGLYCOSIDE	STREPTOMYCIN	EXACTX	278	278	100.00	100.00	278	WP_000480968.1	aminoglycoside O-phosphotransferase APH(6)-Id	NA	NA
NA	NODE_42_length_37916_cov_58.434326	9617	10417	-	aph(3'')-Ib	aminoglycoside O-phosphotransferase APH(3'')-Ib	core	AMR	AMR	AMINOGLYCOSIDE	STREPTOMYCIN	EXACTX	267	267	100.00	100.00	267	WP_001082319.1	aminoglycoside O-phosphotransferase APH(3'')-Ib	NA	NA
NA	NODE_42_length_37916_cov_58.434326	10481	11293	-	sul2	sulfonamide-resistant dihydropteroate synthase Sul2	core	AMR	AMR	SULFONAMIDE	SULFONAMIDE	EXACTX	271	271	100.00	100.00	271	WP_001043260.1	sulfonamide-resistant dihydropteroate synthase Sul2	NA	NA
NA	NODE_48_length_28051_cov_53.373589	9267	10379	+	iroB	salmochelin biosynthesis C-glycosyltransferase IroB	plus	VIRULENCE	VIRULENCE	NA	NA	BLASTX	371	371	100.00	90.30	371	EOW04219.1	salmochelin biosynthesis C-glycosyltransferase IroB	NA	NA
NA	NODE_48_length_28051_cov_53.373589	10525	14160	+	iroC	salmochelin/enterobactin export ABC transporter IroC	plus	VIRULENCE	VIRULENCE	NA	NA	BLASTX	1212	1219	99.51	88.95	1213	AUH19662.1	salmochelin/enterobactin export ABC transporter IroC	NA	NA
NA	NODE_48_length_28051_cov_53.373589	14274	15500	+	iroD	catecholate siderophore esterase IroD	plus	VIRULENCE	VIRULENCE	NA	NA	BLASTX	409	409	100.00	98.78	409	AVE24993.1	catecholate siderophore esterase IroD	NA	NA
NA	NODE_48_length_28051_cov_53.373589	15963	18134	+	iroN	siderophore salmochelin receptor IroN	plus	VIRULENCE	VIRULENCE	NA	NA	EXACTX	724	724	100.00	100.00	724	BAH65949.1	siderophore salmochelin receptor IroN	NA	NA
NA	NODE_48_length_28051_cov_53.373589	18566	19465	-	peg-344	DMT family inner membrane transporter PEG344	plus	VIRULENCE	VIRULENCE	NA	NA	EXACTX	300	300	100.00	100.00	300	BAH65947.1	DMT family inner membrane transporter PEG344	NA	NA
NA	NODE_48_length_28051_cov_53.373589	19544	19939	-	rmpC	mucoid phenotype regulator RmpC	plus	VIRULENCE	VIRULENCE	NA	NA	BLASTX	132	133	99.25	90.91	132	AIK83625.1	mucoid phenotype regulator RmpC	NA	NA
NA	NODE_48_length_28051_cov_53.373589	20295	20414	-	rmpD	mucoid phenotype synthesis protein RmpD	plus	VIRULENCE	VIRULENCE	NA	NA	EXACTX	40	40	100.00	100.00	40	QIK04195.1	mucoid phenotype synthesis protein RmpD	NA	NA
NA	NODE_48_length_28051_cov_53.373589	20473	21102	-	rmpA	mucoid phenotype regulator RmpA	plus	VIRULENCE	VIRULENCE	NA	NA	EXACTX	210	210	100.00	100.00	210	AMA27886.1	mucoid phenotype regulator RmpA	NA	NA
NA	NODE_59_length_2001_cov_59.481501	102	896	+	blaOXA-204	OXA-48 family carbapenem-hydrolyzing class D beta-lactamase OXA-204	core	AMR	AMR	BETA-LACTAM	CARBAPENEM	ALLELEX	265	265	100.00	100.00	265	WP_032495449.1	OXA-48 family carbapenem-hydrolyzing class D beta-lactamase OXA-204	NA	NA
NA	NODE_60_length_1784_cov_65.052632	159	710	+	aac(6')-Ib4	aminoglycoside N-acetyltransferase AAC(6')-Ib4	core	AMR	AMR	AMINOGLYCOSIDE	GENTAMICIN	ALLELEX	184	184	100.00	100.00	184	WP_003159191.1	aminoglycoside N-acetyltransferase AAC(6')-Ib4	NA	NA
NA	NODE_60_length_1784_cov_65.052632	914	1726	+	aph(3')-Ia	aminoglycoside O-phosphotransferase APH(3')-Ia	core	AMR	AMR	AMINOGLYCOSIDE	KANAMYCIN	EXACTX	271	271	100.00	100.00	271	WP_000018326.1	aminoglycoside O-phosphotransferase APH(3')-Ia	NA	NA
NA	NODE_8_length_201010_cov_58.376870	61094	61504	-	crcB	fluoride efflux transporter CrcB	plus	STRESS	BIOCIDE	FLUORIDE	FLUORIDE	EXACTX	137	137	100.00	100.00	137	CCN31428.1	fluoride efflux transporter CrcB	NA	NA
NA	NODE_9_length_179990_cov_51.634390	151183	152040	+	blaSHV-1	broad-spectrum class A beta-lactamase SHV-1	core	AMR	AMR	BETA-LACTAM	BETA-LACTAM	ALLELEX	286	286	100.00	100.00	286	WP_001620095.1	broad-spectrum class A beta-lactamase SHV-1	NA	NA
