Protein id	Contig id	Start	Stop	Strand	Element symbol	Element name	Scope	Type	Subtype	Class	Subclass	Method	Target length	Reference sequence length	% Coverage of reference	% Identity to reference	Alignment length	Closest reference accession	Closest reference name	HMM accession	HMM description
NA	NODE_11_length_176004_cov_23.592069	36305	39451	-	oqxB	multidrug efflux RND transporter permease subunit OqxB	core	AMR	AMR	PHENICOL/QUINOLONE	PHENICOL/QUINOLONE	BLASTX	1049	1050	99.90	97.33	1049	WP_012967412.1	multidrug efflux RND transporter permease subunit OqxB9	NA	NA
NA	NODE_11_length_176004_cov_23.592069	39478	40650	-	oqxA	multidrug efflux RND transporter periplasmic adaptor subunit OqxA	core	AMR	AMR	PHENICOL/QUINOLONE	PHENICOL/QUINOLONE	BLASTX	391	391	100.00	92.58	391	WP_002914189.1	multidrug efflux RND transporter periplasmic adaptor subunit OqxA	NA	NA
NA	NODE_1339_length_433_cov_1.740741	2	316	+	dfrA50	trimethoprim-resistant dihydrofolate reductase DfrA50	core	AMR	AMR	TRIMETHOPRIM	TRIMETHOPRIM	PARTIAL_CONTIG_ENDX	105	158	66.46	97.14	105	WP_040203768.1	trimethoprim-resistant dihydrofolate reductase DfrA50	NA	NA
NA	NODE_1399_length_429_cov_0.983957	41	427	+	catB	type B chloramphenicol O-acetyltransferase	core	AMR	AMR	PHENICOL	CHLORAMPHENICOL	PARTIAL_CONTIG_ENDX	129	210	61.43	100.00	129	WP_031281281.1	type B chloramphenicol O-acetyltransferase	NA	NA
NA	NODE_1501_length_417_cov_1.436464	194	415	-	silF	Cu(+)/Ag(+) efflux RND transporter periplasmic metallochaperone SilF	plus	STRESS	METAL	COPPER/SILVER	COPPER/SILVER	PARTIAL_CONTIG_ENDX	74	117	63.25	97.30	74	KGL71342.1	Cu(+)/Ag(+) efflux RND transporter periplasmic metallochaperone SilF	NA	NA
NA	NODE_17_length_110240_cov_26.390879	78825	79241	-	fosA	FosA5 family fosfomycin resistance glutathione transferase	core	AMR	AMR	FOSFOMYCIN	FOSFOMYCIN	BLASTX	139	139	100.00	94.96	139	WP_114473955.1	fosfomycin resistance glutathione transferase FosA9	NA	NA
NA	NODE_18_length_101316_cov_31.084860	81452	82633	-	emrD	multidrug efflux MFS transporter EmrD	plus	AMR	AMR	EFFLUX	EFFLUX	BLASTX	394	394	100.00	96.45	394	ACN65732.1	multidrug efflux MFS transporter EmrD	NA	NA
NA	NODE_192_length_778_cov_1.608575	1	573	+	blaTEM	TEM family class A beta-lactamase	core	AMR	AMR	BETA-LACTAM	BETA-LACTAM	PARTIAL_CONTIG_ENDX	191	286	66.78	98.95	191	WP_000027057.1	broad-spectrum class A beta-lactamase TEM-1	NA	NA
NA	NODE_23_length_83329_cov_29.074333	35415	36308	-	fieF	CDF family cation-efflux transporter FieF	plus	STRESS	METAL	NA	NA	BLASTX	298	300	99.33	93.96	298	BAB89353.1	CDF family cation-efflux transporter FieF	NA	NA
NA	NODE_262_length_722_cov_1.829085	1	555	-	sul1	sulfonamide-resistant dihydropteroate synthase Sul1	core	AMR	AMR	SULFONAMIDE	SULFONAMIDE	PARTIAL_CONTIG_ENDX	185	279	66.31	100.00	185	WP_000259031.1	sulfonamide-resistant dihydropteroate synthase Sul1	NA	NA
NA	NODE_3_length_258996_cov_27.431090	8141	9253	+	iroB	salmochelin biosynthesis C-glycosyltransferase IroB	plus	VIRULENCE	VIRULENCE	NA	NA	BLASTX	371	371	100.00	89.49	371	EOW04219.1	salmochelin biosynthesis C-glycosyltransferase IroB	NA	NA
NA	NODE_3_length_258996_cov_27.431090	9303	12968	+	iroC	salmochelin/enterobactin export ABC transporter IroC	plus	VIRULENCE	VIRULENCE	NA	NA	BLASTX	1222	1219	100.00	84.38	1223	AUH19662.1	salmochelin/enterobactin export ABC transporter IroC	NA	NA
NA	NODE_3_length_258996_cov_27.431090	15387	17558	-	iroN	siderophore salmochelin receptor IroN	plus	VIRULENCE	VIRULENCE	NA	NA	EXACTX	724	724	100.00	100.00	724	AEG95593.1	siderophore salmochelin receptor IroN	NA	NA
NA	NODE_426_length_626_cov_3.362522	347	625	+	arr	NAD(+)--rifampin ADP-ribosyltransferase	core	AMR	AMR	RIFAMYCIN	RIFAMYCIN	PARTIAL_CONTIG_ENDX	93	150	62.00	100.00	93	WP_000237816.1	NAD(+)--rifampin ADP-ribosyltransferase Arr-2	NA	NA
NA	NODE_46_length_2231_cov_42.594488	26	820	+	blaOXA-48	OXA-48 family carbapenem-hydrolyzing class D beta-lactamase OXA-48	core	AMR	AMR	BETA-LACTAM	CARBAPENEM	ALLELEX	265	265	100.00	100.00	265	WP_015059991.1	OXA-48 family carbapenem-hydrolyzing class D beta-lactamase OXA-48	NA	NA
NA	NODE_513_length_596_cov_1.301294	102	554	-	terB	tellurium resistance membrane protein TerB	plus	STRESS	METAL	TELLURIUM	TELLURIUM	EXACTX	151	151	100.00	100.00	151	ACI12150.1	tellurium resistance membrane protein TerB	NA	NA
NA	NODE_528_length_591_cov_2.063433	254	589	+	dfrA1	trimethoprim-resistant dihydrofolate reductase DfrA1	core	AMR	AMR	TRIMETHOPRIM	TRIMETHOPRIM	PARTIAL_CONTIG_ENDX	112	157	71.34	99.11	112	WP_000777554.1	trimethoprim-resistant dihydrofolate reductase DfrA1	NA	NA
NA	NODE_5_length_249804_cov_24.586205	119595	122225	+	gyrA_S83T	Klebsiella pneumoniae quinolone resistant GyrA	core	AMR	POINT	QUINOLONE	QUINOLONE	POINTX	877	877	100.00	96.24	877	WP_117036963.1	DNA gyrase subunit A GyrA	NA	NA
NA	NODE_660_length_555_cov_1.270000	5	553	-	hsp20	small heat shock protein sHSP20	plus	STRESS	HEAT	NA	NA	BLASTX	183	189	96.83	99.45	183	CDY80020.1	small heat shock protein sHSP20	NA	NA
NA	NODE_691_length_548_cov_1.283976	1	444	+	aac(6')-Ib	AAC(6')-Ib family aminoglycoside 6'-N-acetyltransferase	core	AMR	AMR	AMINOGLYCOSIDE	AMIKACIN/KANAMYCIN/TOBRAMYCIN	PARTIAL_CONTIG_ENDX	148	184	80.43	100.00	148	WP_117046752.1	AAC(6')-Ib family aminoglycoside 6'-N-acetyltransferase	NA	NA
NA	NODE_6_length_234290_cov_26.949640	63618	64760	+	ampC-Kaer	AmpC-Kaer family extended-spectrum class C beta-lactamase	core	AMR	AMR	BETA-LACTAM	CEPHALOSPORIN	BLASTX	381	381	100.00	97.11	381	WP_063406924.1	extended-spectrum class C beta-lactamase AmpC-Kaer-1	NA	NA
