Protein id	Contig id	Start	Stop	Strand	Element symbol	Element name	Scope	Type	Subtype	Class	Subclass	Method	Target length	Reference sequence length	% Coverage of reference	% Identity to reference	Alignment length	Closest reference accession	Closest reference name	HMM accession	HMM description
NA	NODE_10_length_186474_cov_50.072804	32064	34694	+	gyrA_D87N	Klebsiella pneumoniae quinolone resistant GyrA	core	AMR	POINT	QUINOLONE	QUINOLONE	POINTX	877	877	100.00	99.66	877	WP_117036963.1	DNA gyrase subunit A GyrA	NA	NA
NA	NODE_10_length_186474_cov_50.072804	32064	34694	+	gyrA_S83Y	Klebsiella pneumoniae quinolone resistant GyrA	core	AMR	POINT	QUINOLONE	QUINOLONE	POINTX	877	877	100.00	99.66	877	WP_117036963.1	DNA gyrase subunit A GyrA	NA	NA
NA	NODE_10_length_186474_cov_50.072804	41806	42906	+	ompK36_D135DGD	Klebsiella pneumoniae carbapenem resistant OmpK36	core	AMR	POINT	BETA-LACTAM	CARBAPENEM	POINTX	367	367	100.00	94.86	370	WP_002913005.1	outer membrane porin OmpK36	NA	NA
NA	NODE_17_length_106721_cov_51.544419	52208	53380	+	oqxA	multidrug efflux RND transporter periplasmic adaptor subunit OqxA	core	AMR	AMR	PHENICOL/QUINOLONE	PHENICOL/QUINOLONE	EXACTX	391	391	100.00	100.00	391	WP_002914189.1	multidrug efflux RND transporter periplasmic adaptor subunit OqxA	NA	NA
NA	NODE_17_length_106721_cov_51.544419	53407	56556	+	oqxB20	multidrug efflux RND transporter permease subunit OqxB20	core	AMR	AMR	PHENICOL/QUINOLONE	PHENICOL/QUINOLONE	ALLELEX	1050	1050	100.00	100.00	1050	WP_021312368.1	multidrug efflux RND transporter permease subunit OqxB20	NA	NA
NA	NODE_18_length_100443_cov_54.964826	79969	81150	-	emrD	multidrug efflux MFS transporter EmrD	plus	AMR	AMR	EFFLUX	EFFLUX	BLASTX	394	394	100.00	99.49	394	ACN65732.1	multidrug efflux MFS transporter EmrD	NA	NA
NA	NODE_19_length_99572_cov_53.916899	39753	40652	-	fieF	CDF family cation-efflux transporter FieF	plus	STRESS	METAL	NA	NA	EXACTX	300	300	100.00	100.00	300	BAB89353.1	CDF family cation-efflux transporter FieF	NA	NA
NA	NODE_1_length_309479_cov_47.978799	191651	192508	+	blaSHV-1	broad-spectrum class A beta-lactamase SHV-1	core	AMR	AMR	BETA-LACTAM	BETA-LACTAM	ALLELEX	286	286	100.00	100.00	286	WP_001620095.1	broad-spectrum class A beta-lactamase SHV-1	NA	NA
NA	NODE_2_length_306059_cov_53.587947	64100	66142	+	parC_S80I	Klebsiella pneumoniae quinolone resistant ParC	core	AMR	POINT	QUINOLONE	QUINOLONE	POINTX	681	689	98.84	99.27	681	WP_101982161.1	DNA topoisomerase IV subunit A ParC	NA	NA
NA	NODE_32_length_64718_cov_49.823562	104	976	+	blaCTX-M-15	extended-spectrum class A beta-lactamase CTX-M-15	core	AMR	AMR	BETA-LACTAM	CEPHALOSPORIN	ALLELEX	291	291	100.00	100.00	291	WP_000239590.1	extended-spectrum class A beta-lactamase CTX-M-15	NA	NA
NA	NODE_38_length_48039_cov_53.824275	46576	46992	-	fosA	FosA5 family fosfomycin resistance glutathione transferase	core	AMR	AMR	FOSFOMYCIN	FOSFOMYCIN	BLASTX	139	139	100.00	98.56	139	WP_114473955.1	fosfomycin resistance glutathione transferase FosA9	NA	NA
NA	NODE_51_length_19167_cov_62.212275	636	1436	+	aph(3'')-Ib	aminoglycoside O-phosphotransferase APH(3'')-Ib	core	AMR	AMR	AMINOGLYCOSIDE	STREPTOMYCIN	EXACTX	267	267	100.00	100.00	267	WP_001082319.1	aminoglycoside O-phosphotransferase APH(3'')-Ib	NA	NA
NA	NODE_51_length_19167_cov_62.212275	1667	2443	+	aph(3')-VIb	aminoglycoside O-phosphotransferase APH(3')-VIb	core	AMR	AMR	AMINOGLYCOSIDE	AMIKACIN/KANAMYCIN	BLASTX	259	259	100.00	98.84	259	WP_000422633.1	aminoglycoside O-phosphotransferase APH(3')-VIb	NA	NA
NA	NODE_51_length_19167_cov_62.212275	3918	4718	+	aph(3'')-Ib	aminoglycoside O-phosphotransferase APH(3'')-Ib	core	AMR	AMR	AMINOGLYCOSIDE	STREPTOMYCIN	EXACTX	267	267	100.00	100.00	267	WP_001082319.1	aminoglycoside O-phosphotransferase APH(3'')-Ib	NA	NA
NA	NODE_51_length_19167_cov_62.212275	4721	5554	+	aph(6)-Id	aminoglycoside O-phosphotransferase APH(6)-Id	core	AMR	AMR	AMINOGLYCOSIDE	STREPTOMYCIN	EXACTX	278	278	100.00	100.00	278	WP_000480968.1	aminoglycoside O-phosphotransferase APH(6)-Id	NA	NA
NA	NODE_52_length_18917_cov_56.807656	96	968	+	blaCTX-M-14	extended-spectrum class A beta-lactamase CTX-M-14	core	AMR	AMR	BETA-LACTAM	CEPHALOSPORIN	ALLELEX	291	291	100.00	100.00	291	WP_001617865.1	extended-spectrum class A beta-lactamase CTX-M-14	NA	NA
NA	NODE_60_length_7625_cov_82.916513	202	621	+	merC	organomercurial transporter MerC	plus	STRESS	METAL	MERCURY	ORGANOMERCURY	EXACTX	140	140	100.00	100.00	140	AAC33908.1	organomercurial transporter MerC	NA	NA
NA	NODE_60_length_7625_cov_82.916513	5601	6458	-	blaTEM-1	broad-spectrum class A beta-lactamase TEM-1	core	AMR	AMR	BETA-LACTAM	BETA-LACTAM	ALLELEX	286	286	100.00	100.00	286	WP_000027057.1	broad-spectrum class A beta-lactamase TEM-1	NA	NA
NA	NODE_61_length_7593_cov_54.548952	1665	2135	+	dfrA14	trimethoprim-resistant dihydrofolate reductase DfrA14	core	AMR	AMR	TRIMETHOPRIM	TRIMETHOPRIM	EXACTX	157	157	100.00	100.00	157	WP_004201280.1	trimethoprim-resistant dihydrofolate reductase DfrA14	NA	NA
NA	NODE_65_length_5399_cov_53.381549	116	349	-	merE	broad-spectrum mercury transporter MerE	plus	STRESS	METAL	MERCURY	MERCURY	BLASTX	78	78	100.00	96.15	78	AAC38236.1	broad-spectrum mercury transporter MerE	NA	NA
NA	NODE_65_length_5399_cov_53.381549	349	711	-	merD	mercury resistance co-regulator MerD	plus	STRESS	METAL	MERCURY	MERCURY	BLASTX	121	121	100.00	90.08	121	AAC38221.1	mercury resistance co-regulator MerD	NA	NA
NA	NODE_65_length_5399_cov_53.381549	732	2414	-	merA	mercury(II) reductase	plus	STRESS	METAL	MERCURY	MERCURY	BLASTX	561	561	100.00	93.23	561	ACU65296.1	mercury(II) reductase	NA	NA
NA	NODE_65_length_5399_cov_53.381549	3200	3544	-	merT	mercuric transport protein MerT	plus	STRESS	METAL	MERCURY	MERCURY	BLASTX	115	116	99.14	98.26	115	CAA70196.1	mercuric transport protein MerT	NA	NA
NA	NODE_65_length_5399_cov_53.381549	3634	4059	+	merR	mercury resistance transcriptional regulator MerR	plus	STRESS	METAL	MERCURY	MERCURY	BLASTX	142	144	98.61	92.96	142	CAA77320.1	mercury resistance transcriptional regulator MerR	NA	NA
NA	NODE_67_length_3617_cov_50.563728	739	1920	+	tet(D)	tetracycline efflux MFS transporter Tet(D)	core	AMR	AMR	TETRACYCLINE	TETRACYCLINE	EXACTX	394	394	100.00	100.00	394	WP_001039466.1	tetracycline efflux MFS transporter Tet(D)	NA	NA
NA	NODE_69_length_2707_cov_53.978130	96	953	+	aac(3)-IIe	aminoglycoside N-acetyltransferase AAC(3)-IIe	core	AMR	AMR	AMINOGLYCOSIDE	GENTAMICIN	EXACTX	286	286	100.00	100.00	286	WP_000557452.1	aminoglycoside N-acetyltransferase AAC(3)-IIe	NA	NA
NA	NODE_72_length_2293_cov_47.691689	56	496	-	catB3	type B-3 chloramphenicol O-acetyltransferase CatB3	core	AMR	AMR	PHENICOL	CHLORAMPHENICOL	PARTIALX	147	210	70.00	100.00	147	WP_000186237.1	type B-3 chloramphenicol O-acetyltransferase CatB3	NA	NA
NA	NODE_72_length_2293_cov_47.691689	637	1464	-	blaOXA-1	oxacillin-hydrolyzing class D beta-lactamase OXA-1	core	AMR	AMR	BETA-LACTAM	CEPHALOSPORIN	ALLELEX	276	276	100.00	100.00	276	WP_001334766.1	oxacillin-hydrolyzing class D beta-lactamase OXA-1	NA	NA
NA	NODE_72_length_2293_cov_47.691689	1598	2149	-	aac(6')-Ib-cr5	fluoroquinolone-acetylating aminoglycoside 6'-N-acetyltransferase AAC(6')-Ib-cr5	core	AMR	AMR	AMINOGLYCOSIDE/QUINOLONE	AMIKACIN/KANAMYCIN/QUINOLONE/TOBRAMYCIN	ALLELEX	184	184	100.00	100.00	184	WP_063840321.1	fluoroquinolone-acetylating aminoglycoside 6'-N-acetyltransferase AAC(6')-Ib-cr5	NA	NA
NA	NODE_73_length_2231_cov_58.181977	1412	2206	-	blaOXA-48	OXA-48 family carbapenem-hydrolyzing class D beta-lactamase OXA-48	core	AMR	AMR	BETA-LACTAM	CARBAPENEM	ALLELEX	265	265	100.00	100.00	265	WP_015059991.1	OXA-48 family carbapenem-hydrolyzing class D beta-lactamase OXA-48	NA	NA
NA	NODE_9_length_211197_cov_50.756822	109334	111133	+	ybtP	yersiniabactin ABC transporter ATP-binding/permease protein YbtP	plus	VIRULENCE	VIRULENCE	NA	NA	BLASTX	600	600	100.00	99.83	600	CAA21388.1	yersiniabactin ABC transporter ATP-binding/permease protein YbtP	NA	NA
NA	NODE_9_length_211197_cov_50.756822	111123	112922	+	ybtQ	yersiniabactin ABC transporter ATP-binding/permease protein YbtQ	plus	VIRULENCE	VIRULENCE	NA	NA	BLASTX	600	600	100.00	99.83	600	AAC69584.1	yersiniabactin ABC transporter ATP-binding/permease protein YbtQ	NA	NA
