Protein id	Contig id	Start	Stop	Strand	Element symbol	Element name	Scope	Type	Subtype	Class	Subclass	Method	Target length	Reference sequence length	% Coverage of reference	% Identity to reference	Alignment length	Closest reference accession	Closest reference name	HMM accession	HMM description
NA	NODE_17_length_107026_cov_52.002702	52208	53380	+	oqxA	multidrug efflux RND transporter periplasmic adaptor subunit OqxA	core	AMR	AMR	PHENICOL/QUINOLONE	PHENICOL/QUINOLONE	EXACTX	391	391	100.00	100.00	391	WP_002914189.1	multidrug efflux RND transporter periplasmic adaptor subunit OqxA	NA	NA
NA	NODE_17_length_107026_cov_52.002702	53407	56556	+	oqxB20	multidrug efflux RND transporter permease subunit OqxB20	core	AMR	AMR	PHENICOL/QUINOLONE	PHENICOL/QUINOLONE	ALLELEX	1050	1050	100.00	100.00	1050	WP_021312368.1	multidrug efflux RND transporter permease subunit OqxB20	NA	NA
NA	NODE_19_length_100443_cov_54.111956	79969	81150	-	emrD	multidrug efflux MFS transporter EmrD	plus	AMR	AMR	EFFLUX	EFFLUX	BLASTX	394	394	100.00	99.49	394	ACN65732.1	multidrug efflux MFS transporter EmrD	NA	NA
NA	NODE_1_length_309802_cov_48.803498	191961	192818	+	blaSHV-1	broad-spectrum class A beta-lactamase SHV-1	core	AMR	AMR	BETA-LACTAM	BETA-LACTAM	ALLELEX	286	286	100.00	100.00	286	WP_001620095.1	broad-spectrum class A beta-lactamase SHV-1	NA	NA
NA	NODE_20_length_99532_cov_53.304854	58881	59780	+	fieF	CDF family cation-efflux transporter FieF	plus	STRESS	METAL	NA	NA	EXACTX	300	300	100.00	100.00	300	BAB89353.1	CDF family cation-efflux transporter FieF	NA	NA
NA	NODE_26_length_81097_cov_53.329101	14005	14421	+	fosA	FosA5 family fosfomycin resistance glutathione transferase	core	AMR	AMR	FOSFOMYCIN	FOSFOMYCIN	BLASTX	139	139	100.00	98.56	139	WP_114473955.1	fosfomycin resistance glutathione transferase FosA9	NA	NA
NA	NODE_2_length_304993_cov_53.147023	64100	66142	+	parC_S80I	Klebsiella pneumoniae quinolone resistant ParC	core	AMR	POINT	QUINOLONE	QUINOLONE	POINTX	681	689	98.84	99.27	681	WP_101982161.1	DNA topoisomerase IV subunit A ParC	NA	NA
NA	NODE_33_length_64717_cov_51.052921	63742	64614	-	blaCTX-M-15	extended-spectrum class A beta-lactamase CTX-M-15	core	AMR	AMR	BETA-LACTAM	CEPHALOSPORIN	ALLELEX	291	291	100.00	100.00	291	WP_000239590.1	extended-spectrum class A beta-lactamase CTX-M-15	NA	NA
NA	NODE_36_length_51537_cov_48.739637	960	1388	-	silE	silver-binding protein SilE	plus	STRESS	METAL	SILVER	SILVER	BLASTX	143	143	100.00	91.61	143	AAD11743.1	silver-binding protein SilE	NA	NA
NA	NODE_36_length_51537_cov_48.739637	1642	3114	-	silS	copper/silver sensor histidine kinase SilS	plus	STRESS	METAL	COPPER/SILVER	COPPER/SILVER	EXACTX	491	491	100.00	100.00	491	SPD96882.1	copper/silver sensor histidine kinase SilS	NA	NA
NA	NODE_36_length_51537_cov_48.739637	3110	3787	-	silR	copper/silver response regulator transcription factor SilR	plus	STRESS	METAL	COPPER/SILVER	COPPER/SILVER	EXACTX	226	226	100.00	100.00	226	SPD96883.1	copper/silver response regulator transcription factor SilR	NA	NA
NA	NODE_36_length_51537_cov_48.739637	3977	5359	+	silC	Cu(+)/Ag(+) efflux RND transporter outer membrane channel SilC	plus	STRESS	METAL	COPPER/SILVER	COPPER/SILVER	EXACTX	461	461	100.00	100.00	461	SPD96884.1	Cu(+)/Ag(+) efflux RND transporter outer membrane channel SilC	NA	NA
NA	NODE_36_length_51537_cov_48.739637	5391	5741	+	silF	Cu(+)/Ag(+) efflux RND transporter periplasmic metallochaperone SilF	plus	STRESS	METAL	COPPER/SILVER	COPPER/SILVER	BLASTX	117	117	100.00	99.15	117	KGL71342.1	Cu(+)/Ag(+) efflux RND transporter periplasmic metallochaperone SilF	NA	NA
NA	NODE_36_length_51537_cov_48.739637	5858	7147	+	silB	Cu(+)/Ag(+) efflux RND transporter periplasmic adaptor subunit SilB	plus	STRESS	METAL	COPPER/SILVER	COPPER/SILVER	BLASTX	430	430	100.00	97.67	430	AAD11748.1	Cu(+)/Ag(+) efflux RND transporter periplasmic adaptor subunit SilB	NA	NA
NA	NODE_36_length_51537_cov_48.739637	7161	10304	+	silA	Cu(+)/Ag(+) efflux RND transporter permease subunit SilA	plus	STRESS	METAL	COPPER/SILVER	COPPER/SILVER	BLASTX	1048	1048	100.00	98.85	1048	AAD11749.1	Cu(+)/Ag(+) efflux RND transporter permease subunit SilA	NA	NA
NA	NODE_36_length_51537_cov_48.739637	10940	13405	+	silP	Ag(+)-translocating P-type ATPase SilP	plus	STRESS	METAL	SILVER	SILVER	BLASTX	822	824	99.64	94.53	823	AAD11750.1	Ag(+)-translocating P-type ATPase SilP	NA	NA
NA	NODE_36_length_51537_cov_48.739637	15389	17203	+	pcoA	multicopper oxidase PcoA	plus	STRESS	METAL	COPPER	COPPER	EXACTX	605	605	100.00	100.00	605	CAA58525.1	multicopper oxidase PcoA	NA	NA
NA	NODE_36_length_51537_cov_48.739637	17212	18099	+	pcoB	copper-binding protein PcoB	plus	STRESS	METAL	COPPER	COPPER	EXACTX	296	296	100.00	100.00	296	CAA58526.1	copper-binding protein PcoB	NA	NA
NA	NODE_36_length_51537_cov_48.739637	18142	18519	+	pcoC	copper resistance system metallochaperone PcoC	plus	STRESS	METAL	COPPER	COPPER	EXACTX	126	126	100.00	100.00	126	CAA58527.1	copper resistance system metallochaperone PcoC	NA	NA
NA	NODE_36_length_51537_cov_48.739637	18527	19453	+	pcoD	copper resistance inner membrane protein PcoD	plus	STRESS	METAL	COPPER	COPPER	BLASTX	309	309	100.00	99.68	309	CAA58528.1	copper resistance inner membrane protein PcoD	NA	NA
NA	NODE_36_length_51537_cov_48.739637	19511	20188	+	pcoR	copper response regulator transcription factor PcoR	plus	STRESS	METAL	COPPER	COPPER	EXACTX	226	226	100.00	100.00	226	CAA58529.1	copper response regulator transcription factor PcoR	NA	NA
NA	NODE_36_length_51537_cov_48.739637	20188	21585	+	pcoS	copper resistance membrane spanning protein PcoS	plus	STRESS	METAL	COPPER	COPPER	BLASTX	466	466	100.00	99.14	466	CAA58530.1	copper resistance membrane spanning protein PcoS	NA	NA
NA	NODE_36_length_51537_cov_48.739637	21805	22236	+	pcoE	copper resistance system metallochaperone PcoE	plus	STRESS	METAL	COPPER	COPPER	BLASTX	144	144	100.00	94.44	144	CAA58532.1	copper resistance system metallochaperone PcoE	NA	NA
NA	NODE_36_length_51537_cov_48.739637	30278	30700	-	arsC	glutaredoxin-dependent arsenate reductase	plus	STRESS	METAL	ARSENIC	ARSENATE	EXACTX	141	141	100.00	100.00	141	BAA24824.1	glutaredoxin-dependent arsenate reductase	NA	NA
NA	NODE_36_length_51537_cov_48.739637	30716	32002	-	arsB	arsenite efflux transporter membrane subunit ArsB	plus	STRESS	METAL	ARSENIC	ARSENITE	EXACTX	429	429	100.00	100.00	429	BAA24823.1	arsenite efflux transporter membrane subunit ArsB	NA	NA
NA	NODE_36_length_51537_cov_48.739637	32053	33801	-	arsA	arsenite efflux transporter ATPase subunit ArsA	plus	STRESS	METAL	ARSENIC	ARSENITE	EXACTX	583	583	100.00	100.00	583	BAA24822.1	arsenite efflux transporter ATPase subunit ArsA	NA	NA
NA	NODE_36_length_51537_cov_48.739637	33822	34181	-	arsD	arsenite efflux transporter metallochaperone ArsD	plus	STRESS	METAL	ARSENIC	ARSENITE	BLASTX	120	120	100.00	91.67	120	AAB09625.1	arsenite efflux transporter metallochaperone ArsD	NA	NA
NA	NODE_36_length_51537_cov_48.739637	34234	34581	-	arsR	As(III)-sensing metalloregulatory transcriptional repressor ArsR	plus	STRESS	METAL	ARSENIC	ARSENIC	EXACTX	116	116	100.00	100.00	116	AET17094.1	As(III)-sensing metalloregulatory transcriptional repressor ArsR	NA	NA
NA	NODE_36_length_51537_cov_48.739637	46319	49105	-	clpK	heat shock survival AAA family ATPase ClpK	plus	STRESS	HEAT	NA	NA	BLASTX	929	949	97.89	99.25	929	ASF80763.1	heat shock survival AAA family ATPase ClpK	NA	NA
NA	NODE_36_length_51537_cov_48.739637	49223	49789	-	hsp20	small heat shock protein sHSP20	plus	STRESS	HEAT	NA	NA	EXACTX	189	189	100.00	100.00	189	CDY80020.1	small heat shock protein sHSP20	NA	NA
NA	NODE_66_length_7627_cov_45.786450	1170	2027	+	blaTEM-1	broad-spectrum class A beta-lactamase TEM-1	core	AMR	AMR	BETA-LACTAM	BETA-LACTAM	ALLELEX	286	286	100.00	100.00	286	WP_000027057.1	broad-spectrum class A beta-lactamase TEM-1	NA	NA
NA	NODE_66_length_7627_cov_45.786450	7007	7426	-	merC	organomercurial transporter MerC	plus	STRESS	METAL	MERCURY	ORGANOMERCURY	EXACTX	140	140	100.00	100.00	140	AAC33908.1	organomercurial transporter MerC	NA	NA
NA	NODE_67_length_7593_cov_32.020297	1665	2135	+	dfrA14	trimethoprim-resistant dihydrofolate reductase DfrA14	core	AMR	AMR	TRIMETHOPRIM	TRIMETHOPRIM	EXACTX	157	157	100.00	100.00	157	WP_004201280.1	trimethoprim-resistant dihydrofolate reductase DfrA14	NA	NA
NA	NODE_74_length_4084_cov_76.977166	65	490	-	merR	mercury resistance transcriptional regulator MerR	plus	STRESS	METAL	MERCURY	MERCURY	BLASTX	142	144	98.61	92.96	142	CAA77320.1	mercury resistance transcriptional regulator MerR	NA	NA
NA	NODE_74_length_4084_cov_76.977166	595	939	+	merT	mercuric transport protein MerT	plus	STRESS	METAL	MERCURY	MERCURY	BLASTX	115	116	99.14	98.26	115	CAA70196.1	mercuric transport protein MerT	NA	NA
NA	NODE_74_length_4084_cov_76.977166	1725	3407	+	merA	mercury(II) reductase	plus	STRESS	METAL	MERCURY	MERCURY	BLASTX	561	561	100.00	93.23	561	ACU65296.1	mercury(II) reductase	NA	NA
NA	NODE_74_length_4084_cov_76.977166	3428	3790	+	merD	mercury resistance co-regulator MerD	plus	STRESS	METAL	MERCURY	MERCURY	BLASTX	121	121	100.00	90.08	121	AAC38221.1	mercury resistance co-regulator MerD	NA	NA
NA	NODE_74_length_4084_cov_76.977166	3790	4023	+	merE	broad-spectrum mercury transporter MerE	plus	STRESS	METAL	MERCURY	MERCURY	BLASTX	78	78	100.00	96.15	78	AAC38236.1	broad-spectrum mercury transporter MerE	NA	NA
NA	NODE_76_length_3617_cov_29.885177	1698	2879	-	tet(D)	tetracycline efflux MFS transporter Tet(D)	core	AMR	AMR	TETRACYCLINE	TETRACYCLINE	EXACTX	394	394	100.00	100.00	394	WP_001039466.1	tetracycline efflux MFS transporter Tet(D)	NA	NA
NA	NODE_7_length_186424_cov_51.124693	143569	144669	-	ompK36_D135DGD	Klebsiella pneumoniae carbapenem resistant OmpK36	core	AMR	POINT	BETA-LACTAM	CARBAPENEM	POINTX	367	367	100.00	94.86	370	WP_002913005.1	outer membrane porin OmpK36	NA	NA
NA	NODE_7_length_186424_cov_51.124693	151781	154411	-	gyrA_D87N	Klebsiella pneumoniae quinolone resistant GyrA	core	AMR	POINT	QUINOLONE	QUINOLONE	POINTX	877	877	100.00	99.66	877	WP_117036963.1	DNA gyrase subunit A GyrA	NA	NA
NA	NODE_7_length_186424_cov_51.124693	151781	154411	-	gyrA_S83Y	Klebsiella pneumoniae quinolone resistant GyrA	core	AMR	POINT	QUINOLONE	QUINOLONE	POINTX	877	877	100.00	99.66	877	WP_117036963.1	DNA gyrase subunit A GyrA	NA	NA
NA	NODE_81_length_2710_cov_28.887006	1755	2612	-	aac(3)-IIe	aminoglycoside N-acetyltransferase AAC(3)-IIe	core	AMR	AMR	AMINOGLYCOSIDE	GENTAMICIN	EXACTX	286	286	100.00	100.00	286	WP_000557452.1	aminoglycoside N-acetyltransferase AAC(3)-IIe	NA	NA
NA	NODE_83_length_2293_cov_26.610366	56	496	-	catB3	type B-3 chloramphenicol O-acetyltransferase CatB3	core	AMR	AMR	PHENICOL	CHLORAMPHENICOL	PARTIALX	147	210	70.00	100.00	147	WP_000186237.1	type B-3 chloramphenicol O-acetyltransferase CatB3	NA	NA
NA	NODE_83_length_2293_cov_26.610366	637	1464	-	blaOXA-1	oxacillin-hydrolyzing class D beta-lactamase OXA-1	core	AMR	AMR	BETA-LACTAM	CEPHALOSPORIN	ALLELEX	276	276	100.00	100.00	276	WP_001334766.1	oxacillin-hydrolyzing class D beta-lactamase OXA-1	NA	NA
NA	NODE_83_length_2293_cov_26.610366	1598	2149	-	aac(6')-Ib-cr5	fluoroquinolone-acetylating aminoglycoside 6'-N-acetyltransferase AAC(6')-Ib-cr5	core	AMR	AMR	AMINOGLYCOSIDE/QUINOLONE	AMIKACIN/KANAMYCIN/QUINOLONE/TOBRAMYCIN	ALLELEX	184	184	100.00	100.00	184	WP_063840321.1	fluoroquinolone-acetylating aminoglycoside 6'-N-acetyltransferase AAC(6')-Ib-cr5	NA	NA
NA	NODE_84_length_2231_cov_37.690726	1412	2206	-	blaOXA-48	OXA-48 family carbapenem-hydrolyzing class D beta-lactamase OXA-48	core	AMR	AMR	BETA-LACTAM	CARBAPENEM	ALLELEX	265	265	100.00	100.00	265	WP_015059991.1	OXA-48 family carbapenem-hydrolyzing class D beta-lactamase OXA-48	NA	NA
