Protein id	Contig id	Start	Stop	Strand	Element symbol	Element name	Scope	Type	Subtype	Class	Subclass	Method	Target length	Reference sequence length	% Coverage of reference	% Identity to reference	Alignment length	Closest reference accession	Closest reference name	HMM accession	HMM description
NA	NODE_12_length_144637_cov_40.381680	80284	81465	-	emrD	multidrug efflux MFS transporter EmrD	plus	AMR	AMR	EFFLUX	EFFLUX	BLASTX	394	394	100.00	99.49	394	ACN65732.1	multidrug efflux MFS transporter EmrD	NA	NA
NA	NODE_14_length_137455_cov_35.921703	3266	5065	-	ybtQ	yersiniabactin ABC transporter ATP-binding/permease protein YbtQ	plus	VIRULENCE	VIRULENCE	NA	NA	BLASTX	600	600	100.00	99.67	600	AAC69584.1	yersiniabactin ABC transporter ATP-binding/permease protein YbtQ	NA	NA
NA	NODE_14_length_137455_cov_35.921703	5055	6854	-	ybtP	yersiniabactin ABC transporter ATP-binding/permease protein YbtP	plus	VIRULENCE	VIRULENCE	NA	NA	BLASTX	600	600	100.00	99.83	600	CAA21388.1	yersiniabactin ABC transporter ATP-binding/permease protein YbtP	NA	NA
NA	NODE_23_length_94125_cov_35.632242	39754	40653	-	fieF	CDF family cation-efflux transporter FieF	plus	STRESS	METAL	NA	NA	EXACTX	300	300	100.00	100.00	300	BAB89353.1	CDF family cation-efflux transporter FieF	NA	NA
NA	NODE_26_length_85820_cov_34.735090	15376	15792	+	fosA	FosA5 family fosfomycin resistance glutathione transferase	core	AMR	AMR	FOSFOMYCIN	FOSFOMYCIN	BLASTX	139	139	100.00	98.56	139	WP_004146118.1	FosA5 family fosfomycin resistance glutathione transferase	NA	NA
NA	NODE_33_length_56329_cov_30.114138	52	1938	+	oqxB	multidrug efflux RND transporter permease subunit OqxB	core	AMR	AMR	PHENICOL/QUINOLONE	PHENICOL/QUINOLONE	PARTIALX	629	1050	59.90	100.00	629	WP_004149399.1	multidrug efflux RND transporter permease subunit OqxB19	NA	NA
NA	NODE_37_length_32430_cov_28.285220	605	1777	-	oqxA	multidrug efflux RND transporter periplasmic adaptor subunit OqxA	core	AMR	AMR	PHENICOL/QUINOLONE	PHENICOL/QUINOLONE	EXACTX	391	391	100.00	100.00	391	WP_002914189.1	multidrug efflux RND transporter periplasmic adaptor subunit OqxA	NA	NA
NA	NODE_3_length_360800_cov_26.374977	68124	68981	-	blaSHV-1	broad-spectrum class A beta-lactamase SHV-1	core	AMR	AMR	BETA-LACTAM	BETA-LACTAM	ALLELEX	286	286	100.00	100.00	286	WP_001620095.1	broad-spectrum class A beta-lactamase SHV-1	NA	NA
NA	NODE_42_length_15502_cov_42.705962	7135	8856	+	iucA	aerobactin synthase IucA	plus	VIRULENCE	VIRULENCE	NA	NA	BLASTX	574	576	100.00	95.31	576	EGI25746.1	aerobactin synthase IucA	NA	NA
NA	NODE_42_length_15502_cov_42.705962	8860	9804	+	iucB	N(6)-hydroxylysine O-acetyltransferase IucB	plus	VIRULENCE	VIRULENCE	NA	NA	BLASTX	315	315	100.00	96.19	315	AAN82074.1	N(6)-hydroxylysine O-acetyltransferase IucB	NA	NA
NA	NODE_42_length_15502_cov_42.705962	9807	11546	+	iucC	NIS family aerobactin synthetase IucC	plus	VIRULENCE	VIRULENCE	NA	NA	BLASTX	580	580	100.00	97.59	580	AAN82073.1	NIS family aerobactin synthetase IucC	NA	NA
NA	NODE_42_length_15502_cov_42.705962	11546	12820	+	iucD	NADPH-dependent L-lysine N(6)-monooxygenase IucD	plus	VIRULENCE	VIRULENCE	NA	NA	BLASTX	425	445	95.51	97.65	425	AAD44749.1	NADPH-dependent L-lysine N(6)-monooxygenase IucD	NA	NA
NA	NODE_42_length_15502_cov_42.705962	12917	15103	+	iutA	ferric aerobactin receptor IutA	plus	VIRULENCE	VIRULENCE	NA	NA	BLASTX	729	731	99.73	89.85	729	AAN45165.2	ferric aerobactin receptor IutA	NA	NA
NA	NODE_43_length_13894_cov_64.493316	775	1416	+	qnrB1	quinolone resistance pentapeptide repeat protein QnrB1	core	AMR	AMR	QUINOLONE	QUINOLONE	ALLELEX	214	214	100.00	100.00	214	WP_014386481.1	quinolone resistance pentapeptide repeat protein QnrB1	NA	NA
NA	NODE_43_length_13894_cov_64.493316	5045	5854	+	blaNDM-1	subclass B1 metallo-beta-lactamase NDM-1	core	AMR	AMR	BETA-LACTAM	CARBAPENEM	ALLELEX	270	270	100.00	100.00	270	WP_004201164.1	subclass B1 metallo-beta-lactamase NDM-1	NA	NA
NA	NODE_43_length_13894_cov_64.493316	5861	6223	+	ble	bleomycin binding protein Ble-MBL	core	AMR	AMR	BLEOMYCIN	BLEOMYCIN	EXACTX	121	121	100.00	100.00	121	WP_004201167.1	bleomycin binding protein Ble-MBL	NA	NA
NA	NODE_50_length_3749_cov_40.868706	826	1455	+	catB	type B chloramphenicol O-acetyltransferase	core	AMR	AMR	PHENICOL	CHLORAMPHENICOL	EXACTX	210	210	100.00	100.00	210	WP_031281281.1	type B chloramphenicol O-acetyltransferase	NA	NA
NA	NODE_50_length_3749_cov_40.868706	3110	3748	-	rmtF	RmtF family 16S rRNA (guanine(1405)-N(7))-methyltransferase	core	AMR	AMR	AMINOGLYCOSIDE	AMINOGLYCOSIDE	PARTIAL_CONTIG_ENDX	213	259	82.24	100.00	213	WP_015632396.1	16S rRNA (guanine(1405)-N(7))-methyltransferase RmtF1	NA	NA
NA	NODE_53_length_3540_cov_83.735725	959	1831	-	blaCTX-M-15	extended-spectrum class A beta-lactamase CTX-M-15	core	AMR	AMR	BETA-LACTAM	CEPHALOSPORIN	ALLELEX	291	291	100.00	100.00	291	WP_000239590.1	extended-spectrum class A beta-lactamase CTX-M-15	NA	NA
NA	NODE_54_length_3491_cov_16.060244	206	550	+	qacEdelta1	quaternary ammonium compound efflux SMR transporter QacE delta 1	core	STRESS	BIOCIDE	QUATERNARY AMMONIUM	QUATERNARY AMMONIUM	ALLELEX	115	115	100.00	100.00	115	WP_000679427.1	quaternary ammonium compound efflux SMR transporter QacE delta 1	NA	NA
NA	NODE_54_length_3491_cov_16.060244	547	1383	+	sul1	sulfonamide-resistant dihydropteroate synthase Sul1	core	AMR	AMR	SULFONAMIDE	SULFONAMIDE	EXACTX	279	279	100.00	100.00	279	WP_000259031.1	sulfonamide-resistant dihydropteroate synthase Sul1	NA	NA
NA	NODE_55_length_3335_cov_27.436280	118	1020	+	mph(A)	Mph(A) family macrolide 2'-phosphotransferase	core	AMR	AMR	MACROLIDE	AZITHROMYCIN/ERYTHROMYCIN/SPIRAMYCIN/TELITHROMYCIN	EXACTX	301	301	100.00	100.00	301	WP_000219391.1	Mph(A) family macrolide 2'-phosphotransferase	NA	NA
NA	NODE_5_length_298164_cov_26.778591	180560	183190	-	gyrA_S83I	Klebsiella pneumoniae quinolone resistant GyrA	core	AMR	POINT	QUINOLONE	QUINOLONE	POINTX	877	877	100.00	99.77	877	WP_117036963.1	DNA gyrase subunit A GyrA	NA	NA
NA	NODE_62_length_2050_cov_58.171429	295	789	+	dfrA12	trimethoprim-resistant dihydrofolate reductase DfrA12	core	AMR	AMR	TRIMETHOPRIM	TRIMETHOPRIM	EXACTX	165	165	100.00	100.00	165	WP_001083725.1	trimethoprim-resistant dihydrofolate reductase DfrA12	NA	NA
NA	NODE_62_length_2050_cov_58.171429	1200	1988	+	aadA2	ANT(3'')-Ia family aminoglycoside nucleotidyltransferase AadA2	core	AMR	AMR	AMINOGLYCOSIDE	STREPTOMYCIN	EXACTX	263	263	100.00	100.00	263	WP_001206356.1	ANT(3'')-Ia family aminoglycoside nucleotidyltransferase AadA2	NA	NA
NA	NODE_65_length_1366_cov_66.360793	348	1082	+	erm(B)	23S rRNA (adenine(2058)-N(6))-methyltransferase Erm(B)	core	AMR	AMR	LINCOSAMIDE/MACROLIDE/STREPTOGRAMIN	CLINDAMYCIN/ERYTHROMYCIN/STREPTOGRAMIN B	BLASTX	245	245	100.00	99.59	245	WP_002321849.1	23S rRNA (adenine(2058)-N(6))-methyltransferase Erm(B)	NA	NA
NA	NODE_69_length_1264_cov_66.769231	592	1143	-	aac(6')-Ib	AAC(6')-Ib family aminoglycoside 6'-N-acetyltransferase	core	AMR	AMR	AMINOGLYCOSIDE	GENTAMICIN	EXACTX	184	184	100.00	100.00	184	WP_022631510.1	AAC(6')-Ib family aminoglycoside 6'-N-acetyltransferase	NA	NA
NA	NODE_6_length_267118_cov_32.119444	235088	237130	-	parC_S80I	Klebsiella pneumoniae quinolone resistant ParC	core	AMR	POINT	QUINOLONE	QUINOLONE	POINTX	681	689	98.84	99.41	681	WP_101982161.1	DNA topoisomerase IV subunit A ParC	NA	NA
NA	NODE_81_length_605_cov_64.394545	68	517	-	arr-2	NAD(+)--rifampin ADP-ribosyltransferase Arr-2	core	AMR	AMR	RIFAMYCIN	RIFAMYCIN	ALLELEX	150	150	100.00	100.00	150	WP_000237816.1	NAD(+)--rifampin ADP-ribosyltransferase Arr-2	NA	NA
