Protein id	Contig id	Start	Stop	Strand	Element symbol	Element name	Scope	Type	Subtype	Class	Subclass	Method	Target length	Reference sequence length	% Coverage of reference	% Identity to reference	Alignment length	Closest reference accession	Closest reference name	HMM accession	HMM description
NA	NODE_14_length_139448_cov_67.170453	73875	75056	-	emrD	multidrug efflux MFS transporter EmrD	plus	AMR	AMR	EFFLUX	EFFLUX	BLASTX	394	394	100.00	99.24	394	ACN65732.1	multidrug efflux MFS transporter EmrD	NA	NA
NA	NODE_18_length_122801_cov_56.988521	52825	53298	+	oqxR_D95E	Klebsiella pneumoniae tigecycline resistant OqxR	core	AMR	POINT	TETRACYCLINE	TIGECYCLINE	POINTX	158	159	99.37	98.10	158	WP_000888203.1	Rrf2 family transcriptional regulator OqxR	NA	NA
NA	NODE_18_length_122801_cov_56.988521	52825	53298	+	oqxR_V113I	Klebsiella pneumoniae tigecycline resistant OqxR	core	AMR	POINT	TETRACYCLINE	TIGECYCLINE	POINTX	158	159	99.37	98.10	158	WP_000888203.1	Rrf2 family transcriptional regulator OqxR	NA	NA
NA	NODE_18_length_122801_cov_56.988521	53374	56523	-	oqxB	multidrug efflux RND transporter permease subunit OqxB	core	AMR	AMR	PHENICOL/QUINOLONE	PHENICOL/QUINOLONE	BLASTX	1050	1050	100.00	99.90	1050	WP_012967412.1	multidrug efflux RND transporter permease subunit OqxB9	NA	NA
NA	NODE_18_length_122801_cov_56.988521	56550	57722	-	oqxA	multidrug efflux RND transporter periplasmic adaptor subunit OqxA	core	AMR	AMR	PHENICOL/QUINOLONE	PHENICOL/QUINOLONE	BLASTX	391	391	100.00	99.23	391	WP_002914189.1	multidrug efflux RND transporter periplasmic adaptor subunit OqxA	NA	NA
NA	NODE_1_length_559423_cov_52.454738	490223	491080	-	blaLEN-17	class A beta-lactamase LEN-17	core	AMR	AMR	BETA-LACTAM	BETA-LACTAM	ALLELEX	286	286	100.00	100.00	286	WP_039103359.1	class A beta-lactamase LEN-17	NA	NA
NA	NODE_24_length_95347_cov_62.823574	58683	59582	+	fieF	CDF family cation-efflux transporter FieF	plus	STRESS	METAL	NA	NA	BLASTX	300	300	100.00	99.67	300	BAB89353.1	CDF family cation-efflux transporter FieF	NA	NA
NA	NODE_25_length_94857_cov_59.889760	70212	70622	-	fosA	FosA5 family fosfomycin resistance glutathione transferase	core	AMR	AMR	FOSFOMYCIN	FOSFOMYCIN	BLASTX	137	139	98.56	100.00	137	WP_114473955.1	fosfomycin resistance glutathione transferase FosA9	NA	NA
NA	NODE_35_length_46436_cov_104.011707	2750	4222	-	silS	copper/silver sensor histidine kinase SilS	plus	STRESS	METAL	COPPER/SILVER	COPPER/SILVER	BLASTX	491	491	100.00	98.78	491	SPD96882.1	copper/silver sensor histidine kinase SilS	NA	NA
NA	NODE_35_length_46436_cov_104.011707	4218	4895	-	silR	copper/silver response regulator transcription factor SilR	plus	STRESS	METAL	COPPER/SILVER	COPPER/SILVER	BLASTX	226	226	100.00	97.35	226	SPD96883.1	copper/silver response regulator transcription factor SilR	NA	NA
NA	NODE_35_length_46436_cov_104.011707	5085	6467	+	silC	Cu(+)/Ag(+) efflux RND transporter outer membrane channel SilC	plus	STRESS	METAL	COPPER/SILVER	COPPER/SILVER	BLASTX	461	461	100.00	98.05	461	SPD96884.1	Cu(+)/Ag(+) efflux RND transporter outer membrane channel SilC	NA	NA
NA	NODE_35_length_46436_cov_104.011707	6499	6849	+	silF	Cu(+)/Ag(+) efflux RND transporter periplasmic metallochaperone SilF	plus	STRESS	METAL	COPPER/SILVER	COPPER/SILVER	BLASTX	117	117	100.00	99.15	117	KGL71342.1	Cu(+)/Ag(+) efflux RND transporter periplasmic metallochaperone SilF	NA	NA
NA	NODE_35_length_46436_cov_104.011707	6966	8255	+	silB	Cu(+)/Ag(+) efflux RND transporter periplasmic adaptor subunit SilB	plus	STRESS	METAL	COPPER/SILVER	COPPER/SILVER	BLASTX	430	430	100.00	98.37	430	AAD11748.1	Cu(+)/Ag(+) efflux RND transporter periplasmic adaptor subunit SilB	NA	NA
NA	NODE_35_length_46436_cov_104.011707	8269	11412	+	silA	Cu(+)/Ag(+) efflux RND transporter permease subunit SilA	plus	STRESS	METAL	COPPER/SILVER	COPPER/SILVER	BLASTX	1048	1048	100.00	99.43	1048	AAD11749.1	Cu(+)/Ag(+) efflux RND transporter permease subunit SilA	NA	NA
NA	NODE_35_length_46436_cov_104.011707	12040	14508	+	silP	Ag(+)-translocating P-type ATPase SilP	plus	STRESS	METAL	SILVER	SILVER	BLASTX	823	824	100.00	98.18	824	AAD11750.1	Ag(+)-translocating P-type ATPase SilP	NA	NA
NA	NODE_35_length_46436_cov_104.011707	16493	18307	+	pcoA	multicopper oxidase PcoA	plus	STRESS	METAL	COPPER	COPPER	EXACTX	605	605	100.00	100.00	605	CAA58525.1	multicopper oxidase PcoA	NA	NA
NA	NODE_35_length_46436_cov_104.011707	18316	19203	+	pcoB	copper-binding protein PcoB	plus	STRESS	METAL	COPPER	COPPER	BLASTX	296	296	100.00	99.66	296	CAA58526.1	copper-binding protein PcoB	NA	NA
NA	NODE_35_length_46436_cov_104.011707	19246	19623	+	pcoC	copper resistance system metallochaperone PcoC	plus	STRESS	METAL	COPPER	COPPER	EXACTX	126	126	100.00	100.00	126	CAA58527.1	copper resistance system metallochaperone PcoC	NA	NA
NA	NODE_35_length_46436_cov_104.011707	19631	20557	+	pcoD	copper resistance inner membrane protein PcoD	plus	STRESS	METAL	COPPER	COPPER	BLASTX	309	309	100.00	99.68	309	CAA58528.1	copper resistance inner membrane protein PcoD	NA	NA
NA	NODE_35_length_46436_cov_104.011707	20615	21292	+	pcoR	copper response regulator transcription factor PcoR	plus	STRESS	METAL	COPPER	COPPER	EXACTX	226	226	100.00	100.00	226	CAA58529.1	copper response regulator transcription factor PcoR	NA	NA
NA	NODE_35_length_46436_cov_104.011707	21292	22689	+	pcoS	copper resistance membrane spanning protein PcoS	plus	STRESS	METAL	COPPER	COPPER	BLASTX	466	466	100.00	99.36	466	CAA58530.1	copper resistance membrane spanning protein PcoS	NA	NA
NA	NODE_35_length_46436_cov_104.011707	34411	35535	-	ncrC	Ni(II)/Co(II) efflux transporter permease subunit NcrC	plus	STRESS	METAL	COPPER/NICKEL	COPPER/NICKEL	BLASTX	375	376	99.47	92.29	376	ADF64798.1	Ni(II)/Co(II) efflux transporter permease subunit NcrC	NA	NA
NA	NODE_35_length_46436_cov_104.011707	35551	35817	-	ncrB	nickel-sensing transcriptional repressor NcrB	plus	STRESS	METAL	NICKEL	NICKEL	BLASTX	89	89	100.00	94.38	89	ABF61435.1	nickel-sensing transcriptional repressor NcrB	NA	NA
NA	NODE_35_length_46436_cov_104.011707	35922	37217	-	ncrA	Metal Resistance	plus	STRESS	METAL	NICKEL	NICKEL	BLASTX	432	432	100.00	92.13	432	ABF14406.1	Metal Resistance	NA	NA
NA	NODE_42_length_30351_cov_152.484486	2012	2848	-	sul1	sulfonamide-resistant dihydropteroate synthase Sul1	core	AMR	AMR	SULFONAMIDE	SULFONAMIDE	EXACTX	279	279	100.00	100.00	279	WP_000259031.1	sulfonamide-resistant dihydropteroate synthase Sul1	NA	NA
NA	NODE_42_length_30351_cov_152.484486	2845	3051	-	qacE	quaternary ammonium compound efflux SMR transporter QacE	core	STRESS	BIOCIDE	QUATERNARY AMMONIUM	QUATERNARY AMMONIUM	PARTIALX	69	115	60.00	98.55	69	WP_000679427.1	quaternary ammonium compound efflux SMR transporter QacE delta 1	NA	NA
NA	NODE_42_length_30351_cov_152.484486	3339	3980	+	qnrB2	quinolone resistance pentapeptide repeat protein QnrB2	core	AMR	AMR	QUINOLONE	QUINOLONE	ALLELEX	214	214	100.00	100.00	214	WP_012695489.1	quinolone resistance pentapeptide repeat protein QnrB2	NA	NA
NA	NODE_42_length_30351_cov_152.484486	7733	8569	-	sul1	sulfonamide-resistant dihydropteroate synthase Sul1	core	AMR	AMR	SULFONAMIDE	SULFONAMIDE	EXACTX	279	279	100.00	100.00	279	WP_000259031.1	sulfonamide-resistant dihydropteroate synthase Sul1	NA	NA
NA	NODE_42_length_30351_cov_152.484486	8566	8910	-	qacEdelta1	quaternary ammonium compound efflux SMR transporter QacE delta 1	core	STRESS	BIOCIDE	QUATERNARY AMMONIUM	QUATERNARY AMMONIUM	ALLELEX	115	115	100.00	100.00	115	WP_000679427.1	quaternary ammonium compound efflux SMR transporter QacE delta 1	NA	NA
NA	NODE_42_length_30351_cov_152.484486	9445	9678	-	dfrB3	trimethoprim-resistant dihydrofolate reductase DfrB3	core	AMR	AMR	TRIMETHOPRIM	TRIMETHOPRIM	ALLELEX	78	78	100.00	100.00	78	WP_010890144.1	trimethoprim-resistant dihydrofolate reductase DfrB3	NA	NA
NA	NODE_46_length_25228_cov_110.482779	5558	8344	-	clpK	heat shock survival AAA family ATPase ClpK	plus	STRESS	HEAT	NA	NA	BLASTX	929	949	97.89	99.25	929	ASF80763.1	heat shock survival AAA family ATPase ClpK	NA	NA
NA	NODE_46_length_25228_cov_110.482779	8471	9037	-	hsp20	small heat shock protein sHSP20	plus	STRESS	HEAT	NA	NA	BLASTX	189	189	100.00	98.94	189	CDY80020.1	small heat shock protein sHSP20	NA	NA
NA	NODE_49_length_19982_cov_137.998745	8061	8939	+	blaKPC-3	carbapenem-hydrolyzing class A beta-lactamase KPC-3	core	AMR	AMR	BETA-LACTAM	CARBAPENEM	ALLELEX	293	293	100.00	100.00	293	WP_004152396.1	carbapenem-hydrolyzing class A beta-lactamase KPC-3	NA	NA
NA	NODE_68_length_2735_cov_163.711567	877	2559	+	merA	mercury(II) reductase	plus	STRESS	METAL	MERCURY	MERCURY	BLASTX	561	561	100.00	93.23	561	ACU65296.1	mercury(II) reductase	NA	NA
NA	NODE_6_length_218466_cov_57.578107	93215	95845	-	gyrA_S83F	Klebsiella pneumoniae quinolone resistant GyrA	core	AMR	POINT	QUINOLONE	QUINOLONE	POINTX	877	877	100.00	99.54	877	WP_117036963.1	DNA gyrase subunit A GyrA	NA	NA
NA	NODE_71_length_2036_cov_108.953559	1792	2034	-	merP	mercury resistance system periplasmic binding protein MerP	plus	STRESS	METAL	MERCURY	MERCURY	PARTIAL_CONTIG_ENDX	81	91	89.01	95.06	81	AAC38219.1	mercury resistance system periplasmic binding protein MerP	NA	NA
NA	NODE_80_length_872_cov_350.299878	1	312	-	merT	mercuric transport protein MerT	plus	STRESS	METAL	MERCURY	MERCURY	PARTIAL_CONTIG_ENDX	104	116	89.66	100.00	104	CAA70196.1	mercuric transport protein MerT	NA	NA
NA	NODE_80_length_872_cov_350.299878	384	809	+	merR	mercury resistance transcriptional regulator MerR	plus	STRESS	METAL	MERCURY	MERCURY	BLASTX	142	144	98.61	92.96	142	CAA77320.1	mercury resistance transcriptional regulator MerR	NA	NA
NA	NODE_83_length_786_cov_234.086183	262	495	+	merE	broad-spectrum mercury transporter MerE	plus	STRESS	METAL	MERCURY	MERCURY	BLASTX	78	78	100.00	96.15	78	AAC38236.1	broad-spectrum mercury transporter MerE	NA	NA
