Protein id	Contig id	Start	Stop	Strand	Element symbol	Element name	Scope	Type	Subtype	Class	Subclass	Method	Target length	Reference sequence length	% Coverage of reference	% Identity to reference	Alignment length	Closest reference accession	Closest reference name	HMM accession	HMM description
NA	NODE_130_length_466_cov_0.951338	1	252	-	merR	mercury resistance transcriptional regulator MerR	plus	STRESS	METAL	MERCURY	MERCURY	PARTIAL_CONTIG_ENDX	84	144	58.33	95.24	84	CAA77320.1	mercury resistance transcriptional regulator MerR	NA	NA
NA	NODE_1_length_358063_cov_49.188973	46158	48200	+	parC_S80I	Klebsiella pneumoniae quinolone resistant ParC	core	AMR	POINT	QUINOLONE	QUINOLONE	POINTX	681	689	98.84	99.41	681	WP_101982161.1	DNA topoisomerase IV subunit A ParC	NA	NA
NA	NODE_22_length_99202_cov_49.210193	39569	40468	-	fieF	CDF family cation-efflux transporter FieF	plus	STRESS	METAL	NA	NA	EXACTX	300	300	100.00	100.00	300	BAB89353.1	CDF family cation-efflux transporter FieF	NA	NA
NA	NODE_26_length_89748_cov_44.859499	30693	31865	+	oqxA	multidrug efflux RND transporter periplasmic adaptor subunit OqxA	core	AMR	AMR	PHENICOL/QUINOLONE	PHENICOL/QUINOLONE	EXACTX	391	391	100.00	100.00	391	WP_002914189.1	multidrug efflux RND transporter periplasmic adaptor subunit OqxA	NA	NA
NA	NODE_26_length_89748_cov_44.859499	31892	35041	+	oqxB	multidrug efflux RND transporter permease subunit OqxB	core	AMR	AMR	PHENICOL/QUINOLONE	PHENICOL/QUINOLONE	EXACTX	1050	1050	100.00	100.00	1050	WP_000347934.1	multidrug efflux RND transporter permease subunit OqxB	NA	NA
NA	NODE_27_length_84574_cov_49.175227	14005	14421	+	fosA	FosA5 family fosfomycin resistance glutathione transferase	core	AMR	AMR	FOSFOMYCIN	FOSFOMYCIN	BLASTX	139	139	100.00	98.56	139	WP_004146118.1	FosA5 family fosfomycin resistance glutathione transferase	NA	NA
NA	NODE_2_length_301009_cov_43.323488	117764	120394	+	gyrA_S83I	Klebsiella pneumoniae quinolone resistant GyrA	core	AMR	POINT	QUINOLONE	QUINOLONE	POINTX	877	877	100.00	99.77	877	WP_117036963.1	DNA gyrase subunit A GyrA	NA	NA
NA	NODE_2_length_301009_cov_43.323488	127509	128615	+	ompK36_T136TDT	Klebsiella pneumoniae carbapenem resistant OmpK36	core	AMR	POINT	BETA-LACTAM	CARBAPENEM	POINTX	369	367	100.00	99.46	369	WP_002913005.1	outer membrane porin OmpK36	NA	NA
NA	NODE_31_length_68823_cov_62.223927	19988	20416	-	silE	silver-binding protein SilE	plus	STRESS	METAL	SILVER	SILVER	BLASTX	143	143	100.00	91.61	143	AAD11743.1	silver-binding protein SilE	NA	NA
NA	NODE_31_length_68823_cov_62.223927	20670	22142	-	silS	copper/silver sensor histidine kinase SilS	plus	STRESS	METAL	COPPER/SILVER	COPPER/SILVER	EXACTX	491	491	100.00	100.00	491	SPD96882.1	copper/silver sensor histidine kinase SilS	NA	NA
NA	NODE_31_length_68823_cov_62.223927	22138	22815	-	silR	copper/silver response regulator transcription factor SilR	plus	STRESS	METAL	COPPER/SILVER	COPPER/SILVER	EXACTX	226	226	100.00	100.00	226	SPD96883.1	copper/silver response regulator transcription factor SilR	NA	NA
NA	NODE_31_length_68823_cov_62.223927	23005	24387	+	silC	Cu(+)/Ag(+) efflux RND transporter outer membrane channel SilC	plus	STRESS	METAL	COPPER/SILVER	COPPER/SILVER	EXACTX	461	461	100.00	100.00	461	SPD96884.1	Cu(+)/Ag(+) efflux RND transporter outer membrane channel SilC	NA	NA
NA	NODE_31_length_68823_cov_62.223927	24419	24769	+	silF	Cu(+)/Ag(+) efflux RND transporter periplasmic metallochaperone SilF	plus	STRESS	METAL	COPPER/SILVER	COPPER/SILVER	BLASTX	117	117	100.00	99.15	117	KGL71342.1	Cu(+)/Ag(+) efflux RND transporter periplasmic metallochaperone SilF	NA	NA
NA	NODE_31_length_68823_cov_62.223927	24886	26175	+	silB	Cu(+)/Ag(+) efflux RND transporter periplasmic adaptor subunit SilB	plus	STRESS	METAL	COPPER/SILVER	COPPER/SILVER	BLASTX	430	430	100.00	97.67	430	AAD11748.1	Cu(+)/Ag(+) efflux RND transporter periplasmic adaptor subunit SilB	NA	NA
NA	NODE_31_length_68823_cov_62.223927	26189	29332	+	silA	Cu(+)/Ag(+) efflux RND transporter permease subunit SilA	plus	STRESS	METAL	COPPER/SILVER	COPPER/SILVER	BLASTX	1048	1048	100.00	98.85	1048	AAD11749.1	Cu(+)/Ag(+) efflux RND transporter permease subunit SilA	NA	NA
NA	NODE_31_length_68823_cov_62.223927	29968	32433	+	silP	Ag(+)-translocating P-type ATPase SilP	plus	STRESS	METAL	SILVER	SILVER	BLASTX	822	824	99.64	94.53	823	AAD11750.1	Ag(+)-translocating P-type ATPase SilP	NA	NA
NA	NODE_31_length_68823_cov_62.223927	34417	36231	+	pcoA	multicopper oxidase PcoA	plus	STRESS	METAL	COPPER	COPPER	BLASTX	605	605	100.00	99.83	605	CAA58525.1	multicopper oxidase PcoA	NA	NA
NA	NODE_31_length_68823_cov_62.223927	36240	37127	+	pcoB	copper-binding protein PcoB	plus	STRESS	METAL	COPPER	COPPER	EXACTX	296	296	100.00	100.00	296	CAA58526.1	copper-binding protein PcoB	NA	NA
NA	NODE_31_length_68823_cov_62.223927	37170	37547	+	pcoC	copper resistance system metallochaperone PcoC	plus	STRESS	METAL	COPPER	COPPER	EXACTX	126	126	100.00	100.00	126	CAA58527.1	copper resistance system metallochaperone PcoC	NA	NA
NA	NODE_31_length_68823_cov_62.223927	37555	38481	+	pcoD	copper resistance inner membrane protein PcoD	plus	STRESS	METAL	COPPER	COPPER	BLASTX	309	309	100.00	99.68	309	CAA58528.1	copper resistance inner membrane protein PcoD	NA	NA
NA	NODE_31_length_68823_cov_62.223927	38539	39216	+	pcoR	copper response regulator transcription factor PcoR	plus	STRESS	METAL	COPPER	COPPER	EXACTX	226	226	100.00	100.00	226	CAA58529.1	copper response regulator transcription factor PcoR	NA	NA
NA	NODE_31_length_68823_cov_62.223927	39216	40613	+	pcoS	copper resistance membrane spanning protein PcoS	plus	STRESS	METAL	COPPER	COPPER	BLASTX	466	466	100.00	99.14	466	CAA58530.1	copper resistance membrane spanning protein PcoS	NA	NA
NA	NODE_31_length_68823_cov_62.223927	40833	41264	+	pcoE	copper resistance system metallochaperone PcoE	plus	STRESS	METAL	COPPER	COPPER	BLASTX	144	144	100.00	94.44	144	CAA58532.1	copper resistance system metallochaperone PcoE	NA	NA
NA	NODE_31_length_68823_cov_62.223927	49306	49728	-	arsC	glutaredoxin-dependent arsenate reductase	plus	STRESS	METAL	ARSENIC	ARSENATE	EXACTX	141	141	100.00	100.00	141	BAA24824.1	glutaredoxin-dependent arsenate reductase	NA	NA
NA	NODE_31_length_68823_cov_62.223927	49744	51030	-	arsB	arsenite efflux transporter membrane subunit ArsB	plus	STRESS	METAL	ARSENIC	ARSENITE	EXACTX	429	429	100.00	100.00	429	BAA24823.1	arsenite efflux transporter membrane subunit ArsB	NA	NA
NA	NODE_31_length_68823_cov_62.223927	51081	52829	-	arsA	arsenite efflux transporter ATPase subunit ArsA	plus	STRESS	METAL	ARSENIC	ARSENITE	EXACTX	583	583	100.00	100.00	583	BAA24822.1	arsenite efflux transporter ATPase subunit ArsA	NA	NA
NA	NODE_31_length_68823_cov_62.223927	52850	53209	-	arsD	arsenite efflux transporter metallochaperone ArsD	plus	STRESS	METAL	ARSENIC	ARSENITE	BLASTX	120	120	100.00	91.67	120	AAB09625.1	arsenite efflux transporter metallochaperone ArsD	NA	NA
NA	NODE_31_length_68823_cov_62.223927	53262	53609	-	arsR	As(III)-sensing metalloregulatory transcriptional repressor ArsR	plus	STRESS	METAL	ARSENIC	ARSENIC	EXACTX	116	116	100.00	100.00	116	AET17094.1	As(III)-sensing metalloregulatory transcriptional repressor ArsR	NA	NA
NA	NODE_31_length_68823_cov_62.223927	63064	65850	-	clpK	heat shock survival AAA family ATPase ClpK	plus	STRESS	HEAT	NA	NA	BLASTX	929	949	97.89	99.25	929	ASF80763.1	heat shock survival AAA family ATPase ClpK	NA	NA
NA	NODE_31_length_68823_cov_62.223927	65968	66534	-	hsp20	small heat shock protein sHSP20	plus	STRESS	HEAT	NA	NA	EXACTX	189	189	100.00	100.00	189	CDY80020.1	small heat shock protein sHSP20	NA	NA
NA	NODE_58_length_16328_cov_61.395748	278	934	+	catA1	type A-1 chloramphenicol O-acetyltransferase	core	AMR	AMR	PHENICOL	CHLORAMPHENICOL	EXACTX	219	219	100.00	100.00	219	WP_000412211.1	type A-1 chloramphenicol O-acetyltransferase	NA	NA
NA	NODE_58_length_16328_cov_61.395748	6948	7442	+	dfrA12	trimethoprim-resistant dihydrofolate reductase DfrA12	core	AMR	AMR	TRIMETHOPRIM	TRIMETHOPRIM	EXACTX	165	165	100.00	100.00	165	WP_001083725.1	trimethoprim-resistant dihydrofolate reductase DfrA12	NA	NA
NA	NODE_58_length_16328_cov_61.395748	7853	8641	+	aadA2	ANT(3'')-Ia family aminoglycoside nucleotidyltransferase AadA2	core	AMR	AMR	AMINOGLYCOSIDE	STREPTOMYCIN	EXACTX	263	263	100.00	100.00	263	WP_001206356.1	ANT(3'')-Ia family aminoglycoside nucleotidyltransferase AadA2	NA	NA
NA	NODE_58_length_16328_cov_61.395748	8808	9152	+	qacEdelta1	quaternary ammonium compound efflux SMR transporter QacE delta 1	core	STRESS	BIOCIDE	QUATERNARY AMMONIUM	QUATERNARY AMMONIUM	ALLELEX	115	115	100.00	100.00	115	WP_000679427.1	quaternary ammonium compound efflux SMR transporter QacE delta 1	NA	NA
NA	NODE_58_length_16328_cov_61.395748	9149	9985	+	sul1	sulfonamide-resistant dihydropteroate synthase Sul1	core	AMR	AMR	SULFONAMIDE	SULFONAMIDE	EXACTX	279	279	100.00	100.00	279	WP_000259031.1	sulfonamide-resistant dihydropteroate synthase Sul1	NA	NA
NA	NODE_58_length_16328_cov_61.395748	15302	16204	-	mph(A)	Mph(A) family macrolide 2'-phosphotransferase	core	AMR	AMR	MACROLIDE	AZITHROMYCIN/ERYTHROMYCIN/SPIRAMYCIN/TELITHROMYCIN	EXACTX	301	301	100.00	100.00	301	WP_000219391.1	Mph(A) family macrolide 2'-phosphotransferase	NA	NA
NA	NODE_65_length_10008_cov_1312.327338	1929	2807	-	blaKPC-3	carbapenem-hydrolyzing class A beta-lactamase KPC-3	core	AMR	AMR	BETA-LACTAM	CARBAPENEM	ALLELEX	293	293	100.00	100.00	293	WP_004152396.1	carbapenem-hydrolyzing class A beta-lactamase KPC-3	NA	NA
NA	NODE_84_length_2805_cov_614.988364	346	897	-	aac(6')-Ib	AAC(6')-Ib family aminoglycoside 6'-N-acetyltransferase	core	AMR	AMR	AMINOGLYCOSIDE	AMIKACIN/KANAMYCIN/TOBRAMYCIN	EXACTX	184	184	100.00	100.00	184	WP_063840280.1	AAC(6')-Ib family aminoglycoside 6'-N-acetyltransferase	NA	NA
NA	NODE_8_length_172024_cov_52.513843	90955	92136	+	emrD	multidrug efflux MFS transporter EmrD	plus	AMR	AMR	EFFLUX	EFFLUX	BLASTX	394	394	100.00	99.24	394	ACN65732.1	multidrug efflux MFS transporter EmrD	NA	NA
NA	NODE_9_length_157542_cov_55.283414	149567	150424	+	blaSHV-11	broad-spectrum class A beta-lactamase SHV-11	core	AMR	AMR	BETA-LACTAM	BETA-LACTAM	ALLELEX	286	286	100.00	100.00	286	WP_004176269.1	broad-spectrum class A beta-lactamase SHV-11	NA	NA
