Protein id	Contig id	Start	Stop	Strand	Element symbol	Element name	Scope	Type	Subtype	Class	Subclass	Method	Target length	Reference sequence length	% Coverage of reference	% Identity to reference	Alignment length	Closest reference accession	Closest reference name	HMM accession	HMM description
NA	NODE_14_length_135460_cov_49.842930	41678	43477	-	ybtQ	yersiniabactin ABC transporter ATP-binding/permease protein YbtQ	plus	VIRULENCE	VIRULENCE	NA	NA	EXACTX	600	600	100.00	100.00	600	AAC69584.1	yersiniabactin ABC transporter ATP-binding/permease protein YbtQ	NA	NA
NA	NODE_14_length_135460_cov_49.842930	43467	45266	-	ybtP	yersiniabactin ABC transporter ATP-binding/permease protein YbtP	plus	VIRULENCE	VIRULENCE	NA	NA	BLASTX	600	600	100.00	99.67	600	CAA21388.1	yersiniabactin ABC transporter ATP-binding/permease protein YbtP	NA	NA
NA	NODE_20_length_100770_cov_64.543156	79896	81077	-	emrD	multidrug efflux MFS transporter EmrD	plus	AMR	AMR	EFFLUX	EFFLUX	BLASTX	394	394	100.00	99.49	394	ACN65732.1	multidrug efflux MFS transporter EmrD	NA	NA
NA	NODE_22_length_99169_cov_63.721896	39552	40451	-	fieF	CDF family cation-efflux transporter FieF	plus	STRESS	METAL	NA	NA	EXACTX	300	300	100.00	100.00	300	BAB89353.1	CDF family cation-efflux transporter FieF	NA	NA
NA	NODE_24_length_98580_cov_50.899142	54709	57858	-	oqxB19	multidrug efflux RND transporter permease subunit OqxB19	core	AMR	AMR	PHENICOL/QUINOLONE	PHENICOL/QUINOLONE	ALLELEX	1050	1050	100.00	100.00	1050	WP_004149399.1	multidrug efflux RND transporter permease subunit OqxB19	NA	NA
NA	NODE_24_length_98580_cov_50.899142	57885	59057	-	oqxA	multidrug efflux RND transporter periplasmic adaptor subunit OqxA	core	AMR	AMR	PHENICOL/QUINOLONE	PHENICOL/QUINOLONE	EXACTX	391	391	100.00	100.00	391	WP_002914189.1	multidrug efflux RND transporter periplasmic adaptor subunit OqxA	NA	NA
NA	NODE_2_length_309283_cov_38.217529	185749	186606	-	blaSHV-11	broad-spectrum class A beta-lactamase SHV-11	core	AMR	AMR	BETA-LACTAM	BETA-LACTAM	ALLELEX	286	286	100.00	100.00	286	WP_004176269.1	broad-spectrum class A beta-lactamase SHV-11	NA	NA
NA	NODE_30_length_79197_cov_56.971178	13836	14252	+	fosA	FosA5 family fosfomycin resistance glutathione transferase	core	AMR	AMR	FOSFOMYCIN	FOSFOMYCIN	BLASTX	139	139	100.00	98.56	139	WP_004146118.1	FosA5 family fosfomycin resistance glutathione transferase	NA	NA
NA	NODE_48_length_24754_cov_72.484149	2247	2675	-	silE	silver-binding protein SilE	plus	STRESS	METAL	SILVER	SILVER	BLASTX	143	143	100.00	92.31	143	AAD11743.1	silver-binding protein SilE	NA	NA
NA	NODE_48_length_24754_cov_72.484149	2929	4401	-	silS	copper/silver sensor histidine kinase SilS	plus	STRESS	METAL	COPPER/SILVER	COPPER/SILVER	BLASTX	491	491	100.00	98.78	491	SPD96882.1	copper/silver sensor histidine kinase SilS	NA	NA
NA	NODE_48_length_24754_cov_72.484149	4397	5074	-	silR	copper/silver response regulator transcription factor SilR	plus	STRESS	METAL	COPPER/SILVER	COPPER/SILVER	BLASTX	226	226	100.00	97.35	226	SPD96883.1	copper/silver response regulator transcription factor SilR	NA	NA
NA	NODE_48_length_24754_cov_72.484149	5264	6646	+	silC	Cu(+)/Ag(+) efflux RND transporter outer membrane channel SilC	plus	STRESS	METAL	COPPER/SILVER	COPPER/SILVER	BLASTX	461	461	100.00	98.26	461	SPD96884.1	Cu(+)/Ag(+) efflux RND transporter outer membrane channel SilC	NA	NA
NA	NODE_48_length_24754_cov_72.484149	6678	7028	+	silF	Cu(+)/Ag(+) efflux RND transporter periplasmic metallochaperone SilF	plus	STRESS	METAL	COPPER/SILVER	COPPER/SILVER	BLASTX	117	117	100.00	99.15	117	KGL71342.1	Cu(+)/Ag(+) efflux RND transporter periplasmic metallochaperone SilF	NA	NA
NA	NODE_48_length_24754_cov_72.484149	7145	8434	+	silB	Cu(+)/Ag(+) efflux RND transporter periplasmic adaptor subunit SilB	plus	STRESS	METAL	COPPER/SILVER	COPPER/SILVER	BLASTX	430	430	100.00	98.14	430	AAD11748.1	Cu(+)/Ag(+) efflux RND transporter periplasmic adaptor subunit SilB	NA	NA
NA	NODE_48_length_24754_cov_72.484149	8448	11591	+	silA	Cu(+)/Ag(+) efflux RND transporter permease subunit SilA	plus	STRESS	METAL	COPPER/SILVER	COPPER/SILVER	BLASTX	1048	1048	100.00	99.43	1048	AAD11749.1	Cu(+)/Ag(+) efflux RND transporter permease subunit SilA	NA	NA
NA	NODE_48_length_24754_cov_72.484149	12219	14687	+	silP	Ag(+)-translocating P-type ATPase SilP	plus	STRESS	METAL	SILVER	SILVER	BLASTX	823	824	100.00	98.54	824	AAD11750.1	Ag(+)-translocating P-type ATPase SilP	NA	NA
NA	NODE_48_length_24754_cov_72.484149	16672	18486	+	pcoA	multicopper oxidase PcoA	plus	STRESS	METAL	COPPER	COPPER	BLASTX	605	605	100.00	99.83	605	CAA58525.1	multicopper oxidase PcoA	NA	NA
NA	NODE_48_length_24754_cov_72.484149	18495	19382	+	pcoB	copper-binding protein PcoB	plus	STRESS	METAL	COPPER	COPPER	EXACTX	296	296	100.00	100.00	296	CAA58526.1	copper-binding protein PcoB	NA	NA
NA	NODE_48_length_24754_cov_72.484149	19425	19802	+	pcoC	copper resistance system metallochaperone PcoC	plus	STRESS	METAL	COPPER	COPPER	EXACTX	126	126	100.00	100.00	126	CAA58527.1	copper resistance system metallochaperone PcoC	NA	NA
NA	NODE_48_length_24754_cov_72.484149	19810	20736	+	pcoD	copper resistance inner membrane protein PcoD	plus	STRESS	METAL	COPPER	COPPER	BLASTX	309	309	100.00	99.35	309	CAA58528.1	copper resistance inner membrane protein PcoD	NA	NA
NA	NODE_48_length_24754_cov_72.484149	20794	21471	+	pcoR	copper response regulator transcription factor PcoR	plus	STRESS	METAL	COPPER	COPPER	EXACTX	226	226	100.00	100.00	226	CAA58529.1	copper response regulator transcription factor PcoR	NA	NA
NA	NODE_48_length_24754_cov_72.484149	21471	22868	+	pcoS	copper resistance membrane spanning protein PcoS	plus	STRESS	METAL	COPPER	COPPER	BLASTX	466	466	100.00	99.14	466	CAA58530.1	copper resistance membrane spanning protein PcoS	NA	NA
NA	NODE_48_length_24754_cov_72.484149	23087	23518	+	pcoE	copper resistance system metallochaperone PcoE	plus	STRESS	METAL	COPPER	COPPER	BLASTX	144	144	100.00	93.75	144	CAA58532.1	copper resistance system metallochaperone PcoE	NA	NA
NA	NODE_54_length_13588_cov_81.561295	877	1518	-	qnrB1	quinolone resistance pentapeptide repeat protein QnrB1	core	AMR	AMR	QUINOLONE	QUINOLONE	ALLELEX	214	214	100.00	100.00	214	WP_014386481.1	quinolone resistance pentapeptide repeat protein QnrB1	NA	NA
NA	NODE_54_length_13588_cov_81.561295	9749	10945	-	tet(A)	tetracycline efflux MFS transporter Tet(A)	core	AMR	AMR	TETRACYCLINE	TETRACYCLINE	EXACTX	399	399	100.00	100.00	399	WP_000804064.1	tetracycline efflux MFS transporter Tet(A)	NA	NA
NA	NODE_58_length_11718_cov_78.906285	635	1507	-	blaCTX-M-15	extended-spectrum class A beta-lactamase CTX-M-15	core	AMR	AMR	BETA-LACTAM	CEPHALOSPORIN	ALLELEX	291	291	100.00	100.00	291	WP_000239590.1	extended-spectrum class A beta-lactamase CTX-M-15	NA	NA
NA	NODE_58_length_11718_cov_78.906285	4329	5186	+	blaTEM-1	broad-spectrum class A beta-lactamase TEM-1	core	AMR	AMR	BETA-LACTAM	BETA-LACTAM	ALLELEX	286	286	100.00	100.00	286	WP_000027057.1	broad-spectrum class A beta-lactamase TEM-1	NA	NA
NA	NODE_58_length_11718_cov_78.906285	5913	6746	-	aph(6)-Id	aminoglycoside O-phosphotransferase APH(6)-Id	core	AMR	AMR	AMINOGLYCOSIDE	STREPTOMYCIN	EXACTX	278	278	100.00	100.00	278	WP_000480968.1	aminoglycoside O-phosphotransferase APH(6)-Id	NA	NA
NA	NODE_58_length_11718_cov_78.906285	6749	7549	-	aph(3'')-Ib	aminoglycoside O-phosphotransferase APH(3'')-Ib	core	AMR	AMR	AMINOGLYCOSIDE	STREPTOMYCIN	EXACTX	267	267	100.00	100.00	267	WP_001082319.1	aminoglycoside O-phosphotransferase APH(3'')-Ib	NA	NA
NA	NODE_58_length_11718_cov_78.906285	7613	8425	-	sul2	sulfonamide-resistant dihydropteroate synthase Sul2	core	AMR	AMR	SULFONAMIDE	SULFONAMIDE	EXACTX	271	271	100.00	100.00	271	WP_001043260.1	sulfonamide-resistant dihydropteroate synthase Sul2	NA	NA
NA	NODE_63_length_9416_cov_60.009508	3143	5929	-	clpK	heat shock survival AAA family ATPase ClpK	plus	STRESS	HEAT	NA	NA	BLASTX	929	949	97.89	98.60	929	ASF80763.1	heat shock survival AAA family ATPase ClpK	NA	NA
NA	NODE_63_length_9416_cov_60.009508	6013	6579	-	hsp20	small heat shock protein sHSP20	plus	STRESS	HEAT	NA	NA	BLASTX	189	189	100.00	97.35	189	CDY80020.1	small heat shock protein sHSP20	NA	NA
NA	NODE_69_length_6834_cov_92.806461	4660	5130	-	dfrA14	trimethoprim-resistant dihydrofolate reductase DfrA14	core	AMR	AMR	TRIMETHOPRIM	TRIMETHOPRIM	EXACTX	157	157	100.00	100.00	157	WP_004201280.1	trimethoprim-resistant dihydrofolate reductase DfrA14	NA	NA
NA	NODE_81_length_2709_cov_72.142427	1754	2611	-	aac(3)-IIe	aminoglycoside N-acetyltransferase AAC(3)-IIe	core	AMR	AMR	AMINOGLYCOSIDE	GENTAMICIN	EXACTX	286	286	100.00	100.00	286	WP_000557452.1	aminoglycoside N-acetyltransferase AAC(3)-IIe	NA	NA
NA	NODE_82_length_2295_cov_93.712500	56	496	-	catB3	type B-3 chloramphenicol O-acetyltransferase CatB3	core	AMR	AMR	PHENICOL	CHLORAMPHENICOL	PARTIALX	147	210	70.00	100.00	147	WP_000186237.1	type B-3 chloramphenicol O-acetyltransferase CatB3	NA	NA
NA	NODE_82_length_2295_cov_93.712500	637	1464	-	blaOXA-1	oxacillin-hydrolyzing class D beta-lactamase OXA-1	core	AMR	AMR	BETA-LACTAM	CEPHALOSPORIN	ALLELEX	276	276	100.00	100.00	276	WP_001334766.1	oxacillin-hydrolyzing class D beta-lactamase OXA-1	NA	NA
NA	NODE_82_length_2295_cov_93.712500	1598	2149	-	aac(6')-Ib-cr5	fluoroquinolone-acetylating aminoglycoside 6'-N-acetyltransferase AAC(6')-Ib-cr5	core	AMR	AMR	AMINOGLYCOSIDE/QUINOLONE	AMIKACIN/KANAMYCIN/QUINOLONE/TOBRAMYCIN	ALLELEX	184	184	100.00	100.00	184	WP_063840321.1	fluoroquinolone-acetylating aminoglycoside 6'-N-acetyltransferase AAC(6')-Ib-cr5	NA	NA
