Protein id	Contig id	Start	Stop	Strand	Element symbol	Element name	Scope	Type	Subtype	Class	Subclass	Method	Target length	Reference sequence length	% Coverage of reference	% Identity to reference	Alignment length	Closest reference accession	Closest reference name	HMM accession	HMM description
NA	NODE_13_length_131113_cov_56.706535	72362	73534	+	oqxA3	multidrug efflux RND transporter periplasmic adaptor subunit OqxA3	core	AMR	AMR	PHENICOL/QUINOLONE	PHENICOL/QUINOLONE	ALLELEX	391	391	100.00	100.00	391	WP_004890321.1	multidrug efflux RND transporter periplasmic adaptor subunit OqxA3	NA	NA
NA	NODE_13_length_131113_cov_56.706535	73561	76710	+	oqxB19	multidrug efflux RND transporter permease subunit OqxB19	core	AMR	AMR	PHENICOL/QUINOLONE	PHENICOL/QUINOLONE	ALLELEX	1050	1050	100.00	100.00	1050	WP_004149399.1	multidrug efflux RND transporter permease subunit OqxB19	NA	NA
NA	NODE_19_length_99531_cov_56.819072	39750	40649	-	fieF	CDF family cation-efflux transporter FieF	plus	STRESS	METAL	NA	NA	EXACTX	300	300	100.00	100.00	300	BAB89353.1	CDF family cation-efflux transporter FieF	NA	NA
NA	NODE_1_length_481811_cov_64.305119	400672	401853	+	emrD	multidrug efflux MFS transporter EmrD	plus	AMR	AMR	EFFLUX	EFFLUX	BLASTX	394	394	100.00	99.49	394	ACN65732.1	multidrug efflux MFS transporter EmrD	NA	NA
NA	NODE_23_length_82905_cov_56.953953	51730	52140	-	crcB	fluoride efflux transporter CrcB	plus	STRESS	BIOCIDE	FLUORIDE	FLUORIDE	EXACTX	137	137	100.00	100.00	137	CCN31428.1	fluoride efflux transporter CrcB	NA	NA
NA	NODE_2_length_325647_cov_31.756170	216289	217146	-	blaSHV-33	broad-spectrum class A beta-lactamase SHV-33	core	AMR	AMR	BETA-LACTAM	BETA-LACTAM	ALLELEX	286	286	100.00	100.00	286	WP_023325206.1	broad-spectrum class A beta-lactamase SHV-33	NA	NA
NA	NODE_32_length_49150_cov_35.117568	42072	42638	+	hsp20	small heat shock protein sHSP20	plus	STRESS	HEAT	NA	NA	BLASTX	189	189	100.00	99.47	189	CDY80020.1	small heat shock protein sHSP20	NA	NA
NA	NODE_32_length_49150_cov_35.117568	42765	45551	+	clpK	heat shock survival AAA family ATPase ClpK	plus	STRESS	HEAT	NA	NA	BLASTX	929	949	97.89	99.25	929	ASF80763.1	heat shock survival AAA family ATPase ClpK	NA	NA
NA	NODE_33_length_43782_cov_37.918654	8767	9114	+	arsR	As(III)-sensing metalloregulatory transcriptional repressor ArsR	plus	STRESS	METAL	ARSENIC	ARSENIC	EXACTX	116	116	100.00	100.00	116	AET17094.1	As(III)-sensing metalloregulatory transcriptional repressor ArsR	NA	NA
NA	NODE_33_length_43782_cov_37.918654	9167	9526	+	arsD	arsenite efflux transporter metallochaperone ArsD	plus	STRESS	METAL	ARSENIC	ARSENITE	BLASTX	120	120	100.00	91.67	120	AAB09625.1	arsenite efflux transporter metallochaperone ArsD	NA	NA
NA	NODE_33_length_43782_cov_37.918654	9547	11295	+	arsA	arsenite efflux transporter ATPase subunit ArsA	plus	STRESS	METAL	ARSENIC	ARSENITE	BLASTX	583	583	100.00	99.83	583	BAA24822.1	arsenite efflux transporter ATPase subunit ArsA	NA	NA
NA	NODE_33_length_43782_cov_37.918654	11346	12632	+	arsB	arsenite efflux transporter membrane subunit ArsB	plus	STRESS	METAL	ARSENIC	ARSENITE	EXACTX	429	429	100.00	100.00	429	BAA24823.1	arsenite efflux transporter membrane subunit ArsB	NA	NA
NA	NODE_33_length_43782_cov_37.918654	12648	13070	+	arsC	glutaredoxin-dependent arsenate reductase	plus	STRESS	METAL	ARSENIC	ARSENATE	EXACTX	141	141	100.00	100.00	141	BAA24824.1	glutaredoxin-dependent arsenate reductase	NA	NA
NA	NODE_33_length_43782_cov_37.918654	21112	21543	-	pcoE	copper resistance system metallochaperone PcoE	plus	STRESS	METAL	COPPER	COPPER	BLASTX	144	144	100.00	94.44	144	CAA58532.1	copper resistance system metallochaperone PcoE	NA	NA
NA	NODE_33_length_43782_cov_37.918654	21763	23160	-	pcoS	copper resistance membrane spanning protein PcoS	plus	STRESS	METAL	COPPER	COPPER	BLASTX	466	466	100.00	99.14	466	CAA58530.1	copper resistance membrane spanning protein PcoS	NA	NA
NA	NODE_33_length_43782_cov_37.918654	23160	23837	-	pcoR	copper response regulator transcription factor PcoR	plus	STRESS	METAL	COPPER	COPPER	EXACTX	226	226	100.00	100.00	226	CAA58529.1	copper response regulator transcription factor PcoR	NA	NA
NA	NODE_33_length_43782_cov_37.918654	23895	24821	-	pcoD	copper resistance inner membrane protein PcoD	plus	STRESS	METAL	COPPER	COPPER	BLASTX	309	309	100.00	99.68	309	CAA58528.1	copper resistance inner membrane protein PcoD	NA	NA
NA	NODE_33_length_43782_cov_37.918654	24829	25206	-	pcoC	copper resistance system metallochaperone PcoC	plus	STRESS	METAL	COPPER	COPPER	EXACTX	126	126	100.00	100.00	126	CAA58527.1	copper resistance system metallochaperone PcoC	NA	NA
NA	NODE_33_length_43782_cov_37.918654	25249	26136	-	pcoB	copper-binding protein PcoB	plus	STRESS	METAL	COPPER	COPPER	EXACTX	296	296	100.00	100.00	296	CAA58526.1	copper-binding protein PcoB	NA	NA
NA	NODE_33_length_43782_cov_37.918654	26145	27959	-	pcoA	multicopper oxidase PcoA	plus	STRESS	METAL	COPPER	COPPER	BLASTX	605	605	100.00	99.83	605	CAA58525.1	multicopper oxidase PcoA	NA	NA
NA	NODE_33_length_43782_cov_37.918654	29943	32408	-	silP	Ag(+)-translocating P-type ATPase SilP	plus	STRESS	METAL	SILVER	SILVER	BLASTX	822	824	99.64	94.53	823	AAD11750.1	Ag(+)-translocating P-type ATPase SilP	NA	NA
NA	NODE_33_length_43782_cov_37.918654	33044	36187	-	silA	Cu(+)/Ag(+) efflux RND transporter permease subunit SilA	plus	STRESS	METAL	COPPER/SILVER	COPPER/SILVER	BLASTX	1048	1048	100.00	98.85	1048	AAD11749.1	Cu(+)/Ag(+) efflux RND transporter permease subunit SilA	NA	NA
NA	NODE_33_length_43782_cov_37.918654	36201	37490	-	silB	Cu(+)/Ag(+) efflux RND transporter periplasmic adaptor subunit SilB	plus	STRESS	METAL	COPPER/SILVER	COPPER/SILVER	BLASTX	430	430	100.00	97.91	430	AAD11748.1	Cu(+)/Ag(+) efflux RND transporter periplasmic adaptor subunit SilB	NA	NA
NA	NODE_33_length_43782_cov_37.918654	37607	37957	-	silF	Cu(+)/Ag(+) efflux RND transporter periplasmic metallochaperone SilF	plus	STRESS	METAL	COPPER/SILVER	COPPER/SILVER	BLASTX	117	117	100.00	99.15	117	KGL71342.1	Cu(+)/Ag(+) efflux RND transporter periplasmic metallochaperone SilF	NA	NA
NA	NODE_33_length_43782_cov_37.918654	37989	39371	-	silC	Cu(+)/Ag(+) efflux RND transporter outer membrane channel SilC	plus	STRESS	METAL	COPPER/SILVER	COPPER/SILVER	EXACTX	461	461	100.00	100.00	461	SPD96884.1	Cu(+)/Ag(+) efflux RND transporter outer membrane channel SilC	NA	NA
NA	NODE_33_length_43782_cov_37.918654	39561	40238	+	silR	copper/silver response regulator transcription factor SilR	plus	STRESS	METAL	COPPER/SILVER	COPPER/SILVER	EXACTX	226	226	100.00	100.00	226	SPD96883.1	copper/silver response regulator transcription factor SilR	NA	NA
NA	NODE_33_length_43782_cov_37.918654	40234	41706	+	silS	copper/silver sensor histidine kinase SilS	plus	STRESS	METAL	COPPER/SILVER	COPPER/SILVER	EXACTX	491	491	100.00	100.00	491	SPD96882.1	copper/silver sensor histidine kinase SilS	NA	NA
NA	NODE_33_length_43782_cov_37.918654	41960	42388	+	silE	silver-binding protein SilE	plus	STRESS	METAL	SILVER	SILVER	BLASTX	143	143	100.00	91.61	143	AAD11743.1	silver-binding protein SilE	NA	NA
NA	NODE_5_length_266052_cov_38.529081	66398	68491	+	mchF	microcin H47 export transporter peptidase/ATP-binding subunit MchF	plus	VIRULENCE	VIRULENCE	NA	NA	EXACTX	698	698	100.00	100.00	698	AAL08400.1	microcin H47 export transporter peptidase/ATP-binding subunit MchF	NA	NA
NA	NODE_7_length_254320_cov_54.445162	15558	15974	+	fosA	FosA5 family fosfomycin resistance glutathione transferase	core	AMR	AMR	FOSFOMYCIN	FOSFOMYCIN	EXACTX	139	139	100.00	100.00	139	WP_004146118.1	FosA5 family fosfomycin resistance glutathione transferase	NA	NA
