Protein id	Contig id	Start	Stop	Strand	Element symbol	Element name	Scope	Type	Subtype	Class	Subclass	Method	Target length	Reference sequence length	% Coverage of reference	% Identity to reference	Alignment length	Closest reference accession	Closest reference name	HMM accession	HMM description
NA	NODE_10_length_169201_cov_23.493739	86418	87275	+	blaSHV-1	broad-spectrum class A beta-lactamase SHV-1	core	AMR	AMR	BETA-LACTAM	BETA-LACTAM	ALLELEX	286	286	100.00	100.00	286	WP_001620095.1	broad-spectrum class A beta-lactamase SHV-1	NA	NA
NA	NODE_18_length_99527_cov_29.288664	58897	59796	+	fieF	CDF family cation-efflux transporter FieF	plus	STRESS	METAL	NA	NA	EXACTX	300	300	100.00	100.00	300	BAB89353.1	CDF family cation-efflux transporter FieF	NA	NA
NA	NODE_1_length_355610_cov_27.914008	79897	81078	-	emrD	multidrug efflux MFS transporter EmrD	plus	AMR	AMR	EFFLUX	EFFLUX	BLASTX	394	394	100.00	98.98	394	ACN65732.1	multidrug efflux MFS transporter EmrD	NA	NA
NA	NODE_22_length_86629_cov_41.294107	58091	58948	-	blaTEM-1	broad-spectrum class A beta-lactamase TEM-1	core	AMR	AMR	BETA-LACTAM	BETA-LACTAM	ALLELEX	286	286	100.00	100.00	286	WP_000027057.1	broad-spectrum class A beta-lactamase TEM-1	NA	NA
NA	NODE_22_length_86629_cov_41.294107	61770	62642	+	blaCTX-M-15	extended-spectrum class A beta-lactamase CTX-M-15	core	AMR	AMR	BETA-LACTAM	CEPHALOSPORIN	ALLELEX	291	291	100.00	100.00	291	WP_000239590.1	extended-spectrum class A beta-lactamase CTX-M-15	NA	NA
NA	NODE_25_length_79262_cov_27.438282	13924	14340	+	fosA	FosA5 family fosfomycin resistance glutathione transferase	core	AMR	AMR	FOSFOMYCIN	FOSFOMYCIN	BLASTX	139	139	100.00	99.28	139	WP_004146118.1	FosA5 family fosfomycin resistance glutathione transferase	NA	NA
NA	NODE_27_length_67483_cov_26.362609	32444	35593	-	oqxB20	multidrug efflux RND transporter permease subunit OqxB20	core	AMR	AMR	PHENICOL/QUINOLONE	PHENICOL/QUINOLONE	ALLELEX	1050	1050	100.00	100.00	1050	WP_021312368.1	multidrug efflux RND transporter permease subunit OqxB20	NA	NA
NA	NODE_27_length_67483_cov_26.362609	35620	36792	-	oqxA	multidrug efflux RND transporter periplasmic adaptor subunit OqxA	core	AMR	AMR	PHENICOL/QUINOLONE	PHENICOL/QUINOLONE	EXACTX	391	391	100.00	100.00	391	WP_002914189.1	multidrug efflux RND transporter periplasmic adaptor subunit OqxA	NA	NA
