Protein id	Contig id	Start	Stop	Strand	Element symbol	Element name	Scope	Type	Subtype	Class	Subclass	Method	Target length	Reference sequence length	% Coverage of reference	% Identity to reference	Alignment length	Closest reference accession	Closest reference name	HMM accession	HMM description
NA	NODE_100_length_2756_cov_30.907071	1718	2359	-	qnrB17	quinolone resistance pentapeptide repeat protein QnrB17	core	AMR	AMR	QUINOLONE	QUINOLONE	ALLELEX	214	214	100.00	100.00	214	WP_048216435.1	quinolone resistance pentapeptide repeat protein QnrB17	NA	NA
NA	NODE_117_length_985_cov_118.401075	122	958	+	sul1	sulfonamide-resistant dihydropteroate synthase Sul1	core	AMR	AMR	SULFONAMIDE	SULFONAMIDE	EXACTX	279	279	100.00	100.00	279	WP_000259031.1	sulfonamide-resistant dihydropteroate synthase Sul1	NA	NA
NA	NODE_120_length_884_cov_72.398070	4	861	-	blaSHV-12	extended-spectrum class A beta-lactamase SHV-12	core	AMR	AMR	BETA-LACTAM	CEFIDEROCOL/CEPHALOSPORIN	ALLELEX	286	286	100.00	100.00	286	WP_002904004.1	extended-spectrum class A beta-lactamase SHV-12	NA	NA
NA	NODE_17_length_101773_cov_21.041015	20364	21545	+	emrD	multidrug efflux MFS transporter EmrD	plus	AMR	AMR	EFFLUX	EFFLUX	BLASTX	394	394	100.00	99.49	394	ACN65732.1	multidrug efflux MFS transporter EmrD	NA	NA
NA	NODE_20_length_96711_cov_19.516367	42181	43353	+	oqxA	multidrug efflux RND transporter periplasmic adaptor subunit OqxA	core	AMR	AMR	PHENICOL/QUINOLONE	PHENICOL/QUINOLONE	EXACTX	391	391	100.00	100.00	391	WP_002914189.1	multidrug efflux RND transporter periplasmic adaptor subunit OqxA	NA	NA
NA	NODE_20_length_96711_cov_19.516367	43380	46529	+	oqxB25	multidrug efflux RND transporter permease subunit OqxB25	core	AMR	AMR	PHENICOL/QUINOLONE	PHENICOL/QUINOLONE	ALLELEX	1050	1050	100.00	100.00	1050	WP_016947602.1	multidrug efflux RND transporter permease subunit OqxB25	NA	NA
NA	NODE_22_length_93357_cov_21.002722	38755	39654	-	fieF	CDF family cation-efflux transporter FieF	plus	STRESS	METAL	NA	NA	EXACTX	300	300	100.00	100.00	300	BAB89353.1	CDF family cation-efflux transporter FieF	NA	NA
NA	NODE_45_length_37662_cov_9.740766	7261	8385	-	ncrC	Ni(II)/Co(II) efflux transporter permease subunit NcrC	plus	STRESS	METAL	COPPER/NICKEL	COPPER/NICKEL	BLASTX	375	376	99.73	96.53	375	ADF64798.1	Ni(II)/Co(II) efflux transporter permease subunit NcrC	NA	NA
NA	NODE_45_length_37662_cov_9.740766	8776	10071	-	ncrA	Metal Resistance	plus	STRESS	METAL	NICKEL	NICKEL	BLASTX	432	432	100.00	95.37	432	ABF61434.1	Metal Resistance	NA	NA
NA	NODE_64_length_14714_cov_20.208063	13934	14350	+	fosA	FosA5 family fosfomycin resistance glutathione transferase	core	AMR	AMR	FOSFOMYCIN	FOSFOMYCIN	BLASTX	139	139	100.00	98.56	139	WP_004146118.1	FosA5 family fosfomycin resistance glutathione transferase	NA	NA
NA	NODE_66_length_14459_cov_9.251180	855	2252	-	pcoS	copper resistance membrane spanning protein PcoS	plus	STRESS	METAL	COPPER	COPPER	BLASTX	466	466	100.00	99.36	466	CAA58530.1	copper resistance membrane spanning protein PcoS	NA	NA
NA	NODE_66_length_14459_cov_9.251180	2252	2929	-	pcoR	copper response regulator transcription factor PcoR	plus	STRESS	METAL	COPPER	COPPER	EXACTX	226	226	100.00	100.00	226	CAA58529.1	copper response regulator transcription factor PcoR	NA	NA
NA	NODE_66_length_14459_cov_9.251180	2987	3913	-	pcoD	copper resistance inner membrane protein PcoD	plus	STRESS	METAL	COPPER	COPPER	BLASTX	309	309	100.00	99.68	309	CAA58528.1	copper resistance inner membrane protein PcoD	NA	NA
NA	NODE_66_length_14459_cov_9.251180	3921	4298	-	pcoC	copper resistance system metallochaperone PcoC	plus	STRESS	METAL	COPPER	COPPER	EXACTX	126	126	100.00	100.00	126	CAA58527.1	copper resistance system metallochaperone PcoC	NA	NA
NA	NODE_66_length_14459_cov_9.251180	4341	5228	-	pcoB	copper-binding protein PcoB	plus	STRESS	METAL	COPPER	COPPER	BLASTX	296	296	100.00	99.66	296	CAA58526.1	copper-binding protein PcoB	NA	NA
NA	NODE_66_length_14459_cov_9.251180	5237	7051	-	pcoA	multicopper oxidase PcoA	plus	STRESS	METAL	COPPER	COPPER	EXACTX	605	605	100.00	100.00	605	CAA58525.1	multicopper oxidase PcoA	NA	NA
NA	NODE_66_length_14459_cov_9.251180	9035	11500	-	silP	Ag(+)-translocating P-type ATPase SilP	plus	STRESS	METAL	SILVER	SILVER	BLASTX	822	824	99.64	94.53	823	AAD11750.1	Ag(+)-translocating P-type ATPase SilP	NA	NA
NA	NODE_66_length_14459_cov_9.251180	12136	14457	-	silA	Cu(+)/Ag(+) efflux RND transporter permease subunit SilA	plus	STRESS	METAL	COPPER/SILVER	COPPER/SILVER	PARTIAL_CONTIG_ENDX	774	1048	73.85	98.58	774	AAD11749.1	Cu(+)/Ag(+) efflux RND transporter permease subunit SilA	NA	NA
NA	NODE_67_length_14388_cov_8.445057	181	603	-	arsC	glutaredoxin-dependent arsenate reductase	plus	STRESS	METAL	ARSENIC	ARSENATE	BLASTX	141	141	100.00	92.91	141	AAA21096.1	glutaredoxin-dependent arsenate reductase	NA	NA
NA	NODE_67_length_14388_cov_8.445057	4133	4483	-	arsR	As(III)-sensing metalloregulatory transcriptional repressor ArsR	plus	STRESS	METAL	ARSENIC	ARSENIC	BLASTX	117	117	100.00	90.60	117	AAB09624.1	As(III)-sensing metalloregulatory transcriptional repressor ArsR	NA	NA
NA	NODE_79_length_9518_cov_60.970728	8560	9054	+	dfrA22	trimethoprim-resistant dihydrofolate reductase DfrA22	core	AMR	AMR	TRIMETHOPRIM	TRIMETHOPRIM	EXACTX	165	165	100.00	100.00	165	WP_032667553.1	trimethoprim-resistant dihydrofolate reductase DfrA22	NA	NA
NA	NODE_79_length_9518_cov_60.970728	9244	9516	+	qacE	quaternary ammonium compound efflux SMR transporter QacE	core	STRESS	BIOCIDE	QUATERNARY AMMONIUM	QUATERNARY AMMONIUM	PARTIAL_CONTIG_ENDX	91	115	79.13	100.00	91	WP_000679427.1	quaternary ammonium compound efflux SMR transporter QacE delta 1	NA	NA
NA	NODE_80_length_9192_cov_8.438656	2006	2434	-	silE	silver-binding protein SilE	plus	STRESS	METAL	SILVER	SILVER	BLASTX	143	143	100.00	97.20	143	AAD11743.1	silver-binding protein SilE	NA	NA
NA	NODE_80_length_9192_cov_8.438656	2688	4160	-	silS	copper/silver sensor histidine kinase SilS	plus	STRESS	METAL	COPPER/SILVER	COPPER/SILVER	BLASTX	491	491	100.00	98.98	491	SPD96882.1	copper/silver sensor histidine kinase SilS	NA	NA
NA	NODE_80_length_9192_cov_8.438656	4156	4833	-	silR	copper/silver response regulator transcription factor SilR	plus	STRESS	METAL	COPPER/SILVER	COPPER/SILVER	BLASTX	226	226	100.00	98.23	226	SPD96883.1	copper/silver response regulator transcription factor SilR	NA	NA
NA	NODE_80_length_9192_cov_8.438656	5023	6405	+	silC	Cu(+)/Ag(+) efflux RND transporter outer membrane channel SilC	plus	STRESS	METAL	COPPER/SILVER	COPPER/SILVER	BLASTX	461	461	100.00	98.05	461	SPD96884.1	Cu(+)/Ag(+) efflux RND transporter outer membrane channel SilC	NA	NA
NA	NODE_80_length_9192_cov_8.438656	6437	6787	+	silF	Cu(+)/Ag(+) efflux RND transporter periplasmic metallochaperone SilF	plus	STRESS	METAL	COPPER/SILVER	COPPER/SILVER	BLASTX	117	117	100.00	99.15	117	KGL71342.1	Cu(+)/Ag(+) efflux RND transporter periplasmic metallochaperone SilF	NA	NA
NA	NODE_80_length_9192_cov_8.438656	6904	8193	+	silB	Cu(+)/Ag(+) efflux RND transporter periplasmic adaptor subunit SilB	plus	STRESS	METAL	COPPER/SILVER	COPPER/SILVER	BLASTX	430	430	100.00	97.91	430	AAD11748.1	Cu(+)/Ag(+) efflux RND transporter periplasmic adaptor subunit SilB	NA	NA
NA	NODE_96_length_3146_cov_9.155290	1098	1673	-	hsp20	small heat shock protein sHSP20	plus	STRESS	HEAT	NA	NA	BLASTX	192	189	100.00	98.44	192	CDY80020.1	small heat shock protein sHSP20	NA	NA
NA	NODE_97_length_3086_cov_8.042890	209	865	+	catA1	type A-1 chloramphenicol O-acetyltransferase	core	AMR	AMR	PHENICOL	CHLORAMPHENICOL	EXACTX	219	219	100.00	100.00	219	WP_011152976.1	type A-1 chloramphenicol O-acetyltransferase	NA	NA
