Protein id	Contig id	Start	Stop	Strand	Element symbol	Element name	Scope	Type	Subtype	Class	Subclass	Method	Target length	Reference sequence length	% Coverage of reference	% Identity to reference	Alignment length	Closest reference accession	Closest reference name	HMM accession	HMM description
NA	NODE_102_length_3416_cov_136.945254	2486	3343	-	blaSHV-31	extended-spectrum class A beta-lactamase SHV-31	core	AMR	AMR	BETA-LACTAM	CEPHALOSPORIN	ALLELEX	286	286	100.00	100.00	286	WP_063864674.1	extended-spectrum class A beta-lactamase SHV-31	NA	NA
NA	NODE_122_length_1149_cov_16.987203	143	955	+	aph(3')-Ia	aminoglycoside O-phosphotransferase APH(3')-Ia	core	AMR	AMR	AMINOGLYCOSIDE	KANAMYCIN	EXACTX	271	271	100.00	100.00	271	WP_000018329.1	aminoglycoside O-phosphotransferase APH(3')-Ia	NA	NA
NA	NODE_17_length_101172_cov_17.477308	20103	21284	+	emrD	multidrug efflux MFS transporter EmrD	plus	AMR	AMR	EFFLUX	EFFLUX	BLASTX	394	394	100.00	99.24	394	ACN65732.1	multidrug efflux MFS transporter EmrD	NA	NA
NA	NODE_1_length_315991_cov_18.287251	64095	66137	-	parC_S80I	Klebsiella pneumoniae quinolone resistant ParC	core	AMR	POINT	QUINOLONE	QUINOLONE	POINTX	681	689	98.84	99.41	681	WP_101982161.1	DNA topoisomerase IV subunit A ParC	NA	NA
NA	NODE_21_length_89443_cov_16.974728	30693	31865	+	oqxA	multidrug efflux RND transporter periplasmic adaptor subunit OqxA	core	AMR	AMR	PHENICOL/QUINOLONE	PHENICOL/QUINOLONE	EXACTX	391	391	100.00	100.00	391	WP_002914189.1	multidrug efflux RND transporter periplasmic adaptor subunit OqxA	NA	NA
NA	NODE_21_length_89443_cov_16.974728	31892	35041	+	oqxB	multidrug efflux RND transporter permease subunit OqxB	core	AMR	AMR	PHENICOL/QUINOLONE	PHENICOL/QUINOLONE	EXACTX	1050	1050	100.00	100.00	1050	WP_000347934.1	multidrug efflux RND transporter permease subunit OqxB	NA	NA
NA	NODE_25_length_75034_cov_17.538337	15213	16112	-	fieF	CDF family cation-efflux transporter FieF	plus	STRESS	METAL	NA	NA	EXACTX	300	300	100.00	100.00	300	BAB89353.1	CDF family cation-efflux transporter FieF	NA	NA
NA	NODE_29_length_63895_cov_18.861732	4676	9040	+	clbN	colibactin non-ribosomal peptide synthetase ClbN	plus	VIRULENCE	VIRULENCE	NA	NA	EXACTX	1455	1455	100.00	100.00	1455	AMH08480.1	colibactin non-ribosomal peptide synthetase ClbN	NA	NA
NA	NODE_29_length_63895_cov_18.861732	57183	58982	+	ybtP	yersiniabactin ABC transporter ATP-binding/permease protein YbtP	plus	VIRULENCE	VIRULENCE	NA	NA	BLASTX	600	600	100.00	99.67	600	CAA21388.1	yersiniabactin ABC transporter ATP-binding/permease protein YbtP	NA	NA
NA	NODE_29_length_63895_cov_18.861732	58972	60771	+	ybtQ	yersiniabactin ABC transporter ATP-binding/permease protein YbtQ	plus	VIRULENCE	VIRULENCE	NA	NA	BLASTX	600	600	100.00	99.67	600	AAC69584.1	yersiniabactin ABC transporter ATP-binding/permease protein YbtQ	NA	NA
NA	NODE_48_length_34795_cov_17.275504	259	606	+	arsR	As(III)-sensing metalloregulatory transcriptional repressor ArsR	plus	STRESS	METAL	ARSENIC	ARSENIC	EXACTX	116	116	100.00	100.00	116	AET17094.1	As(III)-sensing metalloregulatory transcriptional repressor ArsR	NA	NA
NA	NODE_48_length_34795_cov_17.275504	659	1018	+	arsD	arsenite efflux transporter metallochaperone ArsD	plus	STRESS	METAL	ARSENIC	ARSENITE	BLASTX	120	120	100.00	91.67	120	AAB09625.1	arsenite efflux transporter metallochaperone ArsD	NA	NA
NA	NODE_48_length_34795_cov_17.275504	1039	2787	+	arsA	arsenite efflux transporter ATPase subunit ArsA	plus	STRESS	METAL	ARSENIC	ARSENITE	EXACTX	583	583	100.00	100.00	583	BAA24822.1	arsenite efflux transporter ATPase subunit ArsA	NA	NA
NA	NODE_48_length_34795_cov_17.275504	2838	4124	+	arsB	arsenite efflux transporter membrane subunit ArsB	plus	STRESS	METAL	ARSENIC	ARSENITE	EXACTX	429	429	100.00	100.00	429	BAA24823.1	arsenite efflux transporter membrane subunit ArsB	NA	NA
NA	NODE_48_length_34795_cov_17.275504	4140	4562	+	arsC	glutaredoxin-dependent arsenate reductase	plus	STRESS	METAL	ARSENIC	ARSENATE	EXACTX	141	141	100.00	100.00	141	BAA24824.1	glutaredoxin-dependent arsenate reductase	NA	NA
NA	NODE_48_length_34795_cov_17.275504	12604	13035	-	pcoE	copper resistance system metallochaperone PcoE	plus	STRESS	METAL	COPPER	COPPER	BLASTX	144	144	100.00	94.44	144	CAA58532.1	copper resistance system metallochaperone PcoE	NA	NA
NA	NODE_48_length_34795_cov_17.275504	13255	14652	-	pcoS	copper resistance membrane spanning protein PcoS	plus	STRESS	METAL	COPPER	COPPER	BLASTX	466	466	100.00	99.14	466	CAA58530.1	copper resistance membrane spanning protein PcoS	NA	NA
NA	NODE_48_length_34795_cov_17.275504	14652	15329	-	pcoR	copper response regulator transcription factor PcoR	plus	STRESS	METAL	COPPER	COPPER	EXACTX	226	226	100.00	100.00	226	CAA58529.1	copper response regulator transcription factor PcoR	NA	NA
NA	NODE_48_length_34795_cov_17.275504	15387	16313	-	pcoD	copper resistance inner membrane protein PcoD	plus	STRESS	METAL	COPPER	COPPER	BLASTX	309	309	100.00	99.68	309	CAA58528.1	copper resistance inner membrane protein PcoD	NA	NA
NA	NODE_48_length_34795_cov_17.275504	16321	16698	-	pcoC	copper resistance system metallochaperone PcoC	plus	STRESS	METAL	COPPER	COPPER	EXACTX	126	126	100.00	100.00	126	CAA58527.1	copper resistance system metallochaperone PcoC	NA	NA
NA	NODE_48_length_34795_cov_17.275504	16741	17628	-	pcoB	copper-binding protein PcoB	plus	STRESS	METAL	COPPER	COPPER	EXACTX	296	296	100.00	100.00	296	CAA58526.1	copper-binding protein PcoB	NA	NA
NA	NODE_48_length_34795_cov_17.275504	17637	19451	-	pcoA	multicopper oxidase PcoA	plus	STRESS	METAL	COPPER	COPPER	BLASTX	605	605	100.00	99.83	605	CAA58525.1	multicopper oxidase PcoA	NA	NA
NA	NODE_48_length_34795_cov_17.275504	21435	23900	-	silP	Ag(+)-translocating P-type ATPase SilP	plus	STRESS	METAL	SILVER	SILVER	BLASTX	822	824	99.64	94.53	823	AAD11750.1	Ag(+)-translocating P-type ATPase SilP	NA	NA
NA	NODE_48_length_34795_cov_17.275504	24536	27679	-	silA	Cu(+)/Ag(+) efflux RND transporter permease subunit SilA	plus	STRESS	METAL	COPPER/SILVER	COPPER/SILVER	BLASTX	1048	1048	100.00	98.85	1048	AAD11749.1	Cu(+)/Ag(+) efflux RND transporter permease subunit SilA	NA	NA
NA	NODE_48_length_34795_cov_17.275504	27693	28982	-	silB	Cu(+)/Ag(+) efflux RND transporter periplasmic adaptor subunit SilB	plus	STRESS	METAL	COPPER/SILVER	COPPER/SILVER	BLASTX	430	430	100.00	97.67	430	AAD11748.1	Cu(+)/Ag(+) efflux RND transporter periplasmic adaptor subunit SilB	NA	NA
NA	NODE_48_length_34795_cov_17.275504	29099	29449	-	silF	Cu(+)/Ag(+) efflux RND transporter periplasmic metallochaperone SilF	plus	STRESS	METAL	COPPER/SILVER	COPPER/SILVER	BLASTX	117	117	100.00	99.15	117	KGL71342.1	Cu(+)/Ag(+) efflux RND transporter periplasmic metallochaperone SilF	NA	NA
NA	NODE_48_length_34795_cov_17.275504	29481	30863	-	silC	Cu(+)/Ag(+) efflux RND transporter outer membrane channel SilC	plus	STRESS	METAL	COPPER/SILVER	COPPER/SILVER	EXACTX	461	461	100.00	100.00	461	SPD96884.1	Cu(+)/Ag(+) efflux RND transporter outer membrane channel SilC	NA	NA
NA	NODE_48_length_34795_cov_17.275504	31053	31730	+	silR	copper/silver response regulator transcription factor SilR	plus	STRESS	METAL	COPPER/SILVER	COPPER/SILVER	EXACTX	226	226	100.00	100.00	226	SPD96883.1	copper/silver response regulator transcription factor SilR	NA	NA
NA	NODE_48_length_34795_cov_17.275504	31726	33198	+	silS	copper/silver sensor histidine kinase SilS	plus	STRESS	METAL	COPPER/SILVER	COPPER/SILVER	EXACTX	491	491	100.00	100.00	491	SPD96882.1	copper/silver sensor histidine kinase SilS	NA	NA
NA	NODE_48_length_34795_cov_17.275504	33452	33880	+	silE	silver-binding protein SilE	plus	STRESS	METAL	SILVER	SILVER	BLASTX	143	143	100.00	91.61	143	AAD11743.1	silver-binding protein SilE	NA	NA
NA	NODE_52_length_30045_cov_16.276926	19770	29387	-	clbB	colibactin hybrid non-ribosomal peptide synthetase/type I polyketide synthase ClbB	plus	VIRULENCE	VIRULENCE	NA	NA	EXACTX	3206	3206	100.00	100.00	3206	AMQ58400.1	colibactin hybrid non-ribosomal peptide synthetase/type I polyketide synthase ClbB	NA	NA
NA	NODE_5_length_234171_cov_17.012549	116437	119067	-	gyrA_S83I	Klebsiella pneumoniae quinolone resistant GyrA	core	AMR	POINT	QUINOLONE	QUINOLONE	POINTX	877	877	100.00	99.77	877	WP_117036963.1	DNA gyrase subunit A GyrA	NA	NA
NA	NODE_76_length_14836_cov_17.515256	5456	5950	+	dfrA12	trimethoprim-resistant dihydrofolate reductase DfrA12	core	AMR	AMR	TRIMETHOPRIM	TRIMETHOPRIM	EXACTX	165	165	100.00	100.00	165	WP_001083725.1	trimethoprim-resistant dihydrofolate reductase DfrA12	NA	NA
NA	NODE_76_length_14836_cov_17.515256	6361	7149	+	aadA2	ANT(3'')-Ia family aminoglycoside nucleotidyltransferase AadA2	core	AMR	AMR	AMINOGLYCOSIDE	STREPTOMYCIN	EXACTX	263	263	100.00	100.00	263	WP_001206356.1	ANT(3'')-Ia family aminoglycoside nucleotidyltransferase AadA2	NA	NA
NA	NODE_76_length_14836_cov_17.515256	7316	7660	+	qacEdelta1	quaternary ammonium compound efflux SMR transporter QacE delta 1	core	STRESS	BIOCIDE	QUATERNARY AMMONIUM	QUATERNARY AMMONIUM	ALLELEX	115	115	100.00	100.00	115	WP_000679427.1	quaternary ammonium compound efflux SMR transporter QacE delta 1	NA	NA
NA	NODE_76_length_14836_cov_17.515256	7657	8493	+	sul1	sulfonamide-resistant dihydropteroate synthase Sul1	core	AMR	AMR	SULFONAMIDE	SULFONAMIDE	BLASTX	279	279	100.00	99.64	279	WP_000259031.1	sulfonamide-resistant dihydropteroate synthase Sul1	NA	NA
NA	NODE_76_length_14836_cov_17.515256	13810	14712	-	mph(A)	Mph(A) family macrolide 2'-phosphotransferase	core	AMR	AMR	MACROLIDE	AZITHROMYCIN/ERYTHROMYCIN/SPIRAMYCIN/TELITHROMYCIN	EXACTX	301	301	100.00	100.00	301	WP_000219391.1	Mph(A) family macrolide 2'-phosphotransferase	NA	NA
NA	NODE_77_length_14745_cov_17.225936	365	781	-	fosA	FosA5 family fosfomycin resistance glutathione transferase	core	AMR	AMR	FOSFOMYCIN	FOSFOMYCIN	BLASTX	139	139	100.00	98.56	139	WP_004146118.1	FosA5 family fosfomycin resistance glutathione transferase	NA	NA
NA	NODE_78_length_13988_cov_17.736094	1302	1868	+	hsp20	small heat shock protein sHSP20	plus	STRESS	HEAT	NA	NA	EXACTX	189	189	100.00	100.00	189	CDY80020.1	small heat shock protein sHSP20	NA	NA
NA	NODE_78_length_13988_cov_17.736094	1986	4772	+	clpK	heat shock survival AAA family ATPase ClpK	plus	STRESS	HEAT	NA	NA	BLASTX	929	949	97.89	99.25	929	ASF80763.1	heat shock survival AAA family ATPase ClpK	NA	NA
NA	NODE_90_length_6845_cov_122.834757	279	935	+	catA1	type A-1 chloramphenicol O-acetyltransferase	core	AMR	AMR	PHENICOL	CHLORAMPHENICOL	EXACTX	219	219	100.00	100.00	219	WP_000412211.1	type A-1 chloramphenicol O-acetyltransferase	NA	NA
NA	NODE_90_length_6845_cov_122.834757	5865	6416	+	aac(6')-Ib	AAC(6')-Ib family aminoglycoside 6'-N-acetyltransferase	core	AMR	AMR	AMINOGLYCOSIDE	AMIKACIN/KANAMYCIN/TOBRAMYCIN	EXACTX	184	184	100.00	100.00	184	WP_063840280.1	AAC(6')-Ib family aminoglycoside 6'-N-acetyltransferase	NA	NA
